,Date,AppID,AppName,Country,Author,Rating,Review,Title Review,Detected Language,content,issue,syn,issue_vio_id,sentiment,Age,Disability,Domain_Specific,Emotional,Gender,Language,Location,Privacy,Socio_economic_Status
2,8/14/20 3:00,nz.govt.health.covidtracer,NZ COVID Tracer,en,margaret roud,1,All I get is waiting for download it gets no further than that.Waist of battery and time..at least my google location keeps track of where I've been and at what time..,  All I get is waiting for download it gets no further than that.Waist of battery and time..at least my google location keeps track of where I've been and at what time.. ,en,  All I get is waiting for download it gets no further than that Waist of battery and time  at least my google location keeps track of where I ve been and at what time   ,"Domain_Specific, Privacy","locat, track, locat",0.230769231,Negative,0,0,1,0,0,0,0,1,0
3,8/14/20 2:52,nz.govt.health.covidtracer,NZ COVID Tracer,en,Rory Cobb,5,Seems to be humming aolng in the latest version. NZ is on the verge of being the first country in the world to make this form of contact tracing work so do your bit and download and use it.,  Seems to be humming aolng in the latest version. NZ is on the verge of being the first country in the world to make this form of contact tracing work so do your bit and download and use it. ,en,  Seems to be humming aolng in the latest version  NZ is on the verge of being the first country in the world to make this form of contact tracing work so do your bit and download and use it  ,"Language, Location","countri, countri",0.111111111,Neutral,0,0,0,0,0,1,1,0,0
11,8/14/20 1:57,nz.govt.health.covidtracer,NZ COVID Tracer,en,M G,4,"To speed up data collection at testing facilities, why not adding a QR code in 'my profile' section of the app with personal details. So the staff person on site simply need to scan the code and verify that no info are missing. This will minimise time staff and community people are at potential exposure as well as touching papers/pen",  To speed up data collection at testing facilities  why not adding a QR code in 'my profile' section of the app with personal details. So the staff person on site simply need to scan the code and verify that no info are missing. This will minimise time staff and community people are at potential exposure as well as touching papers/pen ,en,  To speed up data collection at testing facilities  why not adding a QR code in  my profile  section of the app with personal details  So the staff person on site simply need to scan the code and verify that no info are missing  This will minimise time staff and community people are at potential exposure as well as touching papers pen ,"Domain_Specific, Privacy","data, section, staff, paper, profil",0.142857143,Negative,0,0,1,0,0,0,0,1,0
18,8/14/20 1:22,nz.govt.health.covidtracer,NZ COVID Tracer,en,kiwirail_ spotter,5,Very useful app to keep track where I've been. Easy to make an account with no problems with detailed instructions which was great. Thanks,  Very useful app to keep track where I've been. Easy to make an account with no problems with detailed instructions which was great. Thanks ,en,  Very useful app to keep track where I ve been  Easy to make an account with no problems with detailed instructions which was great  Thanks ,"Domain_Specific, Privacy","track, account",0.153846154,Positive,0,0,1,0,0,0,0,1,0
20,8/14/20 1:21,nz.govt.health.covidtracer,NZ COVID Tracer,en,Rebecca Barlow,1,The code emailed to me to validate my account doesn't work when i enter it. I've repeatedly asked for a re-send code and it never works until I'm locked out. I want to do the right thing but the app doesn't make it easy,  The code emailed to me to validate my account doesn't work when i enter it. I've repeatedly asked for a re-send code and it never works until I'm locked out. I want to do the right thing but the app doesn't make it easy ,en,  The code emailed to me to validate my account doesn t work when i enter it  I ve repeatedly asked for a re send code and it never works until I m locked out  I want to do the right thing but the app doesn t make it easy ,Domain_Specific,"enter, account",0.105263158,Positive,0,0,1,0,0,0,0,0,0
25,8/14/20 1:05,nz.govt.health.covidtracer,NZ COVID Tracer,en,Ravi Bharathan,4,"Easy to download, register and use. Saves me having to manually enter my details in a register in places like the library.",  Easy to download  register and use. Saves me having to manually enter my details in a register in places like the library. ,en,  Easy to download  register and use  Saves me having to manually enter my details in a register in places like the library  ,Domain_Specific,enter,0.083333333,Positive,0,0,1,0,0,0,0,0,0
29,8/14/20 0:54,nz.govt.health.covidtracer,NZ COVID Tracer,en,sher athwal,1,It's not identifying the barcodes.,  It's not identifying the barcodes. ,en,  It s not identifying the barcodes  ,Domain_Specific,identifi,0.5,Neutral,0,0,1,0,0,0,0,0,0
38,8/13/20 23:06,nz.govt.health.covidtracer,NZ COVID Tracer,en,Zak Marsden,1,Password must be at least 10 characters long? This is the most secure password I have ever needed.. Why? In case someone else wants to record my visit somewhere?,  Password must be at least 10 characters long? This is the most secure password I have ever needed.. Why? In case someone else wants to record my visit somewhere? ,en,  Password must be at least    characters long  This is the most secure password I have ever needed   Why  In case someone else wants to record my visit somewhere  ,"Domain_Specific, Privacy","secur, secur, record",0.176470588,Positive,0,0,1,0,0,0,0,1,0
50,8/13/20 21:45,nz.govt.health.covidtracer,NZ COVID Tracer,en,jonathan scott,1,I can complete install. It doesn't send me the code to my email address,  I can complete install. It doesn't send me the code to my email address ,en,  I can complete install  It doesn t send me the code to my email address ,Domain_Specific,address,0.166666667,Neutral,0,0,1,0,0,0,0,0,0
53,8/13/20 21:03,nz.govt.health.covidtracer,NZ COVID Tracer,en,zyra capili,2,"For some reason when I use my app to scan a QR Code, it doesn't work. I tried focusing it for few seconds but nothing happened",  For some reason when I use my app to scan a QR Code  it doesn't work. I tried focusing it for few seconds but nothing happened ,en,  For some reason when I use my app to scan a QR Code  it doesn t work  I tried focusing it for few seconds but nothing happened ,Domain_Specific,focus,0.083333333,Neutral,0,0,1,0,0,0,0,0,0
56,8/13/20 20:38,nz.govt.health.covidtracer,NZ COVID Tracer,en,Peekukthefrog,5,"Works fine, no issues, creating an account is easy took a minute to set up. Most National supporters will have issues with it as its their way of trying to blame the Labour government.",  Works fine  no issues  creating an account is easy took a minute to set up. Most National supporters will have issues with it as its their way of trying to blame the Labour government. ,en,  Works fine  no issues  creating an account is easy took a minute to set up  Most National supporters will have issues with it as its their way of trying to blame the Labour government  ,Domain_Specific,account,0.058823529,Positive,0,0,1,0,0,0,0,0,0
58,8/13/20 20:26,nz.govt.health.covidtracer,NZ COVID Tracer,en,Justin Matthews,4,Very easy to use however would be nice if there was an edit option available especially for manual entries. At least then you could add more detail if required or correct a mistake with the location or the date/time.,  Very easy to use however would be nice if there was an edit option available especially for manual entries. At least then you could add more detail if required or correct a mistake with the location or the date/time. ,en,  Very easy to use however would be nice if there was an edit option available especially for manual entries  At least then you could add more detail if required or correct a mistake with the location or the date time  ,"Domain_Specific, Privacy","locat, locat",0.090909091,Positive,0,0,1,0,0,0,0,1,0
62,8/13/20 20:09,nz.govt.health.covidtracer,NZ COVID Tracer,en,Maria C,1,YOU NEED TO MAKE IT SO WE CAN EXIT THE APP TO GET THE CODE FROM THE EMAIL AND THEN GO BACK INTO THE APP TO ENTER THAT CODE!!! WE CAN'T LOGIN OTHERWISE SO IT IS COMPLETELY USELESS!!!,  YOU NEED TO MAKE IT SO WE CAN EXIT THE APP TO GET THE CODE FROM THE EMAIL AND THEN GO BACK INTO THE APP TO ENTER THAT CODE!!! WE CAN'T LOGIN OTHERWISE SO IT IS COMPLETELY USELESS!!! ,en,  YOU NEED TO MAKE IT SO WE CAN EXIT THE APP TO GET THE CODE FROM THE EMAIL AND THEN GO BACK INTO THE APP TO ENTER THAT CODE    WE CAN T LOGIN OTHERWISE SO IT IS COMPLETELY USELESS    ,Domain_Specific,enter,0.0625,Negative,0,0,1,0,0,0,0,0,0
64,8/13/20 20:06,nz.govt.health.covidtracer,NZ COVID Tracer,en,Rob Pendreigh,2,Cannot use the photo record function on the app when font setting is set to large on the phone have to record all visits manually,  Cannot use the photo record function on the app when font setting is set to large on the phone have to record all visits manually ,en,  Cannot use the photo record function on the app when font setting is set to large on the phone have to record all visits manually ,Domain_Specific,record,0.076923077,Neutral,0,0,1,0,0,0,0,0,0
67,8/13/20 19:55,nz.govt.health.covidtracer,NZ COVID Tracer,en,Carl Redshaw,1,"My impressions of this app is Govt has been too worried about bureaucracy instead of developing and using the technology available .Business now are mandatorily expected to display a QR code. If your business is required to contact register your customer , this App does not support your business only your customers ability to keep a personal journal. You will need another digital register to record your customers details. We are using covidregister.nz (Napier firm) you can check in n check out",  My impressions of this app is Govt has been too worried about bureaucracy instead of developing and using the technology available .Business now are mandatorily expected to display a QR code. If your business is required to contact register your customer   this App does not support your business only your customers ability to keep a personal journal. You will need another digital register to record your customers details. We are using covidregister.nz (Napier firm) you can check in n check out ,en,  My impressions of this app is Govt has been too worried about bureaucracy instead of developing and using the technology available  Business now are mandatorily expected to display a QR code  If your business is required to contact register your customer   this App does not support your business only your customers ability to keep a personal journal  You will need another digital register to record your customers details  We are using covidregister nz  Napier firm  you can check in n check out ,"Domain_Specific, Emotional","worri, custom, record, display",0.086956522,Negative,0,0,1,1,0,0,0,0,0
68,8/13/20 19:52,nz.govt.health.covidtracer,NZ COVID Tracer,en,Sharon Edge,1,Bloody hopeless app. I typed in the code emailed to me so i could activate the set up and it bounced back with a message that I had the wrong code. I rechecked my email........no it was the right number so i tried again. Still no luck.ðŸ™„ðŸ˜¡. Back to old school pen and paper for me its a lot more reliable. Will carry a small note book and pen around.,  Bloody hopeless app. I typed in the code emailed to me so i could activate the set up and it bounced back with a message that I had the wrong code. I rechecked my email........no it was the right number so i tried again. Still no luck.ðŸ™„ðŸ˜¡. Back to old school pen and paper for me its a lot more reliable. Will carry a small note book and pen around. ,en,  Bloody hopeless app  I typed in the code emailed to me so i could activate the set up and it bounced back with a message that I had the wrong code  I rechecked my email        no it was the right number so i tried again  Still no luck     Back to old school pen and paper for me its a lot more reliable  Will carry a small note book and pen around  ,"Age, Domain_Specific","school, paper",0.058823529,Negative,1,0,1,0,0,0,0,0,0
70,8/13/20 19:29,nz.govt.health.covidtracer,NZ COVID Tracer,en,Jym Clark,1,The forgot password function is not sending a reset code to my email. Tried across two separate days. Nothing in the spam folder. Will set up a new account.,  The forgot password function is not sending a reset code to my email. Tried across two separate days. Nothing in the spam folder. Will set up a new account. ,en,  The forgot password function is not sending a reset code to my email  Tried across two separate days  Nothing in the spam folder  Will set up a new account  ,Domain_Specific,"folder, separ, account",0.166666667,Positive,0,0,1,0,0,0,0,0,0
79,8/13/20 10:47,nz.govt.health.covidtracer,NZ COVID Tracer,en,John Main,1,Easier to open a bank account,  Easier to open a bank account ,en,  Easier to open a bank account ,"Domain_Specific, Privacy","bank account, account",0.75,Positive,0,0,1,0,0,0,0,1,0
82,8/13/20 10:08,nz.govt.health.covidtracer,NZ COVID Tracer,en,Charlotte Hills,1,Sent code to activate account and twice the codes don't work... can't say I didn't try....,  Sent code to activate account and twice the codes don't work... can't say I didn't try.... ,en,  Sent code to activate account and twice the codes don t work    can t say I didn t try     ,Domain_Specific,account,0.111111111,Neutral,0,0,1,0,0,0,0,0,0
87,8/13/20 9:16,nz.govt.health.covidtracer,NZ COVID Tracer,en,Sue dunsbee,1,7 verifications numbers recieved and I'm still being told to enter a valid number so can't even use the app,  7 verifications numbers recieved and I'm still being told to enter a valid number so can't even use the app ,en,    verifications numbers recieved and I m still being told to enter a valid number so can t even use the app ,Domain_Specific,enter,0.090909091,Positive,0,0,1,0,0,0,0,0,0
92,8/13/20 8:47,nz.govt.health.covidtracer,NZ COVID Tracer,en,Aidan Obrien,1,It doesn't work try to restore password and keeps saying error not really good,  It doesn't work try to restore password and keeps saying error not really good ,en,  It doesn t work try to restore password and keeps saying error not really good ,Domain_Specific,restor,0.111111111,Negative,0,0,1,0,0,0,0,0,0
93,8/13/20 8:46,nz.govt.health.covidtracer,NZ COVID Tracer,en,selina spooner,1,Won't let me create an account,  Won't let me create an account ,en,  Won t let me create an account ,Domain_Specific,account,0.333333333,Positive,0,0,1,0,0,0,0,0,0
97,8/13/20 8:32,nz.govt.health.covidtracer,NZ COVID Tracer,en,ZiwaRuan brink,1,Total waste of only have to create another email account just to get the app. Due to having a joint email account. Should have known there are people with joint accounts. Sort this out then it would work.,  Total waste of only have to create another email account just to get the app. Due to having a joint email account. Should have known there are people with joint accounts. Sort this out then it would work. ,en,  Total waste of only have to create another email account just to get the app  Due to having a joint email account  Should have known there are people with joint accounts  Sort this out then it would work  ,Domain_Specific,account,0.05,Negative,0,0,1,0,0,0,0,0,0
101,8/13/20 8:06,nz.govt.health.covidtracer,NZ COVID Tracer,en,Brenda Allen-Baines,1,"Signed up. Forgot my password. Email correct. Asked for code to be sent to email to allow for password reset, but no email ever received. Check spam but none in there. So cant use covid tracer & cant sign up again as says email already in use!!!!",  Signed up. Forgot my password. Email correct. Asked for code to be sent to email to allow for password reset  but no email ever received. Check spam but none in there. So cant use covid tracer & cant sign up again as says email already in use!!!! ,en,  Signed up  Forgot my password  Email correct  Asked for code to be sent to email to allow for password reset  but no email ever received  Check spam but none in there  So cant use covid tracer   cant sign up again as says email already in use     ,Domain_Specific,"tracer, receiv",0.071428571,Negative,0,0,1,0,0,0,0,0,0
102,8/13/20 8:03,nz.govt.health.covidtracer,NZ COVID Tracer,en,smith ann,1,Tried scan today at the supermarket but didnt work. Staff at door said others had the same problem very frustrating when trying to do the right thing!,  Tried scan today at the supermarket but didnt work. Staff at door said others had the same problem very frustrating when trying to do the right thing! ,en,  Tried scan today at the supermarket but didnt work  Staff at door said others had the same problem very frustrating when trying to do the right thing  ,"Domain_Specific, Emotional","frustrat, staff",0.133333333,Negative,0,0,1,1,0,0,0,0,0
103,8/13/20 8:02,nz.govt.health.covidtracer,NZ COVID Tracer,en,adele milner,1,"Can't sign up, because it keeps sending verification codes which void the previous code as I'm entering it: useless.",  Can't sign up  because it keeps sending verification codes which void the previous code as I'm entering it: useless. ,en,  Can t sign up  because it keeps sending verification codes which void the previous code as I m entering it  useless  ,Domain_Specific,enter,0.090909091,Negative,0,0,1,0,0,0,0,0,0
107,8/13/20 7:28,nz.govt.health.covidtracer,NZ COVID Tracer,en,Shannan Nuku,1,It keeps saying enter code but i enter it and keeps saying invalid code same thing keeps happening when i get new code,  It keeps saying enter code but i enter it and keeps saying invalid code same thing keeps happening when i get new code ,en,  It keeps saying enter code but i enter it and keeps saying invalid code same thing keeps happening when i get new code ,Domain_Specific,enter,0.066666667,Neutral,0,0,1,0,0,0,0,0,0
109,8/13/20 7:23,nz.govt.health.covidtracer,NZ COVID Tracer,en,Benny Phillips,1,"Absolutely frustrating.I can't log in..This is the second time I've tried uninstalling and then installing again,but no luck.If the government strongly recommend we use this app then something needs to change so we can get past the log in..",  Absolutely frustrating.I can't log in..This is the second time I've tried uninstalling and then installing again but no luck.If the government strongly recommend we use this app then something needs to change so we can get past the log in.. ,en,  Absolutely frustrating I can t log in  This is the second time I ve tried uninstalling and then installing again but no luck If the government strongly recommend we use this app then something needs to change so we can get past the log in   ,Emotional,frustrat,0.05,Positive,0,0,0,1,0,0,0,0,0
121,8/13/20 6:55,nz.govt.health.covidtracer,NZ COVID Tracer,en,Eliza Tamihana,1,"Couldn't get pass the enter the 6 digit code, in one attempt I got 6, 6 digit codes now I have been kicked out trying too many times. Can't be bothered now",  Couldn't get pass the enter the 6 digit code  in one attempt I got 6  6 digit codes now I have been kicked out trying too many times. Can't be bothered now ,en,  Couldn t get pass the enter the   digit code  in one attempt I got      digit codes now I have been kicked out trying too many times  Can t be bothered now ,Domain_Specific,enter,0.066666667,Negative,0,0,1,0,0,0,0,0,0
122,8/13/20 6:53,nz.govt.health.covidtracer,NZ COVID Tracer,en,Doug Lambert,1,I have tried to download this App using my Yahoo account. It says the app is loaded and yet it comes up registered on my gmail account I never use. I want it on my Yahoo account. How would I know my presence has been recorded at a specific site when I showed my phone? It has been a failure.,  I have tried to download this App using my Yahoo account. It says the app is loaded and yet it comes up registered on my gmail account I never use. I want it on my Yahoo account. How would I know my presence has been recorded at a specific site when I showed my phone? It has been a failure. ,en,  I have tried to download this App using my Yahoo account  It says the app is loaded and yet it comes up registered on my gmail account I never use  I want it on my Yahoo account  How would I know my presence has been recorded at a specific site when I showed my phone  It has been a failure  ,Domain_Specific,"record, account",0.071428571,Negative,0,0,1,0,0,0,0,0,0
123,8/13/20 6:49,nz.govt.health.covidtracer,NZ COVID Tracer,en,Sophia Tunnicliffe,2,"2nd time install. Still not impressed with a 10 digit/character/capital ...PWD. OTT compared to bank online PWD requirements. Improved with manual diary entry now but when click into the details screen and type in content, you lose the enter button. If back arrow out you lose 'enter'. Can only get 'enter' button back if click back into and out of time field to get 'enter' button after detail. Its a terrible app design for Government level and clunky. No wonder people are continually frustrated!",  2nd time install. Still not impressed with a 10 digit/character/capital ...PWD. OTT compared to bank online PWD requirements. Improved with manual diary entry now but when click into the details screen and type in content  you lose the enter button. If back arrow out you lose 'enter'. Can only get 'enter' button back if click back into and out of time field to get 'enter' button after detail. Its a terrible app design for Government level and clunky. No wonder people are continually frustrated! ,en,   nd time install  Still not impressed with a    digit character capital    PWD  OTT compared to bank online PWD requirements  Improved with manual diary entry now but when click into the details screen and type in content  you lose the enter button  If back arrow out you lose  enter   Can only get  enter  button back if click back into and out of time field to get  enter  button after detail  Its a terrible app design for Government level and clunky  No wonder people are continually frustrated  ,"Domain_Specific, Emotional","frustrat, enter, button, level",0.074074074,Negative,0,0,1,1,0,0,0,0,0
127,8/13/20 6:41,nz.govt.health.covidtracer,NZ COVID Tracer,en,Jay H,5,Easy to use now with good improvements since its launch. This app should be the only tracer businesses use nationwide. I don't know why other businesses were displaying QR codes from other apps.,  Easy to use now with good improvements since its launch. This app should be the only tracer businesses use nationwide. I don't know why other businesses were displaying QR codes from other apps. ,en,  Easy to use now with good improvements since its launch  This app should be the only tracer businesses use nationwide  I don t know why other businesses were displaying QR codes from other apps  ,Domain_Specific,"tracer, display",0.105263158,Positive,0,0,1,0,0,0,0,0,0
129,8/13/20 6:36,nz.govt.health.covidtracer,NZ COVID Tracer,en,Frank Murphy,1,This app is not user friendly so as installation requires computer use will not be using it,  This app is not user friendly so as installation requires computer use will not be using it ,en,  This app is not user friendly so as installation requires computer use will not be using it ,Domain_Specific,comput,0.125,Negative,0,0,1,0,0,0,0,0,0
130,8/13/20 6:35,nz.govt.health.covidtracer,NZ COVID Tracer,en,Simon Skirrow,1,Tried to change password. No. Tried setup with alternative email NO. Complete junk. SPEND THE MONEY on Mental Health support where it's most needed,  Tried to change password. No. Tried setup with alternative email NO. Complete junk. SPEND THE MONEY on Mental Health support where it's most needed ,en,  Tried to change password  No  Tried setup with alternative email NO  Complete junk  SPEND THE MONEY on Mental Health support where it s most needed ,Emotional,mental,0.066666667,Negative,0,0,0,1,0,0,0,0,0
133,8/13/20 6:17,nz.govt.health.covidtracer,NZ COVID Tracer,en,Chris Smith,1,Have tried downloading this twice cant get past log in page keeps asking me to enter authentication code cant even find it absolutely rubbish so frustrating,  Have tried downloading this twice cant get past log in page keeps asking me to enter authentication code cant even find it absolutely rubbish so frustrating ,en,  Have tried downloading this twice cant get past log in page keeps asking me to enter authentication code cant even find it absolutely rubbish so frustrating ,"Domain_Specific, Emotional","frustrat, enter",0.105263158,Negative,0,0,1,1,0,0,0,0,0
135,8/13/20 6:07,nz.govt.health.covidtracer,NZ COVID Tracer,en,Sharon Dolden,1,"App sucks, im trying to get tracker code, so far iv had about 7 codes none if them work",  App sucks  im trying to get tracker code  so far iv had about 7 codes none if them work ,en,  App sucks  im trying to get tracker code  so far iv had about   codes none if them work ,Domain_Specific,tracker,0.083333333,Negative,0,0,1,0,0,0,0,0,0
137,8/13/20 5:51,nz.govt.health.covidtracer,NZ COVID Tracer,en,Danielle Murray,1,I have tried 30 times over a 24 hour period to verify my email address so i can use the app but i dont recive the code when it sayes sent. And you cant access the app without it. I have cheaked my spam folder aswell,  I have tried 30 times over a 24 hour period to verify my email address so i can use the app but i dont recive the code when it sayes sent. And you cant access the app without it. I have cheaked my spam folder aswell ,en,  I have tried    times over a    hour period to verify my email address so i can use the app but i do not recive the code when it sayes sent  And you cant access the app without it  I have cheaked my spam folder aswell ,Domain_Specific,"folder, address",0.095238095,Negative,0,0,1,0,0,0,0,0,0
