,Date,AppID,AppName,Country,Author,Rating,Review,Title Review,Detected Language,content,issue,syn,issue_vio_id,sentiment,Age,Disability,Domain_Specific,Emotional,Gender,Language,Location,Privacy,Socio_economic_Status
548,8/5/20 1:23,nz.govt.health.covidtracer,NZ COVID Tracer,en,Colleen Riggs,1,Tried several times and despite following directions I keep getting blocked at the code entry level. I give up.,  Tried several times and despite following directions I keep getting blocked at the code entry level. I give up. ,en,  Tried several times and despite following directions I keep getting blocked at the code entry level  I give up  ,Domain_Specific,"follow, level",0.153846154,Negative,0,0,1,0,0,0,0,0,0
550,8/4/20 23:35,nz.govt.health.covidtracer,NZ COVID Tracer,en,Jim Johnston,5,clear to follow.I feel I can be part of a larger team.,  clear to follow.I feel I can be part of a larger team. ,en,  clear to follow I feel I can be part of a larger team  ,Domain_Specific,follow,0.166666667,Positive,0,0,1,0,0,0,0,0,0
553,8/4/20 20:02,nz.govt.health.covidtracer,NZ COVID Tracer,en,userkev1,1,"Great idea, poor in getting compliance. How about this for an idea. For the covid app. Giveaway $1M each day as a lottery for app users. The more you use it, the more chances you have to win. Publicise the winners too. NZ is basically a bogan country, half the workers are on less than $25/h. And live for lotto on Saturday night. Thinking about these things working on The Terrace doesn't cut it. You've gotta think 'bogan'. Are you up to the challenge Ashley? Can you think outside the square?",  Great idea  poor in getting compliance. How about this for an idea. For the covid app. Giveaway $1M each day as a lottery for app users. The more you use it  the more chances you have to win. Publicise the winners too. NZ is basically a bogan country  half the workers are on less than $25/h. And live for lotto on Saturday night. Thinking about these things working on The Terrace doesn't cut it. You've gotta think 'bogan'. Are you up to the challenge Ashley? Can you think outside the square? ,en,  Great idea  poor in getting compliance  How about this for an idea  For the covid app  Giveaway   M each day as a lottery for app users  The more you use it  the more chances you have to win  Publicise the winners too  NZ is basically a bogan country  half the workers are on less than     h  And live for lotto on Saturday night  Thinking about these things working on The Terrace doesn t cut it  You ve gotta think  bogan   Are you up to the challenge Ashley  Can you think outside the square  ,"Domain_Specific, Language, Location","countri, countri, outsid",0.068181818,Positive,0,0,1,0,0,1,1,0,0
554,8/4/20 7:01,nz.govt.health.covidtracer,NZ COVID Tracer,en,ROD LIDDY,1,"Initially this app worked well then out of no where it was asking me to ""log in"" ""sign in"" ok I thought maybe it was updating..?? No.!! Uninstalled this app completely in an attempt to install again and use.. followed all the instructions re email address and password comes back as"" user name already exists"" or ""password does not match"" wipe both address and passwords out start again same result...have now given up","  Initially this app worked well then out of no where it was asking me to ""log in"" ""sign in"" ok I thought maybe it was updating..?? No.!! Uninstalled this app completely in an attempt to install again and use.. followed all the instructions re email address and password comes back as"" user name already exists"" or ""password does not match"" wipe both address and passwords out start again same result...have now given up ",en,  Initially this app worked well then out of no where it was asking me to  log in   sign in  ok I thought maybe it was updating     No    Uninstalled this app completely in an attempt to install again and use   followed all the instructions re email address and password comes back as  user name already exists  or  password does not match  wipe both address and passwords out start again same result   have now given up ,Domain_Specific,"follow, address",0.054054054,Neutral,0,0,1,0,0,0,0,0,0
557,8/3/20 8:22,nz.govt.health.covidtracer,NZ COVID Tracer,en,Paul Benge,1,"Went to use App today, now it wants me to login again. I am not waiting outside a shop messing around to login. Why login anyway, the data so you say is stored on my own device only. Time to delete app. . Should have been a universal standard. Around 75% of the QR Codes you scan don't work. Was way too hard for many businesses to create the code as have to have RealMe Account etc. Changed rating to five stars, developer responded to my review and have taken steps to correct it. Good on them.",  Went to use App today  now it wants me to login again. I am not waiting outside a shop messing around to login. Why login anyway  the data so you say is stored on my own device only. Time to delete app. . Should have been a universal standard. Around 75% of the QR Codes you scan don't work. Was way too hard for many businesses to create the code as have to have RealMe Account etc. Changed rating to five stars  developer responded to my review and have taken steps to correct it. Good on them. ,en,  Went to use App today  now it wants me to login again  I am not waiting outside a shop messing around to login  Why login anyway  the data so you say is stored on my own device only  Time to delete app    Should have been a universal standard  Around     of the QR Codes you scan don t work  Was way too hard for many businesses to create the code as have to have RealMe Account etc  Changed rating to five stars  developer responded to my review and have taken steps to correct it  Good on them  ,"Domain_Specific, Privacy","data, outsid, respond, account",0.08,Positive,0,0,1,0,0,0,0,1,0
559,8/3/20 2:04,nz.govt.health.covidtracer,NZ COVID Tracer,en,R White,4,"Updated Review 3rd Aug Fantastic to see the app now supports the older Android version my phone has (6.0). Furthermore manual entries can now be added where a location does not have a bar code and also notification of when I visit somewhere where someone tested positive. I will upgrade to 5 stars when I hear someone being notified via the app of a positive test of someone who visited the same location as myself. Well done MoH on the updates, communications and esp. my request to support older Android versions than v7.0 Original Review (was 2 stars) Does not supports Android 6.0 but did on initial launch now I cannot upgrade and its unreliable. Very disappointing that an app such as this does not support Android 6 (or even older), the whole idea is to get as many people as possible using this app. Even Google, MS and RSA support Android 6 for secure use such as auth apps. Note I cannot upgrade my Android version as Huawei don't make it available here.I suggest that is requirement. for the next release. I'll upgrade my review when I saw better Android OS support",  Updated Review 3rd Aug Fantastic to see the app now supports the older Android version my phone has (6.0). Furthermore manual entries can now be added where a location does not have a bar code and also notification of when I visit somewhere where someone tested positive. I will upgrade to 5 stars when I hear someone being notified via the app of a positive test of someone who visited the same location as myself. Well done MoH on the updates  communications and esp. my request to support older Android versions than v7.0 Original Review (was 2 stars) Does not supports Android 6.0 but did on initial launch now I cannot upgrade and its unreliable. Very disappointing that an app such as this does not support Android 6 (or even older)  the whole idea is to get as many people as possible using this app. Even Google  MS and RSA support Android 6 for secure use such as auth apps. Note I cannot upgrade my Android version as Huawei don't make it available here.I suggest that is requirement. for the next release. I'll upgrade my review when I saw better Android OS support ,en,  Updated Review  rd Aug Fantastic to see the app now supports the older Android version my phone has        Furthermore manual entries can now be added where a location does not have a bar code and also notification of when I visit somewhere where someone tested positive  I will upgrade to   stars when I hear someone being notified via the app of a positive test of someone who visited the same location as myself  Well done MoH on the updates  communications and esp  my request to support older Android versions than v    Original Review  was   stars  Does not supports Android     but did on initial launch now I cannot upgrade and its unreliable  Very disappointing that an app such as this does not support Android    or even older   the whole idea is to get as many people as possible using this app  Even Google  MS and RSA support Android   for secure use such as auth apps  Note I cannot upgrade my Android version as Huawei don t make it available here I suggest that is requirement  for the next release  I ll upgrade my review when I saw better Android OS support ,"Age, Domain_Specific, Privacy","older, locat, secur, secur, locat, communic",0.057142857,Positive,1,0,1,0,0,0,0,1,0
560,8/3/20 0:57,nz.govt.health.covidtracer,NZ COVID Tracer,en,Gary Lowndes,5,"Actually useful now, the scan button has been replaced with a 'record visit' button so you can record anything anywhere - dairies, sports games, friends houses.. . If you still have a scan button update the app.",  Actually useful now  the scan button has been replaced with a 'record visit' button so you can record anything anywhere - dairies  sports games  friends houses.. . If you still have a scan button update the app. ,en,  Actually useful now  the scan button has been replaced with a  record visit  button so you can record anything anywhere   dairies  sports games  friends houses     If you still have a scan button update the app  ,Domain_Specific,"record, replac, button",0.142857143,Positive,0,0,1,0,0,0,0,0,0
563,8/2/20 9:48,nz.govt.health.covidtracer,NZ COVID Tracer,en,mx4evaNZ,1,"Password is complete stuff up. Why does it need an email address for security? Just txt the verification instead. Uninstalled the ap, never got past the verification stage.....",  Password is complete stuff up. Why does it need an email address for security? Just txt the verification instead. Uninstalled the ap  never got past the verification stage..... ,en,  Password is complete stuff up  Why does it need an email address for security  Just txt the verification instead  Uninstalled the ap  never got past the verification stage      ,"Domain_Specific, Privacy","secur, secur, address",0.157894737,Positive,0,0,1,0,0,0,0,1,0
568,8/1/20 20:39,nz.govt.health.covidtracer,NZ COVID Tracer,en,Richard Supple,1,No way to use it. Why sponsor an app that only does the job for a select few? Can you not choose a developer who fully shares your mission? Is this really? your best attempt? I don't think so,  No way to use it. Why sponsor an app that only does the job for a select few? Can you not choose a developer who fully shares your mission? Is this really? your best attempt? I don't think so ,en,  No way to use it  Why sponsor an app that only does the job for a select few  Can you not choose a developer who fully shares your mission  Is this really  your best attempt  I don t think so ,Domain_Specific,sponsor,0.055555556,Positive,0,0,1,0,0,0,0,0,0
573,8/1/20 6:19,nz.govt.health.covidtracer,NZ COVID Tracer,en,PIRIWIRITUA THOMPSON,1,"I've signed up accordingly, but everytime I log in and insert the 6 digit code, it always comes up with, an error occurred ðŸ™„ðŸ¤¨ which prevents me going any farther. This is frustrating, as I'd like to track my daily steps, whilst this Coronavirus-19 is VERY MUCH Alive... Are you able to help me with this frustration? I don't want t uninstall, SO I'd Appreciate your help here... Gabrielle Thompson Whanganui Aotearoa (NZ)",  I've signed up accordingly  but everytime I log in and insert the 6 digit code  it always comes up with  an error occurred ðŸ™„ðŸ¤¨ which prevents me going any farther. This is frustrating  as I'd like to track my daily steps  whilst this Coronavirus-19 is VERY MUCH Alive... Are you able to help me with this frustration? I don't want t uninstall  SO I'd Appreciate your help here... Gabrielle Thompson Whanganui Aotearoa (NZ) ,en,  I ve signed up accordingly  but everytime I log in and insert the   digit code  it always comes up with  an error occurred    which prevents me going any farther  This is frustrating  as I d like to track my daily steps  whilst this Coronavirus    is VERY MUCH Alive    Are you able to help me with this frustration  I don t want t uninstall  SO I d Appreciate your help here    Gabrielle Thompson Whanganui Aotearoa  NZ  ,"Domain_Specific, Emotional, Privacy","frustrat, track, insert",0.081081081,Positive,0,0,1,1,0,0,0,1,0
574,8/1/20 6:06,nz.govt.health.covidtracer,NZ COVID Tracer,en,John Hetherington,4,"Happy with is app, will read a codes unless they have a clear plastic covering then it won't",  Happy with is app  will read a codes unless they have a clear plastic covering then it won't ,en,  Happy with is app  will read a codes unless they have a clear plastic covering then it won t ,Domain_Specific,"plastic, cover",0.25,Positive,0,0,1,0,0,0,0,0,0
576,7/31/20 20:42,nz.govt.health.covidtracer,NZ COVID Tracer,en,Joy Thavat,3,"Annoyed that I have to log in again every time I open the app. Makes using it less seamless. Even a ""Remember me"" or ""Remember my password"" tick box would help so login credentials don't need to manually entered every time.","  Annoyed that I have to log in again every time I open the app. Makes using it less seamless. Even a ""Remember me"" or ""Remember my password"" tick box would help so login credentials don't need to manually entered every time. ",en,  Annoyed that I have to log in again every time I open the app  Makes using it less seamless  Even a  Remember me  or  Remember my password  tick box would help so login credentials don t need to manually entered every time  ,"Domain_Specific, Emotional","annoy, enter",0.08,Neutral,0,0,1,1,0,0,0,0,0
577,7/31/20 7:32,nz.govt.health.covidtracer,NZ COVID Tracer,en,Najam Haq,1,"Unreliable. Doesn't recognize most locations on multiple phones. The QR code is too dense for what it does, clearly written by amateurs. If perchance contact tracing does become necessary at scale, this app will NOT be of much help.",  Unreliable. Doesn't recognize most locations on multiple phones. The QR code is too dense for what it does  clearly written by amateurs. If perchance contact tracing does become necessary at scale  this app will NOT be of much help. ,en,  Unreliable  Doesn t recognize most locations on multiple phones  The QR code is too dense for what it does  clearly written by amateurs  If perchance contact tracing does become necessary at scale  this app will NOT be of much help  ,"Domain_Specific, Privacy","locat, locat",0.090909091,Positive,0,0,1,0,0,0,0,1,0
579,7/31/20 5:33,nz.govt.health.covidtracer,NZ COVID Tracer,en,Darcy Knibb,1,QR codes never work. I don't see many people manually entering in where they've been,  QR codes never work. I don't see many people manually entering in where they've been ,en,  QR codes never work  I don t see many people manually entering in where they ve been ,Domain_Specific,enter,0.111111111,Neutral,0,0,1,0,0,0,0,0,0
581,7/30/20 22:03,nz.govt.health.covidtracer,NZ COVID Tracer,en,Rodrigo M Leote,4,Is there a reason for not including GPS position recording on the manual entry?,  Is there a reason for not including GPS position recording on the manual entry? ,en,  Is there a reason for not including GPS position recording on the manual entry  ,"Domain_Specific, Privacy","gps, record",0.285714286,Neutral,0,0,1,0,0,0,0,1,0
582,7/30/20 21:44,nz.govt.health.covidtracer,NZ COVID Tracer,en,Michael Morris,1,"Creating account, send verification email which I received entered the 6 digit number and just get a generic error about creating account. Tried twice with 2 seperate 6 digit numbers.",  Creating account  send verification email which I received entered the 6 digit number and just get a generic error about creating account. Tried twice with 2 seperate 6 digit numbers. ,en,  Creating account  send verification email which I received entered the   digit number and just get a generic error about creating account  Tried twice with   seperate   digit numbers  ,Domain_Specific,"enter, receiv, account",0.157894737,Positive,0,0,1,0,0,0,0,0,0
583,7/30/20 21:19,nz.govt.health.covidtracer,NZ COVID Tracer,en,Cetx Etc,5,"Easy to use, quick, and he new manual entry is great. I'd like to see an ability to import and export a CSV of data, and for the source code to be opened on Gitlab or similar, but all around this is exactly the app we need.",  Easy to use  quick  and he new manual entry is great. I'd like to see an ability to import and export a CSV of data  and for the source code to be opened on Gitlab or similar  but all around this is exactly the app we need. ,en,  Easy to use  quick  and he new manual entry is great  I d like to see an ability to import and export a CSV of data  and for the source code to be opened on Gitlab or similar  but all around this is exactly the app we need  ,"Domain_Specific, Privacy","data, export, import",0.130434783,Positive,0,0,1,0,0,0,0,1,0
585,7/30/20 10:06,nz.govt.health.covidtracer,NZ COVID Tracer,en,Crystal Lay,5,"The app is super simple to use, and all functions work perfectly with no issues, even though my phone is a little older now and that I am terrible at actually updating my apps.",  The app is super simple to use  and all functions work perfectly with no issues  even though my phone is a little older now and that I am terrible at actually updating my apps. ,en,  The app is super simple to use  and all functions work perfectly with no issues  even though my phone is a little older now and that I am terrible at actually updating my apps  ,Age,older,0.058823529,Positive,1,0,0,0,0,0,0,0,0
586,7/30/20 6:40,nz.govt.health.covidtracer,NZ COVID Tracer,en,Alistair Thomson,1,"Rubbish. Bizarely hard to use for what should be a simple app. Two factor sign in? Really? I've never, ever managed to read a QR code with it despite multiple attempts.",  Rubbish. Bizarely hard to use for what should be a simple app. Two factor sign in? Really? I've never  ever managed to read a QR code with it despite multiple attempts. ,en,  Rubbish  Bizarely hard to use for what should be a simple app  Two factor sign in  Really  I ve never  ever managed to read a QR code with it despite multiple attempts  ,Domain_Specific,"manag, manag, factor",0.157894737,Negative,0,0,1,0,0,0,0,0,0
592,7/30/20 1:09,nz.govt.health.covidtracer,NZ COVID Tracer,en,Simon Campbell,1,"Don't understand why I need to create an account so did not go past first screen. Why can't I use it without an account? Surely at the point of infection, I could then share my diary.",  Don't understand why I need to create an account so did not go past first screen. Why can't I use it without an account? Surely at the point of infection  I could then share my diary. ,en,  Don t understand why I need to create an account so did not go past first screen  Why can t I use it without an account  Surely at the point of infection  I could then share my diary  ,Domain_Specific,account,0.052631579,Positive,0,0,1,0,0,0,0,0,0
595,7/29/20 22:51,nz.govt.health.covidtracer,NZ COVID Tracer,en,Marty Pilott,2,"I've used this app successfully, but every so often it tells me to log in again with my email and password. Why? Obviously I'm not going to do that in a queue with people waiting for me! The Ministry response says this is for ""privacy and security reasons"". I have to log in to my phone anyway so the app is secure. Contact tracing is stored on the device itself and as far as I know does not send information to any central agency. The privacy and security is therefore entirely imaginary and simply adds another reason not to engage in contact tracing - a very self-destructive and unhelpful approach.","  I've used this app successfully  but every so often it tells me to log in again with my email and password. Why? Obviously I'm not going to do that in a queue with people waiting for me! The Ministry response says this is for ""privacy and security reasons"". I have to log in to my phone anyway so the app is secure. Contact tracing is stored on the device itself and as far as I know does not send information to any central agency. The privacy and security is therefore entirely imaginary and simply adds another reason not to engage in contact tracing - a very self-destructive and unhelpful approach. ",en,  I ve used this app successfully  but every so often it tells me to log in again with my email and password  Why  Obviously I m not going to do that in a queue with people waiting for me  The Ministry response says this is for  privacy and security reasons   I have to log in to my phone anyway so the app is secure  Contact tracing is stored on the device itself and as far as I know does not send information to any central agency  The privacy and security is therefore entirely imaginary and simply adds another reason not to engage in contact tracing   a very self destructive and unhelpful approach  ,Privacy,"secur, privaci, secur",0.054545455,Positive,0,0,0,0,0,0,0,1,0
597,7/29/20 6:24,nz.govt.health.covidtracer,NZ COVID Tracer,en,David Dunsheath,3,"Easy to use except twice it has annoyingly requested my login again with a password, eg today 29July 2020. I searched hard to find relevant remedy which said the app should be set to auto-updating. But the step-by-step instructions for android phones were not possible to follow on my Samsung SE10 (ggrrrhhhh).",  Easy to use except twice it has annoyingly requested my login again with a password  eg today 29July 2020. I searched hard to find relevant remedy which said the app should be set to auto-updating. But the step-by-step instructions for android phones were not possible to follow on my Samsung SE10 (ggrrrhhhh). ,en,  Easy to use except twice it has annoyingly requested my login again with a password  eg today   July       I searched hard to find relevant remedy which said the app should be set to auto updating  But the step by step instructions for android phones were not possible to follow on my Samsung SE    ggrrrhhhh   ,"Domain_Specific, Emotional","annoy, follow",0.064516129,Positive,0,0,1,1,0,0,0,0,0
598,7/28/20 20:22,nz.govt.health.covidtracer,NZ COVID Tracer,en,Peter Hughes,1,This app lacks robustness plus the model of keeping all the data on a single device is flawed,  This app lacks robustness plus the model of keeping all the data on a single device is flawed ,en,  This app lacks robustness plus the model of keeping all the data on a single device is flawed ,"Domain_Specific, Privacy","data, model",0.2,Negative,0,0,1,0,0,0,0,1,0
604,7/25/20 0:45,nz.govt.health.covidtracer,NZ COVID Tracer,en,GrannyBee Mamanuts,1,"I think the app is a great idea, but can only load it on my Tablet as my phone is too old! I only ever remember about scanning after I get home!! There is nowhere on the app I can manually enter an address, date/time I have visited. If I write it in a diary at home, how is Ministry of Health going to know I have visited that place and how will I know that place was contaminated? We will soon end up like Melbourne!",  I think the app is a great idea  but can only load it on my Tablet as my phone is too old! I only ever remember about scanning after I get home!! There is nowhere on the app I can manually enter an address  date/time I have visited. If I write it in a diary at home  how is Ministry of Health going to know I have visited that place and how will I know that place was contaminated? We will soon end up like Melbourne! ,en,  I think the app is a great idea  but can only load it on my Tablet as my phone is too old  I only ever remember about scanning after I get home   There is nowhere on the app I can manually enter an address  date time I have visited  If I write it in a diary at home  how is Ministry of Health going to know I have visited that place and how will I know that place was contaminated  We will soon end up like Melbourne  ,Domain_Specific,"enter, address",0.051282051,Positive,0,0,1,0,0,0,0,0,0
607,7/24/20 9:34,nz.govt.health.covidtracer,NZ COVID Tracer,en,Gerry Edwards,4,"Downloaded without issue and scans fine on a reasonably new Android phone. As mentioned by others, many businesses are not displaying a QR code. This is why the app is only partially effective.",  Downloaded without issue and scans fine on a reasonably new Android phone. As mentioned by others  many businesses are not displaying a QR code. This is why the app is only partially effective. ,en,  Downloaded without issue and scans fine on a reasonably new Android phone  As mentioned by others  many businesses are not displaying a QR code  This is why the app is only partially effective  ,Domain_Specific,display,0.05,Positive,0,0,1,0,0,0,0,0,0
608,7/24/20 8:11,nz.govt.health.covidtracer,NZ COVID Tracer,en,Shaun Cornelius,1,Tried it in three locations didn't work in any. Works on test Q R on website though.,  Tried it in three locations didn't work in any. Works on test Q R on website though. ,en,  Tried it in three locations didn t work in any  Works on test Q R on website though  ,"Domain_Specific, Privacy","locat, locat",0.181818182,Neutral,0,0,1,0,0,0,0,1,0
