,Date,AppID,AppName,Country,Author,Rating,Review,Title Review,Detected Language,content,issue,syn,issue_vio_id,sentiment,Age,Disability,Domain_Specific,Emotional,Gender,Language,Location,Privacy,Socio_economic_Status
959,5/31/20 4:12,nz.govt.health.covidtracer,NZ COVID Tracer,en,MrDerek Barthow,1,I am appalled. My health and safety depends on this app yet I can't even register within it. They sent a 6 digit code to confirm my email address but I have to close the app to check my email for the code. When I reopen the covid app it is not at the page where you enter the code. Instead you have to login again but then it says the code is invalid. I have discovered the app has sent a fresh code. The only way to register would be use a computer to access emails while the covid app is open!,  I am appalled. My health and safety depends on this app yet I can't even register within it. They sent a 6 digit code to confirm my email address but I have to close the app to check my email for the code. When I reopen the covid app it is not at the page where you enter the code. Instead you have to login again but then it says the code is invalid. I have discovered the app has sent a fresh code. The only way to register would be use a computer to access emails while the covid app is open! ,en,  I am appalled  My health and safety depends on this app yet I can t even register within it  They sent a   digit code to confirm my email address but I have to close the app to check my email for the code  When I reopen the covid app it is not at the page where you enter the code  Instead you have to login again but then it says the code is invalid  I have discovered the app has sent a fresh code  The only way to register would be use a computer to access emails while the covid app is open  ,Domain_Specific,"enter, comput, address",0.063829787,Positive,0,0,1,0,0,0,0,0,0
962,5/31/20 1:11,nz.govt.health.covidtracer,NZ COVID Tracer,en,Lynn Riddell,3,"I would love to be able to give a full opinion on this; but so few of the places i visit use this tracer. My local mall (Eastridge in Mission Bay) uses a different one entirely for the whole building and the two don't talk to each other. The couple of times i have been able to use it, it hasn't worked. Downloaded this last week to a new phone, so its not the version of the tracer at fault.",  I would love to be able to give a full opinion on this; but so few of the places i visit use this tracer. My local mall (Eastridge in Mission Bay) uses a different one entirely for the whole building and the two don't talk to each other. The couple of times i have been able to use it  it hasn't worked. Downloaded this last week to a new phone  so its not the version of the tracer at fault. ,en,  I would love to be able to give a full opinion on this  but so few of the places i visit use this tracer  My local mall  Eastridge in Mission Bay  uses a different one entirely for the whole building and the two don t talk to each other  The couple of times i have been able to use it  it hasn t worked  Downloaded this last week to a new phone  so its not the version of the tracer at fault  ,"Domain_Specific, Location","local, tracer",0.055555556,Negative,0,0,1,0,0,0,1,0,0
967,5/30/20 22:25,nz.govt.health.covidtracer,NZ COVID Tracer,en,Zoe Grace Harris The First,2,This app was not supported on my Huawei P9 Lite (Late 2016 release) which forced me to buy a new phone finally. Other people in difficult financial situations with older phones may be unable to download this app which would theoretically leave a huge hole in contact tracing if older phones cannot be supported. Please look into this.,  This app was not supported on my Huawei P9 Lite (Late 2016 release) which forced me to buy a new phone finally. Other people in difficult financial situations with older phones may be unable to download this app which would theoretically leave a huge hole in contact tracing if older phones cannot be supported. Please look into this. ,en,  This app was not supported on my Huawei P  Lite  Late      release  which forced me to buy a new phone finally  Other people in difficult financial situations with older phones may be unable to download this app which would theoretically leave a huge hole in contact tracing if older phones cannot be supported  Please look into this  ,"Age, Domain_Specific, Socio_economic_Status","older, buy, financi",0.088235294,Negative,1,0,1,0,0,0,0,0,1
969,5/30/20 21:45,nz.govt.health.covidtracer,NZ COVID Tracer,en,James Laidlaw,2,There seem to be too many different qr codes and most aren't compatible with this application. Needs wider ability to recognize all QR codes for adequate tracing. Easy to use though otherwise. Response - it's disappointing that govt locations like Te Papa aren't using the official codes then. Also the app doesn't appear to allow you to see where you have checked in making it virtually useless for users at present along with the limited QR codes.,  There seem to be too many different qr codes and most aren't compatible with this application. Needs wider ability to recognize all QR codes for adequate tracing. Easy to use though otherwise. Response - it's disappointing that govt locations like Te Papa aren't using the official codes then. Also the app doesn't appear to allow you to see where you have checked in making it virtually useless for users at present along with the limited QR codes. ,en,  There seem to be too many different qr codes and most aren t compatible with this application  Needs wider ability to recognize all QR codes for adequate tracing  Easy to use though otherwise  Response   it s disappointing that govt locations like Te Papa aren t using the official codes then  Also the app doesn t appear to allow you to see where you have checked in making it virtually useless for users at present along with the limited QR codes  ,"Domain_Specific, Privacy","locat, locat, applic, present",0.090909091,Positive,0,0,1,0,0,0,0,1,0
975,5/30/20 6:37,nz.govt.health.covidtracer,NZ COVID Tracer,en,Angela Purcell,2,Keeps giving me a error occurred when I enter in my verification code. Luckily Google Maps tracks my every move so will keep using that.,  Keeps giving me a error occurred when I enter in my verification code. Luckily Google Maps tracks my every move so will keep using that. ,en,  Keeps giving me a error occurred when I enter in my verification code  Luckily Google Maps tracks my every move so will keep using that  ,"Domain_Specific, Privacy","track, enter",0.133333333,Positive,0,0,1,0,0,0,0,1,0
982,5/30/20 5:29,nz.govt.health.covidtracer,NZ COVID Tracer,en,Debbie Millward,1,"Can't get pass step 2 of creating account. It comes up with a error message, ' an error occurred while trying to create your account.'",  Can't get pass step 2 of creating account. It comes up with a error message  ' an error occurred while trying to create your account.' ,en,  Can t get pass step   of creating account  It comes up with a error message    an error occurred while trying to create your account   ,Domain_Specific,account,0.076923077,Negative,0,0,1,0,0,0,0,0,0
984,5/30/20 5:19,nz.govt.health.covidtracer,NZ COVID Tracer,en,Tyrone Bullock,3,Went to cambridge farmers market and the digital tracker code they had wouldnt work with the nz covid tracer scan ...frustrating Then at w/house rotorua the nz covid tracer would not scan/read the digital print on the window.....frustrating But it did work at a phone accessory store in rotorua main street ....so 1 out of 3 not bad but also not good,  Went to cambridge farmers market and the digital tracker code they had wouldnt work with the nz covid tracer scan ...frustrating Then at w/house rotorua the nz covid tracer would not scan/read the digital print on the window.....frustrating But it did work at a phone accessory store in rotorua main street ....so 1 out of 3 not bad but also not good ,en,  Went to cambridge farmers market and the digital tracker code they had wouldnt work with the nz covid tracer scan    frustrating Then at w house rotorua the nz covid tracer would not scan read the digital print on the window     frustrating But it did work at a phone accessory store in rotorua main street     so   out of   not bad but also not good ,"Domain_Specific, Emotional","frustrat, tracer, tracker, farmer",0.108108108,Negative,0,0,1,1,0,0,0,0,0
985,5/30/20 4:20,nz.govt.health.covidtracer,NZ COVID Tracer,en,Raffaello Vivaldi,1,"It doesn't even let me create an account. When tapping the ""Next"" button, absolutely nothing happens.","  It doesn't even let me create an account. When tapping the ""Next"" button  absolutely nothing happens. ",en,  It doesn t even let me create an account  When tapping the  Next  button  absolutely nothing happens  ,Domain_Specific,"button, account",0.2,Positive,0,0,1,0,0,0,0,0,0
988,5/30/20 2:51,nz.govt.health.covidtracer,NZ COVID Tracer,en,Jennifer Gillan,1,Can't use it. Have tried several different places but say something about invalid QR format even though they are the official ones. End up having to use pen and paper. Have just reinstalled so will see if any better. Trying to do the 'right' thing. So frustrating ðŸ˜ .,  Can't use it. Have tried several different places but say something about invalid QR format even though they are the official ones. End up having to use pen and paper. Have just reinstalled so will see if any better. Trying to do the 'right' thing. So frustrating ðŸ˜ . ,en,  Can t use it  Have tried several different places but say something about invalid QR format even though they are the official ones  End up having to use pen and paper  Have just reinstalled so will see if any better  Trying to do the  right  thing  So frustrating    ,"Domain_Specific, Emotional","frustrat, paper",0.076923077,Negative,0,0,1,1,0,0,0,0,0
989,5/30/20 2:14,nz.govt.health.covidtracer,NZ COVID Tracer,en,Damian Horn,1,Doesnt work on android. Hope MOH didnt pay a 3rd party to develop this...,  Doesnt work on android. Hope MOH didnt pay a 3rd party to develop this... ,en,  Doesnt work on android  Hope MOH didnt pay a  rd party to develop this    ,Socio_economic_Status,pay,0.1,Positive,0,0,0,0,0,0,0,0,1
996,5/29/20 23:46,nz.govt.health.covidtracer,NZ COVID Tracer,en,Grant Boston,1,First time I tried to use it the scan wouldn't start. Used Rippl and it worked perfectly and it was on the official moh poster!,  First time I tried to use it the scan wouldn't start. Used Rippl and it worked perfectly and it was on the official moh poster! ,en,  First time I tried to use it the scan wouldn t start  Used Rippl and it worked perfectly and it was on the official moh poster  ,Domain_Specific,poster,0.076923077,Positive,0,0,1,0,0,0,0,0,0
999,5/29/20 22:52,nz.govt.health.covidtracer,NZ COVID Tracer,en,Lynda Morrison,1,"Most pointless old school app ever - hardly any business has the approved QR code and 90% of shops/businesses have nothing! - Google Timeline tells you everything, where yourve been, what day/time etc. If govt develops an app, do it properly! Absolutely pointless - deleted it!",  Most pointless old school app ever - hardly any business has the approved QR code and 90% of shops/businesses have nothing! - Google Timeline tells you everything  where yourve been  what day/time etc. If govt develops an app  do it properly! Absolutely pointless - deleted it! ,en,  Most pointless old school app ever   hardly any business has the approved QR code and     of shops businesses have nothing    Google Timeline tells you everything  where yourve been  what day time etc  If govt develops an app  do it properly  Absolutely pointless   deleted it  ,"Age, Domain_Specific","school, approv",0.068965517,Positive,1,0,1,0,0,0,0,0,0
1002,5/29/20 21:18,nz.govt.health.covidtracer,NZ COVID Tracer,en,Aaron Hill,1,"Like a lot of people the Q code scanner is not working, not just me but every one I know who has downloaded this. Its Ridiculous that something so important doesn't even work. Poor is a understatement and you would hope that they actually would attempt to rectify this asap.",  Like a lot of people the Q code scanner is not working  not just me but every one I know who has downloaded this. Its Ridiculous that something so important doesn't even work. Poor is a understatement and you would hope that they actually would attempt to rectify this asap. ,en,  Like a lot of people the Q code scanner is not working  not just me but every one I know who has downloaded this  Its Ridiculous that something so important doesn t even work  Poor is a understatement and you would hope that they actually would attempt to rectify this asap  ,Domain_Specific,"rectifi, import",0.08,Positive,0,0,1,0,0,0,0,0,0
1003,5/29/20 21:01,nz.govt.health.covidtracer,NZ COVID Tracer,en,Lord Jacob Parsons,1,"Terrible, as soon as I installed the app, I had a knock on the door from men in black suits who were wearing strange reflective glasses. They started asking me why I follow x and y, what my thoughts are on the govt and where I have been for the past year. Such an odd experience.",  Terrible  as soon as I installed the app  I had a knock on the door from men in black suits who were wearing strange reflective glasses. They started asking me why I follow x and y  what my thoughts are on the govt and where I have been for the past year. Such an odd experience. ,en,  Terrible  as soon as I installed the app  I had a knock on the door from men in black suits who were wearing strange reflective glasses  They started asking me why I follow x and y  what my thoughts are on the govt and where I have been for the past year  Such an odd experience  ,"Domain_Specific, Gender","men, follow",0.083333333,Negative,0,0,1,0,1,0,0,0,0
1006,5/29/20 10:27,nz.govt.health.covidtracer,NZ COVID Tracer,en,Vads H,1,No option to manually input a location that does not have a QR code - how limited.,  No option to manually input a location that does not have a QR code - how limited. ,en,  No option to manually input a location that does not have a QR code   how limited  ,"Domain_Specific, Privacy","locat, locat",0.25,Negative,0,0,1,0,0,0,0,1,0
1008,5/29/20 6:32,nz.govt.health.covidtracer,NZ COVID Tracer,en,Nick Robinson,1,"Couldn't enter a password to sign up. Kept telling me I needed an upper case letter and a lower case letter and a number. Couldn't get past this screen, despite including all of the above.",  Couldn't enter a password to sign up. Kept telling me I needed an upper case letter and a lower case letter and a number. Couldn't get past this screen  despite including all of the above. ,en,  Couldn t enter a password to sign up  Kept telling me I needed an upper case letter and a lower case letter and a number  Couldn t get past this screen  despite including all of the above  ,Domain_Specific,"enter, letter",0.105263158,Negative,0,0,1,0,0,0,0,0,0
1009,5/29/20 4:44,nz.govt.health.covidtracer,NZ COVID Tracer,en,Leila Hamilton,1,"Trying to register and app won't accept my password, keeps telling me it needs on upper case, lower case, number, I had all of these and threw in a symbol for good measure but it still wasn't satisfied..",  Trying to register and app won't accept my password  keeps telling me it needs on upper case  lower case  number  I had all of these and threw in a symbol for good measure but it still wasn't satisfied.. ,en,  Trying to register and app won t accept my password  keeps telling me it needs on upper case  lower case  number  I had all of these and threw in a symbol for good measure but it still wasn t satisfied   ,Domain_Specific,measur,0.052631579,Positive,0,0,1,0,0,0,0,0,0
1010,5/29/20 4:26,nz.govt.health.covidtracer,NZ COVID Tracer,en,Lisa Lee,4,"Though the NZ Government has asked all Citizens to apply this system of Covid-19 contact tracing; I have spoken to a few retailers and physiotherapy clinics that decided not to install the Proprietary QR Code recording system because they found it ""a hassle""... ""Hello Beehive... Not much use to the cause if it's not utilized. Can this problem be solved?"" Therefore, I hope the word will spread. Isn't confidence in tracing supposed to support fast-tracking the economy? We need to be united.","  Though the NZ Government has asked all Citizens to apply this system of Covid-19 contact tracing; I have spoken to a few retailers and physiotherapy clinics that decided not to install the Proprietary QR Code recording system because they found it ""a hassle""... ""Hello Beehive... Not much use to the cause if it's not utilized. Can this problem be solved?"" Therefore  I hope the word will spread. Isn't confidence in tracing supposed to support fast-tracking the economy? We need to be united. ",en,  Though the NZ Government has asked all Citizens to apply this system of Covid    contact tracing  I have spoken to a few retailers and physiotherapy clinics that decided not to install the Proprietary QR Code recording system because they found it  a hassle      Hello Beehive    Not much use to the cause if it s not utilized  Can this problem be solved   Therefore  I hope the word will spread  Isn t confidence in tracing supposed to support fast tracking the economy  We need to be united  ,"Domain_Specific, Privacy","track, record, retail, unit",0.088888889,Positive,0,0,1,0,0,0,0,1,0
1012,5/29/20 1:45,nz.govt.health.covidtracer,NZ COVID Tracer,en,Pavel Valenta,1,"Doesn't work. Tried two times so far. AA car service, unable to scan at all. Nando's show invalid QR code message.",  Doesn't work. Tried two times so far. AA car service  unable to scan at all. Nando's show invalid QR code message. ,en,  Doesn t work  Tried two times so far  AA car service  unable to scan at all  Nando s show invalid QR code message  ,Domain_Specific,"servic, servic",0.125,Neutral,0,0,1,0,0,0,0,0,0
1016,5/29/20 0:30,nz.govt.health.covidtracer,NZ COVID Tracer,en,Roger Fraser,1,Simply incompatible with other tracking app QR codes. Whoever dreamt this up wasted taxpayers money,  Simply incompatible with other tracking app QR codes. Whoever dreamt this up wasted taxpayers money ,en,  Simply incompatible with other tracking app QR codes  Whoever dreamt this up wasted taxpayers money ,Privacy,track,0.090909091,Negative,0,0,0,0,0,0,0,1,0
1021,5/28/20 23:24,nz.govt.health.covidtracer,NZ COVID Tracer,en,Jemma Burland,1,"Tried to get the codes to work, nothing worked. I will not b keeping the app and stick to normal tracking by hand",  Tried to get the codes to work  nothing worked. I will not b keeping the app and stick to normal tracking by hand ,en,  Tried to get the codes to work  nothing worked  I will not b keeping the app and stick to normal tracking by hand ,"Domain_Specific, Privacy","track, normal",0.153846154,Positive,0,0,1,0,0,0,0,1,0
1022,5/28/20 23:12,nz.govt.health.covidtracer,NZ COVID Tracer,en,bryce green,1,"useless. why didn't the nz government make it compulsory for shops opening in level 2 ,to display the governments app QR. shops that have QR are running on a different system . have only come across a couple of stores with this apps QR. deleted app as pointless if shops don't have the QR . SAD.",  useless. why didn't the nz government make it compulsory for shops opening in level 2  to display the governments app QR. shops that have QR are running on a different system . have only come across a couple of stores with this apps QR. deleted app as pointless if shops don't have the QR . SAD. ,en,  useless  why didn t the nz government make it compulsory for shops opening in level    to display the governments app QR  shops that have QR are running on a different system   have only come across a couple of stores with this apps QR  deleted app as pointless if shops don t have the QR   SAD  ,"Domain_Specific, Emotional","sad, display, run, level",0.129032258,Negative,0,0,1,1,0,0,0,0,0
1023,5/28/20 22:32,nz.govt.health.covidtracer,NZ COVID Tracer,en,Stephen Smith,2,Only a digital diary. You are still required to register using pen and paper. Should be classed as beta software.,  Only a digital diary. You are still required to register using pen and paper. Should be classed as beta software. ,en,  Only a digital diary  You are still required to register using pen and paper  Should be classed as beta software  ,Domain_Specific,paper,0.083333333,Neutral,0,0,1,0,0,0,0,0,0
1025,5/28/20 17:09,nz.govt.health.covidtracer,NZ COVID Tracer,en,Murray Taylor,1,"Does not have the ability to manually recode data. Scan bar codes, etc. One would have to ask what value it has at all.",  Does not have the ability to manually recode data. Scan bar codes  etc. One would have to ask what value it has at all. ,en,  Does not have the ability to manually recode data  Scan bar codes  etc  One would have to ask what value it has at all  ,Privacy,data,0.076923077,Positive,0,0,0,0,0,0,0,1,0
1027,5/28/20 10:28,nz.govt.health.covidtracer,NZ COVID Tracer,en,Philippa Youard,1,"Very frustrating. Cant sign in as get to step 2 and am told 'username already exists' or invalid email address or 'Sorry error has occurred signing you in'. Am 100%sure my details are correct so totally unclear what is happening. Same result when I gave login a go (wondered if somehow in my multiple attempts I had somehow been signed in). Have given up in frustration, which is a pity as it could be useful... If it actually worked ðŸ˜’",  Very frustrating. Cant sign in as get to step 2 and am told 'username already exists' or invalid email address or 'Sorry error has occurred signing you in'. Am 100%sure my details are correct so totally unclear what is happening. Same result when I gave login a go (wondered if somehow in my multiple attempts I had somehow been signed in). Have given up in frustration  which is a pity as it could be useful... If it actually worked ðŸ˜’ ,en,  Very frustrating  Cant sign in as get to step   and am told  username already exists  or invalid email address or  Sorry error has occurred signing you in   Am     sure my details are correct so totally unclear what is happening  Same result when I gave login a go  wondered if somehow in my multiple attempts I had somehow been signed in   Have given up in frustration  which is a pity as it could be useful    If it actually worked   ,"Domain_Specific, Emotional","frustrat, address",0.05,Negative,0,0,1,1,0,0,0,0,0
1029,5/28/20 6:37,nz.govt.health.covidtracer,NZ COVID Tracer,en,Robert Uitime,5,Good idea for our country NEW ZEALAND.,  Good idea for our country NEW ZEALAND. ,en,  Good idea for our country NEW ZEALAND  ,"Language, Location","countri, countri",0.4,Positive,0,0,0,0,0,1,1,0,0
1030,5/28/20 6:20,nz.govt.health.covidtracer,NZ COVID Tracer,en,Dallas Mitchell,5,"I tried to scan a QR code the other day and it came up with an 'Invalid QR code' error message. It was an official QR code for this app and had the MoH logo at the bottom. Kinda weird. Also, can you please let us manually enter business details into the app (when a business doesn't have a QR code poster)? It would be even better if you allowed us to 'opt-in' to location sharing so places are added automatically. If possible, pulling locations from the Google Maps timeline would be good too.",  I tried to scan a QR code the other day and it came up with an 'Invalid QR code' error message. It was an official QR code for this app and had the MoH logo at the bottom. Kinda weird. Also  can you please let us manually enter business details into the app (when a business doesn't have a QR code poster)? It would be even better if you allowed us to 'opt-in' to location sharing so places are added automatically. If possible  pulling locations from the Google Maps timeline would be good too. ,en,  I tried to scan a QR code the other day and it came up with an  Invalid QR code  error message  It was an official QR code for this app and had the MoH logo at the bottom  Kinda weird  Also  can you please let us manually enter business details into the app  when a business doesn t have a QR code poster   It would be even better if you allowed us to  opt in  to location sharing so places are added automatically  If possible  pulling locations from the Google Maps timeline would be good too  ,"Domain_Specific, Privacy","locat, enter, locat, bottom, poster",0.096153846,Positive,0,0,1,0,0,0,0,1,0
1037,5/28/20 0:38,nz.govt.health.covidtracer,NZ COVID Tracer,en,Mike Davis,5,Seems to work fine on android 7. Had trouble registering 1st time around cos i's not reading the instructions. Is actually very easy. From other reviews i guess the demographic is impatient haters!,  Seems to work fine on android 7. Had trouble registering 1st time around cos i's not reading the instructions. Is actually very easy. From other reviews i guess the demographic is impatient haters! ,en,  Seems to work fine on android    Had trouble registering  st time around cos i s not reading the instructions  Is actually very easy  From other reviews i guess the demographic is impatient haters  ,Domain_Specific,demograph,0.05,Negative,0,0,1,0,0,0,0,0,0
1041,5/27/20 22:52,nz.govt.health.covidtracer,NZ COVID Tracer,en,David Hickman,1,My wife and I have the same email address. How does she get the app on her phone?,  My wife and I have the same email address. How does she get the app on her phone? ,en,  My wife and I have the same email address  How does she get the app on her phone  ,Domain_Specific,address,0.142857143,Neutral,0,0,1,0,0,0,0,0,0
1044,5/27/20 21:20,nz.govt.health.covidtracer,NZ COVID Tracer,en,Jill Watt,1,One mistake with entering the security number and you are locked out. Account is created but cannot be accessed!,  One mistake with entering the security number and you are locked out. Account is created but cannot be accessed! ,en,  One mistake with entering the security number and you are locked out  Account is created but cannot be accessed  ,"Domain_Specific, Privacy","secur, secur, enter, account",0.444444444,Positive,0,0,1,0,0,0,0,1,0
