,Date,AppID,AppName,Country,Author,Rating,Review,Title Review,Detected Language,content,issue,syn,issue_vio_id,sentiment,Age,Disability,Domain_Specific,Emotional,Gender,Language,Location,Privacy,Socio_economic_Status
270,10/4/20 13:12,com.thaialert.app,MorChana - หมอชนะ,th,Monkey D. Kum,3,ใช้งานยังไงคะ โหลดมาลงทะเบียนเรียบร้อยแล้วแต่ งงมาก ไม่เห็นจะมีแผนที่อะไรเหมือนในข่าวเลย," How do you use it? Loaded and registered, but I am very confused. I do not see any map like in the news. ",th, How do you use it  Loaded and registered  but I am very confused  I do not see any map like in the news  ,Emotional,confus,0.1,Neutral,0,,0,1,,0,0,0,0
273,10/4/20 12:38,com.thaialert.app,MorChana - หมอชนะ,de,prallo,1,Only in Thai language ! 555,   Only in Thai language ! 555  ,en,   Only in Thai language        ,Language,"thai, languag",0.666666667,Neutral,0,,0,0,,1,0,0,0
275,10/4/20 8:41,com.thaialert.app,MorChana - หมอชนะ,th,เพียงพิศ ทิมเย็น,5,มีโรคเป็นความดันสูงคะ, Have high blood pressure disease ,th, Have high blood pressure disease ,Emotional,pressur,0.25,Negative,0,,0,1,,0,0,0,0
277,10/4/20 6:22,com.thaialert.app,MorChana - หมอชนะ,th,โอ้โห ปลากระโห้นี่หว่า,5,เป็นกำลังใจให้คนไทยผ่านวิกฤตนี้ไปด้วยกันครับ, It is an encouragement for Thai people to go through this crisis together. ,th, It is an encouragement for Thai people to go through this crisis together  ,Language,thai,0.166666667,Negative,0,,0,0,,1,0,0,0
281,10/4/20 4:47,com.thaialert.app,MorChana - หมอชนะ,th,Jirawat Jannet,5,ใช้ง่ายดีครับ แต่ก็ง่ายจนไม่รู้ว่าเอาไว้ใช้ทำอะไร 555 แต่คิดว่าน่าจะมีอะไรแจ้งเตือนขึ้นมาตอนใช้ไปสักพักล่ะมั้ง / สามารถแนบรูปได้นะครับ ตรงที่ถ่ายรูปจะมี icon ขวาล่าง ที่เลือกรูปในเครื่องได้," Easy to use. But it's so easy that I don't know what to use for it, haha, but I think there will be a notification when using it for a while / can attach a picture. Where to take photos, there is an icon in the lower right that allows you to select a picture in your device ",th, Easy to use  But it s so easy that I don t know what to use for it  haha  but I think there will be a notification when using it for a while   can attach a picture  Where to take photos  there is an icon in the lower right that allows you to select a picture in your device ,Domain_Specific,attach,0.05,Positive,0,,1,0,,0,0,0,0