,Date,AppID,AppName,Country,Author,Rating,Review,Title Review,Detected Language,content,issue,syn,issue_vio_id,sentiment,Age,Disability,Domain_Specific,Emotional,Gender,Language,Location,Privacy,Socio_economic_Status
3,31/10/2020 18:05,com.healthcarekw.app,Shlonik - شلونك,ar,حسانين علام,1,البرنامج بش شغل عندي يقوال لي الرقم غير صحيح او غير مسجل وبقالي ٥ يوم داخل الكويت افدوان ايه الحل في غاية الاهميه," The program does not work for me. It tells me the number is incorrect or not registered, and I have 5 days inside Kuwait. ",ar, The program does not work for me  It tells me the number is incorrect or not registered  and I have   days inside Kuwait  ,Location,kuwait,0.1,Positive,,,0,0,0,0,1,0,0
6,30/10/2020 22:43,com.healthcarekw.app,Shlonik - شلونك,ar,Gfdggd Gfdffg,1,بعد تنزيل التطبيق لا يمكن فتحه؛؛؛؛, After downloading the application it cannot be opened ;;;; ,ar, After downloading the application it cannot be opened      ,Domain_Specific,applic,0.333333333,Neutral,,,1,0,0,0,0,0,0
7,30/10/2020 17:18,com.healthcarekw.app,Shlonik - شلونك,ar,محمد حجاج,1,بش عايز يفتح اي الحل يا جماعه ممكن حد يرد عليه," I want any solution, group, can anyone respond to it ",ar, I want any solution  group  can anyone respond to it ,Domain_Specific,respond,0.166666667,Positive,,,1,0,0,0,0,0,0
16,28/10/2020 7:00,com.healthcarekw.app,Shlonik - شلونك,ar,محمد محمد,5,الله يعطيكم العافيه و يزيح الغمة عن بلاد المسلمين, May Allah grant you wellness and remove the agony from Muslim countries ,ar, May Allah grant you wellness and remove the agony from Muslim countries ,"Domain_Specific, Language, Location","countri, countri, remov",0.375,Positive,,,1,0,0,1,1,0,0
20,26/10/2020 16:02,com.healthcarekw.app,Shlonik - شلونك,en,Rahul Bharti,5,Supar., Upset. ,id, Upset  ,Emotional,upset,1,Negative,,,0,1,0,0,0,0,0
24,25/10/2020 13:18,com.healthcarekw.app,Shlonik - شلونك,ar,احمد قرنى عبد الوهاب منصور,5,التطبيق لا يعمل هناك مشكله فى تحميل الصوره الشخصيه . ارجوا الرد," The application does not work, there is a problem in uploading the personal picture. Please answer ",ar, The application does not work  there is a problem in uploading the personal picture  Please answer ,Domain_Specific,"answer, applic",0.222222222,Negative,,,1,0,0,0,0,0,0
25,25/10/2020 8:55,com.healthcarekw.app,Shlonik - شلونك,en,Md Monower,5,Monowr Kuwait, Kuwait Monowr ,sw, Kuwait Monowr ,Location,kuwait,0.5,Neutral,,,0,0,0,0,1,0,0
32,22/10/2020 19:54,com.healthcarekw.app,Shlonik - شلونك,en,adel shaikh,2,"It is a flawed app... It gives silent reminders and always we have ""check in"" which is not ideal for everyone... What if someone misses a check in when he's in a bathroom? It's THAT annoying... Rest all it's an OK app for residents..","   It is a flawed app... It gives silent reminders and always we have ""check in"" which is not ideal for everyone... What if someone misses a check in when he's in a bathroom? It's THAT annoying... Rest all it's an OK app for residents..  ",en,   It is a flawed app    It gives silent reminders and always we have  check in  which is not ideal for everyone    What if someone misses a check in when he s in a bathroom  It s THAT annoying    Rest all it s an OK app for residents    ,Emotional,annoy,0.055555556,Negative,,,0,1,0,0,0,0,0
35,22/10/2020 11:52,com.healthcarekw.app,Shlonik - شلونك,ar,sameh fahmy,1,البرنامج مش بيفتح عندي بيعطي شاشه بيضاء ومش عارف اعمل ايه بالله عليكم اعطوني حل مع العلم انا داخل الكويت كمان اسبوع," The program will not open for me, I will be given a white screen, and I don’t know what to do with God. You should give me a solution, knowing that I’m in Kuwait also a week ",ar, The program will not open for me  I will be given a white screen  and I don t know what to do with God  You should give me a solution  knowing that I m in Kuwait also a week ,Location,kuwait,0.076923077,Positive,,,0,0,0,0,1,0,0
39,22/10/2020 2:47,com.healthcarekw.app,Shlonik - شلونك,en,Syed Munvar basha,5,It works perfectly after i complaining its error on airport authorities to give them my details which when i arrived in kuwait and my number and my location in kuwait After that they was send me notifications to register in this app on same number which i gave them to airport authorities and i was able to register within seconds (I REPEAT THOSE WHO SUFFERS FOR ERRORS CALL THE AIRPORT AUTHORITIES AND GIVE THEM YOUR FULL DETAILS THEY WILL FIX IT INSTANTLY,   It works perfectly after i complaining its error on airport authorities to give them my details which when i arrived in kuwait and my number and my location in kuwait After that they was send me notifications to register in this app on same number which i gave them to airport authorities and i was able to register within seconds (I REPEAT THOSE WHO SUFFERS FOR ERRORS CALL THE AIRPORT AUTHORITIES AND GIVE THEM YOUR FULL DETAILS THEY WILL FIX IT INSTANTLY  ,en,   It works perfectly after i complaining its error on airport authorities to give them my details which when i arrived in kuwait and my number and my location in kuwait After that they was send me notifications to register in this app on same number which i gave them to airport authorities and i was able to register within seconds  I REPEAT THOSE WHO SUFFERS FOR ERRORS CALL THE AIRPORT AUTHORITIES AND GIVE THEM YOUR FULL DETAILS THEY WILL FIX IT INSTANTLY  ,"Domain_Specific, Location, Privacy","kuwait, locat, author, locat, author",0.138888889,Negative,,,1,0,0,0,1,1,0
41,21/10/2020 12:04,com.healthcarekw.app,Shlonik - شلونك,ar,سالم الراجحي,1,احاول ارسل الصورة مايستقبلها البرنامج يقولي خطٱ اتصلت علي الدعم الفني لم يردو علي وشاشة الخريطة لاتظهر لي," I am trying to send the picture what the program is receiving, tell me a line ",ar, I am trying to send the picture what the program is receiving  tell me a line ,Domain_Specific,receiv,0.142857143,Neutral,,,1,0,0,0,0,0,0
42,21/10/2020 11:46,com.healthcarekw.app,Shlonik - شلونك,en,Othman Alabdulhadi,1,يدقون على ١٠٠ مره و ١٠٠ مره يدزون مسجات تقول سجل فى تطبيق شلونك. ادق عليهم على ١٥١ و على كل ارقامهم بعد ٤٩ دقيقه ردو على ١٥١ و سالت اذا مو مخالط و لا مسافر و لا مسحه ايجابيه ليش اسجل الموظفه قالت احطلك شكوى على البؤنامج الكلام الاسبوع تاة طاف و تستمر المسجات والاتصالات و دقيت ١٠.مرات و بعد انتظار ٣٠ دقيقه ردو و قالو نفس الفلم و تلفونى ما يسكت مكالمات و مسجات. يرجى الى عنده السالفه يساعدنى.," They tick 100 times and 100 times they record messages that say a record in the Shlonak app. I tell them on 151 and on all their numbers. After 49 minutes, respond to 151 and ask if there is no contact, no traveler, and no positive scan. Why do I record the employee? 30 minutes they answered and said the same movie and phone me that does not silence calls and messages. Please to have an ancestor help me. ",ar, They tick     times and     times they record messages that say a record in the Shlonak app  I tell them on     and on all their numbers  After    minutes  respond to     and ask if there is no contact  no traveler  and no positive scan  Why do I record the employee     minutes they answered and said the same movie and phone me that does not silence calls and messages  Please to have an ancestor help me  ,Domain_Specific,"record, respond, answer",0.090909091,Positive,,,1,0,0,0,0,0,0
54,17/10/2020 13:23,com.healthcarekw.app,Shlonik - شلونك,ar,abdelrahman elgammal,1,التطبيق اتحذف بدون إرادتي ويدخل رقم الموبيل والرقم المدني بيظهر خطأ ف الرقم," I delete the app without my will and enter the mobile number and the civil number, showing an error in the number ",ar, I delete the app without my will and enter the mobile number and the civil number  showing an error in the number ,Domain_Specific,enter,0.090909091,Negative,,,1,0,0,0,0,0,0
56,16/10/2020 22:16,com.healthcarekw.app,Shlonik - شلونك,ar,يوميات سمير و اميره,1,التطبيق مش رادى يتفعل بسجل رقم التليفون والرقم المدنى ، تظهر لى رساله تقول رقم الهاتف غير صحيح او غير مفعل ، جربت كذا رقم تظهر نفس الرسالة . وشكرا," The application does not respond to the phone number record and the civil number, I see a message saying the phone number is incorrect or not activated, I tried such a number showing the same message. Thank you ",ar, The application does not respond to the phone number record and the civil number  I see a message saying the phone number is incorrect or not activated  I tried such a number showing the same message  Thank you ,Domain_Specific,"record, respond, applic",0.15,Positive,,,1,0,0,0,0,0,0
59,16/10/2020 17:00,com.healthcarekw.app,Shlonik - شلونك,ar,Ali Shehata,3,لماذا تأتيني الشاشه بيضاء ولا يفتح لتسجيل البيانات, Why do I get a blank screen and does not open to record data ,ar, Why do I get a blank screen and does not open to record data ,"Domain_Specific, Privacy","data, record",0.25,Neutral,,,1,0,0,0,0,1,0
62,16/10/2020 11:14,com.healthcarekw.app,Shlonik - شلونك,ar,Mohamed Salem,5,التطبيق مش راضى يفتح بيعطينى شاشه بيضاء فقط ايه الحل," The application is not satisfied, it opens, it gives me a white screen only, what is the solution? ",ar, The application is not satisfied  it opens  it gives me a white screen only  what is the solution  ,Domain_Specific,applic,0.125,Neutral,,,1,0,0,0,0,0,0
64,15/10/2020 12:33,com.healthcarekw.app,Shlonik - شلونك,ar,محمد فكري,1,البرنامج مش شغال ورقم الخدمه مبيرودش علي احد حسبي الله ونعم الوكيل لو حد عنده معلومه ياريت يفيدنا," The program is not working and the service number is not working for me. May Allah be pleased with you, and yes, the agent. ",ar, The program is not working and the service number is not working for me  May Allah be pleased with you  and yes  the agent  ,Domain_Specific,"servic, servic",0.2,Positive,,,1,0,0,0,0,0,0
68,14/10/2020 13:51,com.healthcarekw.app,Shlonik - شلونك,ar,Taher Alshemali,1,فاشل جدا محد يرد على الاتصال," Very unsuccessful, Mohd answers the call ",ar, Very unsuccessful  Mohd answers the call ,Domain_Specific,answer,0.2,Negative,,,1,0,0,0,0,0,0
69,14/10/2020 7:20,com.healthcarekw.app,Shlonik - شلونك,en,jimmy Shah,2,"Even after 14 hours of landing I have not received any notification and request for selfie. Even I try to reach call centre of shlonik, nobody is picking up call.","   Even after 14 hours of landing I have not received any notification and request for selfie. Even I try to reach call centre of shlonik, nobody is picking up call.  ",en,   Even after    hours of landing I have not received any notification and request for selfie  Even I try to reach call centre of shlonik  nobody is picking up call   ,"Domain_Specific, Location","land, receiv",0.117647059,Neutral,,,1,0,0,0,1,0,0
70,14/10/2020 2:17,com.healthcarekw.app,Shlonik - شلونك,ar,abdo الخبير,3,تطبيق مهم جدا للمسافرين ل دولة الكويت مع شهادات p.c.r & هل يمكن ان استخدمه لمتابعة عدد حالات كورونا الاصابات و المتعافين مع انني لم اكن مسافر لا ذهاب ولا عودة," A very important application for travelers to the State of Kuwait with p.c.r certificates & can I use it to track the number of Corona cases, injuries and recoveries even though I was not traveling, neither going nor returning ",ar, A very important application for travelers to the State of Kuwait with p c r certificates   can I use it to track the number of Corona cases  injuries and recoveries even though I was not traveling  neither going nor returning ,"Domain_Specific, Location, Privacy","kuwait, track, import, applic",0.173913043,Positive,,,1,0,0,0,1,1,0
73,13/10/2020 12:17,com.healthcarekw.app,Shlonik - شلونك,ar,Badwe Awad,1,اليوم البرنامج بيعلق لا يحمل الصوره غير قادر علي التحميل الصوره," Today, the program gets suspended. It does not download the image. Unable to download the image ",ar, Today  the program gets suspended  It does not download the image  Unable to download the image ,Domain_Specific,imag,0.1,Negative,,,1,0,0,0,0,0,0
74,13/10/2020 9:20,com.healthcarekw.app,Shlonik - شلونك,ar,Mustafa Khalaf,1,التطبيق كل ما اشغله تجى شاشه بيضاء اعمل ايه," The application, all that I run is a white screen that I can do ",ar, The application  all that I run is a white screen that I can do ,Domain_Specific,"run, applic",0.5,Neutral,,,1,0,0,0,0,0,0
76,12/10/20 19:36,com.healthcarekw.app,Shlonik - شلونك,ar,Ahmed Barakat,5,تطبيق شلونك يظهر شاشة بيضاء, Shlonak application shows a white screen ,ar, Shlonak application shows a white screen ,Domain_Specific,applic,0.2,Neutral,,,1,0,0,0,0,0,0
80,12/10/20 13:45,com.healthcarekw.app,Shlonik - شلونك,ar,SHAFI Almarri,1,انا نزلت التطبيق وطلب مني صور تطلعلي رسال بالانجليزي معنها ان الصوره مو مقبول شنو الحل يازين طول اليوم وانا اصور سلفي ومايقبل . التنطيق فاشل . واخر شي تحملونا المسؤلية علي برنامج معفن للاسف يازين !!!!!!," I downloaded the application and he asked me for pictures that show me a message in English, meaning that the picture is not acceptable. What is the solution? The filing failed. And the last thing, they held us responsible for the Mafot program, unfortunately, Yazin !!!!!! ",ar, I downloaded the application and he asked me for pictures that show me a message in English  meaning that the picture is not acceptable  What is the solution  The filing failed  And the last thing  they held us responsible for the Mafot program  unfortunately  Yazin        ,"Domain_Specific, Language","english, applic",0.090909091,Negative,,,1,0,0,1,0,0,0
86,11/10/20 7:35,com.healthcarekw.app,Shlonik - شلونك,ar,أبو يوسف,1,تطبيق به مشكلة لايقبل تحميل الصورة بسهولة ودائما يعطي رسالة بان في خطأ في التحميل وتقييمي له بسيئ جدا, An application with a problem does not accept downloading the image easily and always gives a message that it is in an error in the download and my evaluation is very bad ,ar, An application with a problem does not accept downloading the image easily and always gives a message that it is in an error in the download and my evaluation is very bad ,Domain_Specific,"imag, applic",0.133333333,Negative,,,1,0,0,0,0,0,0
88,10/10/20 8:25,com.healthcarekw.app,Shlonik - شلونك,ar,Abdulrahman Alenezi,1,هناك مشكله بالتطبيق عند الدخول تظهر صفحه بيضاء, There is a problem with the application when entering a blank page appears ,ar, There is a problem with the application when entering a blank page appears ,Domain_Specific,"enter, applic",0.333333333,Negative,,,1,0,0,0,0,0,0
93,8/10/20 11:09,com.healthcarekw.app,Shlonik - شلونك,ar,Hgdgg Gfjgghh,1,السلام عليكم التطبيق نزل الجهاز ولكن مش راضى يفتح اه الحل انا لغيت التسبيت ونزلت مره اخري ولكن مش راضى يفتح التطبيق عشان احط البينات رقم التلفون والرقم المدنى ارجو الافادة," Peace be upon you. The application has downloaded the device, but I am not satisfied with it. Uh, the solution. ",ar, Peace be upon you  The application has downloaded the device  but I am not satisfied with it  Uh  the solution  ,Domain_Specific,applic,0.125,Positive,,,1,0,0,0,0,0,0
94,8/10/20 8:05,com.healthcarekw.app,Shlonik - شلونك,ar,منصور أبو النجا,1,التطبيق لا يفتح معي ارجو المساعدة لحل المشكلة, The application does not open with me please help to solve the problem ,ar, The application does not open with me please help to solve the problem ,Domain_Specific,applic,0.142857143,Positive,,,1,0,0,0,0,0,0
98,7/10/20 12:05,com.healthcarekw.app,Shlonik - شلونك,ar,Gamal Hassan,1,التطبيق مايفتح عندي كل ماافتحو يجيب خلفية بيضاء ارجو الافادة شنو الحل," The application does not open with me, all I open, answers a white background. Please advise what is the solution ",ar, The application does not open with me  all I open  answers a white background  Please advise what is the solution ,Domain_Specific,"answer, applic",0.2,Positive,,,1,0,0,0,0,0,0
101,6/10/20 17:00,com.healthcarekw.app,Shlonik - شلونك,ar,الـjjjــايب Old Man,1,تطبيق فاشل لتدخله بخصوصية الفرد فلا يمكنك من الدخول إلا بالسماح له بالوصول للكاميرا والفيديو وملفات الهاتف فمن وافق عليه مغيب ولا يعرف بمضمونه ومن أنشئ التطبيق متلصص قاصد كشف خصوصيات الناس . نجمه كثيره عليه لكثرة اخطاء تليفونات المراكز الصحيه . وبالرغم من وجود السوار يرسل مسجات مطالبه بالتسجيل ولا يتم قبول التسجيل وحتى 151 لا يجاوبون على الاتصال .," A failed application because it interferes with the privacy of the individual, so you cannot enter except by allowing him access to the camera, video and phone files. Whoever agreed to it is absent and does not know its content. A lot of star on him because of the many mistakes made by the health centers. Despite the presence of the bracelet, it sends records asking for registration, and registration is not accepted. Even 151, they do not answer the call. ",ar, A failed application because it interferes with the privacy of the individual  so you cannot enter except by allowing him access to the camera  video and phone files  Whoever agreed to it is absent and does not know its content  A lot of star on him because of the many mistakes made by the health centers  Despite the presence of the bracelet  it sends records asking for registration  and registration is not accepted  Even      they do not answer the call  ,"Domain_Specific, Privacy","privaci, record, enter, answer, applic",0.125,Negative,,,1,0,0,0,0,1,0
107,5/10/20 14:42,com.healthcarekw.app,Shlonik - شلونك,en,Kjja,1,"The application doesn't work! Ever since I arrived today at 7 am, I instantly installed and activated the application, I keep getting notifications that I should check in, however, when I go to heck in, I'm faced with this statement ""No check in is required currently"" additional the tracking doesn't seem to work even though I gave the application full access to my location all the time. This is rather disappointing and worrying as I keep getting these warning and I can't do anything about it.","   The application doesn't work! Ever since I arrived today at 7 am, I instantly installed and activated the application, I keep getting notifications that I should check in, however, when I go to heck in, I'm faced with this statement ""No check in is required currently"" additional the tracking doesn't seem to work even though I gave the application full access to my location all the time. This is rather disappointing and worrying as I keep getting these warning and I can't do anything about it.  ",en,   The application doesn t work  Ever since I arrived today at   am  I instantly installed and activated the application  I keep getting notifications that I should check in  however  when I go to heck in  I m faced with this statement  No check in is required currently  additional the tracking doesn t seem to work even though I gave the application full access to my location all the time  This is rather disappointing and worrying as I keep getting these warning and I can t do anything about it   ,"Domain_Specific, Emotional, Privacy","worri, locat, track, locat, applic",0.12195122,Negative,,,1,1,0,0,0,1,0
110,5/10/20 6:02,com.healthcarekw.app,Shlonik - شلونك,ar,احمد البيطانى,2,التطبيق ليفتح وبعدين الخلفيه تسير بيضاء ايه الحل," The application opens and then the background goes white, what is the solution? ",ar, The application opens and then the background goes white  what is the solution  ,Domain_Specific,applic,0.166666667,Positive,,,1,0,0,0,0,0,0
115,3/10/20 10:36,com.healthcarekw.app,Shlonik - شلونك,ar,mido gebali,2,"الحين ، كل ما اصور صورة للتسجيل تظهر عندي upload issue, please try later ما هو الحل . حتي اني اتصلت ب WIFI برضو نفس المشكلة موجودة"," Now, all I take is a picture of the recording. My upload issue, please try later. What is the solution? Even if I connect to WIFI, the same problem exists ",ar, Now  all I take is a picture of the recording  My upload issue  please try later  What is the solution  Even if I connect to WIFI  the same problem exists ,Domain_Specific,record,0.071428571,Positive,,,1,0,0,0,0,0,0
117,3/10/20 4:34,com.healthcarekw.app,Shlonik - شلونك,en,Ray,1,@ZAIN /@MOH / @CAIT :Please start replying to issues raised. This is so important for all of us What's your helpline number? Do you have anyone to answer calls 24X7?,   @ZAIN /@MOH / @CAIT :Please start replying to issues raised. This is so important for all of us What's your helpline number? Do you have anyone to answer calls 24X7?  ,en,    ZAIN   MOH    CAIT  Please start replying to issues raised  This is so important for all of us What s your helpline number  Do you have anyone to answer calls   X    ,Domain_Specific,"import, answer",0.125,Positive,,,1,0,0,0,0,0,0
119,2/10/20 13:48,com.healthcarekw.app,Shlonik - شلونك,en,bassam jamal,1,وايد يعلق وبين فترة والثانية توصلني مسجات اني ماسجلت دخول ولما ادخل غلى تطبيق شلونك يقولي ليس عليك التسجيل حاليا. وفوق هذا رقم التنبيهات اللي على ايكون الآب كل ماله ويزيد. اقترح وجود امكانية للتواصل مع الدعم الفني لتطبيق شلونك، لان وزارة الصحة مشكورة سنت عقوبات لعدم الملتزمين بالحجر فاذا كان تطبيق شلونك هو المعيار الوحيد فلازم يكون فعال ويشتغل بدون عيوب جوهرية مثل ما الكل قاعد يشتكي," Wade commented, and between a period and the second, I received messages that I logged in, and when I entered the Shlonak application, they say you do not have to register now. Above this is the number of alerts that the Father must have all his money and more. I suggest the possibility of contacting the technical support for the Shlonak application, because the Ministry of Health is kindly enacted penalties for not complying with the stone. If the Shlonak application is the only criterion, then it must be effective and operate without fundamental defects such as what everyone else is complaining about ",ar, Wade commented  and between a period and the second  I received messages that I logged in  and when I entered the Shlonak application  they say you do not have to register now  Above this is the number of alerts that the Father must have all his money and more  I suggest the possibility of contacting the technical support for the Shlonak application  because the Ministry of Health is kindly enacted penalties for not complying with the stone  If the Shlonak application is the only criterion  then it must be effective and operate without fundamental defects such as what everyone else is complaining about ,"Domain_Specific, Socio_economic_Status","technic, enter, receiv, father, comment, applic",0.130434783,Positive,,,1,0,0,0,0,0,1
121,1/10/20 21:29,com.healthcarekw.app,Shlonik - شلونك,ar,سيد عبد الجابر,1,انا نزلته علي التليفون وعندما قمت بتفعيله لايتفعل وتظهر شاشه بيضاء دون بيانات," I downloaded it on the phone and when I activated it, it does not activate and a white screen appears without data ",ar, I downloaded it on the phone and when I activated it  it does not activate and a white screen appears without data ,Privacy,data,0.1,Neutral,,,0,0,0,0,0,1,0
123,1/10/20 16:05,com.healthcarekw.app,Shlonik - شلونك,ar,Amde Hahg,1,التطبيق مش بيفتح الشاشه بيضه اعمل ايه," The application does not open the screen with an egg, what should I do? ",ar, The application does not open the screen with an egg  what should I do  ,Domain_Specific,applic,0.2,Neutral,,,1,0,0,0,0,0,0
124,30/09/2020 7:39,com.healthcarekw.app,Shlonik - شلونك,ar,ST Kw,5,قمت بعمل تطبيق شلونك بالتمام, I made the application Shlonak completely ,ar, I made the application Shlonak completely ,Domain_Specific,applic,0.25,Neutral,,,1,0,0,0,0,0,0
