,Date,AppID,AppName,Country,Author,Rating,Review,Title Review,Detected Language,content,issue,syn,issue_vio_id,sentiment,Age,Disability,Domain_Specific,Emotional,Gender,Language,Location,Privacy,Socio_economic_Status
263,30/07/2020 8:33,com.healthcarekw.app,Shlonik - شلونك,ar,Mahmoudhelmy Almeldeen,2,التطبيق لا يفتح على التليفون شاشة بيضاء فقط ولا يوجد اي بيانات," The application does not open on the phone a white screen only, and there is no data ",ar, The application does not open on the phone a white screen only  and there is no data ,"Domain_Specific, Privacy","data, applic",0.25,Negative,,,1,0,0,0,0,1,0
269,28/07/2020 1:13,com.healthcarekw.app,Shlonik - شلونك,ar,Hany Fawzy I,1,الطبيق لا يعمل ..., The application does not work ... ,ar, The application does not work     ,Domain_Specific,applic,0.333333333,Neutral,,,1,0,0,0,0,0,0
271,27/07/2020 9:04,com.healthcarekw.app,Shlonik - شلونك,ar,mm mmm,1,التطبيق يعلق ولا يفتح نرجوا معرفة السبب," The application hangs and does not open, please know the reason ",ar, The application hangs and does not open  please know the reason ,Domain_Specific,applic,0.142857143,Negative,,,1,0,0,0,0,0,0
272,27/07/2020 9:03,com.healthcarekw.app,Shlonik - شلونك,ar,Kuwaiti Kuwait,1,تطبيق اشلونك ما شغل بيقول الرقم غير مسجل ارجو الفاده ارجو الافادة ولكم جزيل الشكر," The Ashlonak application does not work, it says the number is not registered. Please inform me. Thank you very much ",ar, The Ashlonak application does not work  it says the number is not registered  Please inform me  Thank you very much ,Domain_Specific,applic,0.083333333,Positive,,,1,0,0,0,0,0,0
274,27/07/2020 5:28,com.healthcarekw.app,Shlonik - شلونك,ar,A. TYB ALEX,1,انا خارج البلاد ورقمي الكويتي يعمل جيدا وعند التفعيل لايصل كود الي الرقم .. قمت بالتجربه علي رقم محلي غير كويتي فتم قبوله ولكن مع الاحتفاظ بمفتاح الكويت 965 ولما حاولت تغييره مره اخري لايتم ارسال الكود فما العمل .!!," I am outside the country and my Kuwaiti number works well and upon activation the code does not reach the number .. I tried the experiment on a local non-Kuwaiti number, so it was accepted, but with keeping the Kuwait key 965, and when I tried to change it again, the code was not sent, so what should be done. !! ",ar, I am outside the country and my Kuwaiti number works well and upon activation the code does not reach the number    I tried the experiment on a local non Kuwaiti number  so it was accepted  but with keeping the Kuwait key      and when I tried to change it again  the code was not sent  so what should be done     ,"Domain_Specific, Language, Location","countri, countri, local, kuwait, outsid",0.185185185,Positive,,,1,0,0,1,1,0,0
276,26/07/2020 10:41,com.healthcarekw.app,Shlonik - شلونك,en,Vijayamma VD,1,It is not working in my phone. While opening the app the notification displays that connection to the server is unsuccessful.. pls do the need full its very urgent,   It is not working in my phone. While opening the app the notification displays that connection to the server is unsuccessful.. pls do the need full its very urgent  ,en,   It is not working in my phone  While opening the app the notification displays that connection to the server is unsuccessful   pls do the need full its very urgent  ,Domain_Specific,display,0.071428571,Neutral,,,1,0,0,0,0,0,0
282,24/07/2020 17:19,com.healthcarekw.app,Shlonik - شلونك,ar,محمدعادل عز,3,كيف ننزل التطبيق وخطوط هواتفى الكويتية سحبت من الشركه فى طريقه اخرى لتنزيل التطبيق شلون ك, How do we download the application and my Kuwaiti phone lines were withdrawn from the company in another way to download the application Shlonk ,ar, How do we download the application and my Kuwaiti phone lines were withdrawn from the company in another way to download the application Shlonk ,Domain_Specific,applic,0.083333333,Neutral,,,1,0,0,0,0,0,0
283,23/07/2020 9:54,com.healthcarekw.app,Shlonik - شلونك,ar,عادل عوض,1,انتظرت مده طويله جدا و لم تصلني رسالة التفعيل رغم محاولات كتييييره," I waited for a very long time, and I did not receive the activation message despite my efforts ",ar, I waited for a very long time  and I did not receive the activation message despite my efforts ,Domain_Specific,receiv,0.111111111,Neutral,,,1,0,0,0,0,0,0
293,9/7/20 20:19,com.healthcarekw.app,Shlonik - شلونك,en,MD ABBAS,5,برنامج جيد وفيد بخدماته, A good program and its services ,ar, A good program and its services ,Domain_Specific,"servic, servic",0.666666667,Positive,,,1,0,0,0,0,0,0
295,8/7/20 17:38,com.healthcarekw.app,Shlonik - شلونك,en,Shabeer Ahamed,1,Not working with Android 4.02. I must buy a new Telephone?,   Not working with Android 4.02. I must buy a new Telephone?  ,en,   Not working with Android       I must buy a new Telephone   ,Socio_economic_Status,buy,0.166666667,Neutral,,,0,0,0,0,0,0,1
296,8/7/20 8:58,com.healthcarekw.app,Shlonik - شلونك,ar,Ahmed Hmdey,1,يجمعه لوسمحتم انا سجلت في تطبيق شلونك بس بعده التطبيق اتمسح وكل ما اجاي اسجل يقولي الرقم غير صحيح وغير مسجل الرجاء الرد لو سمحتم," It collects it. I am registered in the Shlonak application, but after it the application is deleted, and all that I record says the number is incorrect and not registered. Please reply if you please ",ar, It collects it  I am registered in the Shlonak application  but after it the application is deleted  and all that I record says the number is incorrect and not registered  Please reply if you please ,Domain_Specific,"record, applic",0.142857143,Positive,,,1,0,0,0,0,0,0
298,7/7/20 14:54,com.healthcarekw.app,Shlonik - شلونك,en,noakhali sonapur,2,I m chef from bangladesh. I work in kuwait. I want to came agin. I love kuwait for ever,   I m chef from bangladesh. I work in kuwait. I want to came agin. I love kuwait for ever  ,en,   I m chef from bangladesh  I work in kuwait  I want to came agin  I love kuwait for ever  ,Location,"bangladesh, kuwait",0.2,Positive,,,0,0,0,0,1,0,0
300,5/7/20 19:17,com.healthcarekw.app,Shlonik - شلونك,en,Zubayer Hossain,1,I cant set my profile..worst app..,   I cant set my profile..worst app..  ,en,   I cant set my profile  worst app    ,Domain_Specific,profil,0.2,Negative,,,1,0,0,0,0,0,0
310,3/7/20 8:53,com.healthcarekw.app,Shlonik - شلونك,ar,azzazi Tolda,1,اسجل برقم الكويت ولا مصر, Register with the number of Kuwait or Egypt ,ar, Register with the number of Kuwait or Egypt ,Location,"kuwait, egypt",0.5,Positive,,,0,0,0,0,1,0,0
317,30/06/2020 7:33,com.healthcarekw.app,Shlonik - شلونك,ar,Omar Maher,1,جزاكم الله خيرا .. فيه رسائل تأتيني وتطالبني بتحميل التطبيق .. وعند تحميله لا يفتح البرنامج معي .. ولا أعرف ما السبب وما هو المطلوب مني .. ولماذا تأتيني رسائل على هاتفي تفيد بضرورة تحميل التطبيق .. وجزاكم الله كل خير," May God reward you with good .. It contains messages that come to me and ask me to download the application .. and when it is downloaded, the program does not open with me .. I do not know what the reason and what is required of me .. and why do I receive messages on my phone stating the need to download the application .. May God reward you all the best ",ar, May God reward you with good    It contains messages that come to me and ask me to download the application    and when it is downloaded  the program does not open with me    I do not know what the reason and what is required of me    and why do I receive messages on my phone stating the need to download the application    May God reward you all the best ,Domain_Specific,"receiv, applic",0.068965517,Positive,,,1,0,0,0,0,0,0
320,15/06/2020 7:48,com.healthcarekw.app,Shlonik - شلونك,ar,أبو حمزة,1,لا توجد به البيانات الخاصة بالشخص لا نستطيع معرفة الوقت المتبقى للحجر لا نستطيع معرفة هل هناك مسحة أخرى أم لا نداوم أم لا انتهت ال٢٨ يوم ولم يتم إرسال شهادة إنهاء العزل نروح المستوصف يقول تابع برنامج اشلونك وما فى أى جديد بالبرنامج.," It does not contain the person’s data. We cannot know the remaining time for the stone. We cannot know if there is another swab, or we do not attend or not. The 28 days have ended and the isolation termination certificate has not been sent. We go to the dispensary. ",ar, It does not contain the person s data  We cannot know the remaining time for the stone  We cannot know if there is another swab  or we do not attend or not  The    days have ended and the isolation termination certificate has not been sent  We go to the dispensary  ,Privacy,data,0.05,Negative,,,0,0,0,0,0,1,0
321,13/06/2020 6:00,com.healthcarekw.app,Shlonik - شلونك,ar,Nasser Moh,5,التطبيق لايستجيب شاشه بيضاء, The application does not respond to white screen ,ar, The application does not respond to white screen ,Domain_Specific,"respond, applic",0.4,Neutral,,,1,0,0,0,0,0,0
322,12/6/20 23:10,com.healthcarekw.app,Shlonik - شلونك,en,Michael Mann,1,Does not register date of release from quarantine unless I leave the area.,   Does not register date of release from quarantine unless I leave the area.  ,en,   Does not register date of release from quarantine unless I leave the area   ,Location,area,0.125,Negative,,,0,0,0,0,1,0,0
324,12/6/20 10:08,com.healthcarekw.app,Shlonik - شلونك,ar,حكاوي الصعيد,1,الرقم الي ع السوار غير الرقم الي موجود ف البرنامج اي الحل كل ما يقول سجل الصوره يكتب خطأ," The number to the bracelet is not the number that is present in the program, that is, the solution. Everything that says the image record writes an error ",ar, The number to the bracelet is not the number that is present in the program  that is  the solution  Everything that says the image record writes an error ,Domain_Specific,"record, imag, present",0.25,Negative,,,1,0,0,0,0,0,0
326,9/6/20 9:09,com.healthcarekw.app,Shlonik - شلونك,en,Sherin Shafi,5,Good application,   Good application  ,en,   Good application  ,Domain_Specific,applic,0.5,Positive,,,1,0,0,0,0,0,0
328,9/6/20 7:57,com.healthcarekw.app,Shlonik - شلونك,en,ABU FAHAD ABDULLAH FORSA INDRAMAYU,1,This is just an application to get information..can not do anything with this application,   This is just an application to get information..can not do anything with this application  ,en,   This is just an application to get information  can not do anything with this application  ,Domain_Specific,applic,0.2,Neutral,,,1,0,0,0,0,0,0
331,8/6/20 17:54,com.healthcarekw.app,Shlonik - شلونك,en,TOMCY K Thomas,5,Helpful application,   Helpful application  ,en,   Helpful application  ,Domain_Specific,applic,0.5,Positive,,,1,0,0,0,0,0,0
335,8/6/20 11:56,com.healthcarekw.app,Shlonik - شلونك,ar,مرحبا بك,1,التطبيق لا يعمل, The application does not work ,ar, The application does not work ,Domain_Specific,applic,0.333333333,Neutral,,,1,0,0,0,0,0,0
338,8/6/20 11:15,com.healthcarekw.app,Shlonik - شلونك,ar,OM ALBANIN,1,التطبيق لايقبل يقول الرقم غير مسجل؟؟," The application does not accept, says the number is not registered ?? ",ar, The application does not accept  says the number is not registered    ,Domain_Specific,applic,0.166666667,Negative,,,1,0,0,0,0,0,0
339,8/6/20 11:05,com.healthcarekw.app,Shlonik - شلونك,ar,Ck,1,حطيت رقم الجوال والرقم المدني ويقولي خطاء ارجوا متابعة واصلاح التطبيق," I put the mobile number and the civil number and they say a mistake, please follow up and fix the application ",ar, I put the mobile number and the civil number and they say a mistake  please follow up and fix the application ,Domain_Specific,"follow, applic",0.181818182,Positive,,,1,0,0,0,0,0,0
340,8/6/20 11:03,com.healthcarekw.app,Shlonik - شلونك,en,Khalil Alshatti,1,في شي غلط البرنامج اسجل البيانات الموبايل والرقم المدني يعطيني خطأ," In something wrong, the program is recording the mobile data and the civil number gives me an error ",ar, In something wrong  the program is recording the mobile data and the civil number gives me an error ,"Domain_Specific, Privacy","data, record",0.2,Negative,,,1,0,0,0,0,1,0
342,4/6/20 7:49,com.healthcarekw.app,Shlonik - شلونك,ar,يوسف العايدى,1,لاسف التطبيق مش ظاهر لي اي بيانات تخص فترة الحجر الصحي المتبقيه. رحت الطب الوقائي علشان كتاب انهاء فترة الحجز قالوا تطبيق شلونك هو اللي مسئول عن تقييم كل واحد. ولاسف التطبيق لا توجد به بيانات توضح ذلك," Unfortunately, the application does not show me any data regarding the remaining quarantine period. I went to preventive medicine because of the book ending the detention period, they said the Shlonak app is responsible for evaluating each one. Unfortunately, the application has no data to explain this ",ar, Unfortunately  the application does not show me any data regarding the remaining quarantine period  I went to preventive medicine because of the book ending the detention period  they said the Shlonak app is responsible for evaluating each one  Unfortunately  the application has no data to explain this ,"Domain_Specific, Privacy","data, applic",0.071428571,Negative,,,1,0,0,0,0,1,0
345,1/6/20 18:26,com.healthcarekw.app,Shlonik - شلونك,en,Sheeba Chandy,1,The application is not being supported in my phone.,   The application is not being supported in my phone.  ,en,   The application is not being supported in my phone   ,Domain_Specific,applic,0.333333333,Negative,,,1,0,0,0,0,0,0
348,25/05/2020 10:26,com.healthcarekw.app,Shlonik - شلونك,ar,gabarقناة وشاحى shalshal,5,اخي سلام وعليكم عند اخوي جهاز هاواوي بس برنامج اشلونك ما تفتح عنده شنهو السبب وشكرأ," My brother, peace be upon you, when my brother has a Huawei device, but the Shlonak program does not open for it ",ar, My brother  peace be upon you  when my brother has a Huawei device  but the Shlonak program does not open for it ,Domain_Specific,brother,0.1,Positive,,,1,0,0,0,0,0,0
350,23/05/2020 15:58,com.healthcarekw.app,Shlonik - شلونك,en,Jaafar Atch,1,"Very bad connection issues. At times only work with wifi, at others only work with mobile data . Very annoying","   Very bad connection issues. At times only work with wifi, at others only work with mobile data . Very annoying  ",en,   Very bad connection issues  At times only work with wifi  at others only work with mobile data   Very annoying  ,"Emotional, Privacy","annoy, data",0.142857143,Negative,,,0,1,0,0,0,1,0
357,16/05/2020 14:43,com.healthcarekw.app,Shlonik - شلونك,ar,خالد الشمري,1,لا تعليق, No comment ,ar, No comment ,Domain_Specific,comment,1,Negative,,,1,0,0,0,0,0,0
359,13/05/2020 15:14,com.healthcarekw.app,Shlonik - شلونك,ar,tawfiek el-husayn,3,جربت انجليزي وجربت عربي ...ماقام يرسلي كود التفعيل مع عدة محاولات لكن للأسف ما أرسل لي شي," I tried English and tried Arabic ... I wouldn't send me the activation code with several attempts, but unfortunately nothing was sent to me ",ar, I tried English and tried Arabic     I wouldn t send me the activation code with several attempts  but unfortunately nothing was sent to me ,Language,"arab, english",0.166666667,Negative,,,0,0,0,1,0,0,0
360,12/5/20 19:35,com.healthcarekw.app,Shlonik - شلونك,ar,ANAS ALDEHIMAN,5,من الجميل نرى التطور في دولتنا الحبيبه, It is nice to see the development in our beloved country ,ar, It is nice to see the development in our beloved country ,"Language, Location","countri, countri",0.4,Positive,,,0,0,0,1,1,0,0
363,5/5/20 14:50,com.healthcarekw.app,Shlonik - شلونك,ar,Fahad Alazmi,1,استخدم جهاز مشي في الغرفه وكل شوي طالعلي ابديت ازعجني," I used a walker in the room and every bit of it, it bothered me ",ar, I used a walker in the room and every bit of it  it bothered me ,Domain_Specific,walker,0.166666667,Negative,,,1,0,0,0,0,0,0
367,2/5/20 11:51,com.healthcarekw.app,Shlonik - شلونك,en,Mk Karam,4,I'm facing technical difficulties with detecting my braclet is this just me ??,   I'm facing technical difficulties with detecting my braclet is this just me ??  ,en,   I m facing technical difficulties with detecting my braclet is this just me     ,Socio_economic_Status,technic,0.2,Negative,,,0,0,0,0,0,0,1
368,2/5/20 11:04,com.healthcarekw.app,Shlonik - شلونك,ar,adnan rashed,1,هل من المفروض أخذ المعلومات كل ساعة في اليوم الواحد !!!.. التطبيق لايعمل بكفاءة إلا بعد الموافقة بالاذن على الدخول للبيانات والملفات الشخصية المخزنة في الجهاز !!! يجب جعل الأوامر الموجودة في التطبيق بأن تكون اختيارية وليست فرضية.., Is it necessary to take the information every hour per day !!! .. The application does not work efficiently except after approval with permission to enter the data and personal files stored in the device !!! The commands in the application should be made optional and not hypothetical. ,ar, Is it necessary to take the information every hour per day        The application does not work efficiently except after approval with permission to enter the data and personal files stored in the device     The commands in the application should be made optional and not hypothetical  ,"Domain_Specific, Privacy","data, command, command, enter, approv, applic",0.24,Positive,,,1,0,0,0,0,1,0
369,1/5/20 9:33,com.healthcarekw.app,Shlonik - شلونك,ar,Rawan zahr,1,البرنامج يرسل اكثر من رساله لتصوير سيلفي و لمه ادخل يطلع غير مطلوب و السوار في يدي يقول السوار ليس قريب," The program sends more than one message to shoot a selfie, and when I enter, it is not required, and the bracelet in my hand says the bracelet is not near ",ar, The program sends more than one message to shoot a selfie  and when I enter  it is not required  and the bracelet in my hand says the bracelet is not near ,Domain_Specific,enter,0.076923077,Positive,,,1,0,0,0,0,0,0
372,29/04/2020 12:21,com.healthcarekw.app,Shlonik - شلونك,ar,mysma111,1,اليوم توصل رسائل التذكير بكثرة ولما ادخل البرنامج لايوجد نفس قبل يرجي التسجيل..ارجوا تصليح البرنامج," Today, reminders received a lot, and when I entered the program, there is no breath before, please register..Please fix the program ",ar, Today  reminders received a lot  and when I entered the program  there is no breath before  please register  Please fix the program ,Domain_Specific,"enter, receiv",0.153846154,Positive,,,1,0,0,0,0,0,0
374,28/04/2020 22:43,com.healthcarekw.app,Shlonik - شلونك,ar,Amany Saad,1,وين التحديث الجديد تبع السوار؟ مو ظاهر معاي؟!, Where is the new update followed by the bracelet? Isn't it apparent with me ?! ,ar, Where is the new update followed by the bracelet  Isn t it apparent with me    ,Domain_Specific,follow,0.2,Neutral,,,1,0,0,0,0,0,0
375,25/04/2020 15:59,com.healthcarekw.app,Shlonik - شلونك,en,Khaled Alotaibi,2,الموقع يوديني مناطق ما قد طبيتها في الاساس ، وكل شوي داقين علي يسالوني وينك وقولهم في البيت ويدزون دكتور يتاكدون ، اخر شي يقولون ان علي 65 مخاله 😳 وانا قاعد بالبيت . ماادري شلون," The site leads me to some areas that I have medicated in the first place, and every little bit I need to ask me where are you and say them at home, and they call a doctor. They make sure, the last thing they say is that I have 65 males 😳 while I am staying at home. I don't know how ",ar, The site leads me to some areas that I have medicated in the first place  and every little bit I need to ask me where are you and say them at home  and they call a doctor  They make sure  the last thing they say is that I have    males   while I am staying at home  I don t know how ,"Domain_Specific, Gender, Location","male, area, medic",0.125,Positive,,,1,0,1,0,1,0,0
377,24/04/2020 12:14,com.healthcarekw.app,Shlonik - شلونك,en,Abeer Alsaedi,2,البرنامج مرات مايرسل اشعارات ولا مسج للتسجيل ويوصلني اتصال او مسج ان وصل لكن انا ما سجلت شلون احل هالمشكله," The program many times does not send notifications and does not record the registration, and it gives me a call or a message if it arrived, but I did not register how to solve this problem ",ar, The program many times does not send notifications and does not record the registration  and it gives me a call or a message if it arrived  but I did not register how to solve this problem ,Domain_Specific,record,0.0625,Negative,,,1,0,0,0,0,0,0
379,23/04/2020 2:47,com.healthcarekw.app,Shlonik - شلونك,en,dina shakhsher,2,"I download application , keep it open and start Bluetooth and always location on but application not track my movement , please solve this issue","   I download application , keep it open and start Bluetooth and always location on but application not track my movement , please solve this issue  ",en,   I download application   keep it open and start Bluetooth and always location on but application not track my movement   please solve this issue  ,"Domain_Specific, Privacy","locat, track, locat, applic",0.285714286,Positive,,,1,0,0,0,0,1,0
381,22/04/2020 11:00,com.healthcarekw.app,Shlonik - شلونك,ar,abeer_ San,5,جزاكم الله كل خير يا أيها الابطال الله يحفظكم و يحفظ ديرتنا الحبيبه الكويت ما قصرتو على راسي يالابطال," May God reward you, oh heroes, may God protect you and protect our beloved country Kuwait. ",ar, May God reward you  oh heroes  may God protect you and protect our beloved country Kuwait  ,"Language, Location, Privacy","countri, countri, kuwait, protect",0.333333333,Positive,,,0,0,0,1,1,1,0
383,21/04/2020 20:07,com.healthcarekw.app,Shlonik - شلونك,ar,Cati 83,1,موراضي يشتغل وياي كل ما ادخل عليه يطلعني من التطبيق," My path is working and oh, everything I enter will tell me from the application ",ar, My path is working and oh  everything I enter will tell me from the application ,Domain_Specific,"enter, applic",0.285714286,Neutral,,,1,0,0,0,0,0,0
387,20/04/2020 12:50,com.healthcarekw.app,Shlonik - شلونك,ar,R. A. Abdullah,5,حماكم الله ورعاكم.. متمنيا أن تزول هذا الوباء وتعود الحياة طبيعيه انشاء الله متمنيا للجميع الخير والسلام وراحه البال والتوفيق في حياتكم بظل عائلتكم والاحبة ووطننا الكويت الحبيبه..," May God protect you and take care of you .. wishing that this epidemic will disappear and life will return, God willing. ",ar, May God protect you and take care of you    wishing that this epidemic will disappear and life will return  God willing  ,Privacy,protect,0.090909091,Positive,,,0,0,0,0,0,1,0
391,20/04/2020 8:09,com.healthcarekw.app,Shlonik - شلونك,ar,Fawzi Salem,5,جزاكم الله خير مجهود جبار يشكر اللهم احفظ الكويت وأهلها من كل مكروه," May God reward you with the best and tremendous effort. Thank God, protect Kuwait and its people from all harm ",ar, May God reward you with the best and tremendous effort  Thank God  protect Kuwait and its people from all harm ,"Location, Privacy","kuwait, protect",0.166666667,Positive,,,0,0,0,0,1,1,0
395,19/04/2020 21:42,com.healthcarekw.app,Shlonik - شلونك,ar,مــنوعــات نـحـتـاجـهـا Gamez,5,اللهم ادفع عنا هذا البلاء واحفظنا بحفظك.. 🇰🇼❤️," Oh God, protect us from this scourge and protect us ... 🇰🇼❤️ ",ar, Oh God  protect us from this scourge and protect us          ,Privacy,protect,0.142857143,Positive,,,0,0,0,0,0,1,0
