,Date,AppID,AppName,Country,Author,Rating,Review,Title Review,Detected Language,content,issue,syn,issue_vio_id,sentiment,Age,Disability,Domain_Specific,Emotional,Gender,Language,Location,Privacy,Socio_economic_Status
126,29/09/2020 17:01,com.healthcarekw.app,Shlonik - شلونك,ar,صابر كو,2,التطبيق ينزل على التليفون ويتم إنشاء الاختصار لكن لم يسمح باستكمال البيانات للتفعيل," The application is downloaded to the phone and the shortcut is created, but it is not allowed to complete the data for activation ",ar, The application is downloaded to the phone and the shortcut is created  but it is not allowed to complete the data for activation ,"Domain_Specific, Privacy","data, applic",0.222222222,Positive,,,1,0,0,0,0,1,0
128,29/09/2020 9:01,com.healthcarekw.app,Shlonik - شلونك,ar,Saad Alanze,2,انا نزلت التطبيق فور وصولي للمنزل وعند المنفذ لم يكن عندي نت ومن امس لم يردني اي رسالة رغم وصول كود التفعيل لا أعلم ماهو الوضع علما بأني اتصلت على الخط الساخن 151ولم يرد احد، لا أعرف من اتواصل معاه," I downloaded the application as soon as I arrived at home and at the port I did not have the net and yesterday he did not receive any message despite the arrival of the activation code, I do not know what the situation is, knowing that I called the hotline 151 and no one answered, I do not know whom to contact with ",ar, I downloaded the application as soon as I arrived at home and at the port I did not have the net and yesterday he did not receive any message despite the arrival of the activation code  I do not know what the situation is  knowing that I called the hotline     and no one answered  I do not know whom to contact with ,Domain_Specific,"receiv, answer, applic",0.125,Negative,,,1,0,0,0,0,0,0
136,27/09/2020 9:10,com.healthcarekw.app,Shlonik - شلونك,ar,احمد رفاعي,1,التطبيق لا يفتح عندى ما السبب, The application does not open for me what is the reason ,ar, The application does not open for me what is the reason ,Domain_Specific,applic,0.25,Neutral,,,1,0,0,0,0,0,0
138,26/09/2020 10:18,com.healthcarekw.app,Shlonik - شلونك,ar,سورياحبيبتي سوريا,5,البرنامج لاستقبال صورتي الرجاء إصلاح العطل وشكرا, Program to receive my picture please fix the malfunction and thank you ,ar, Program to receive my picture please fix the malfunction and thank you ,Domain_Specific,receiv,0.142857143,Positive,,,1,0,0,0,0,0,0
142,25/09/2020 16:18,com.healthcarekw.app,Shlonik - شلونك,ar,Atef Atef,5,التحميل في التطبيق ضعيف جدا جدا," The download in the application is very, very weak ",ar, The download in the application is very  very weak ,Domain_Specific,applic,0.2,Negative,,,1,0,0,0,0,0,0
143,25/09/2020 5:20,com.healthcarekw.app,Shlonik - شلونك,en,Muhammad Imran,1,"My phone notifaction coming but no open & some time no rining.i tomuch time contact center call but no answer .can i reinstall ap after register second time .please advice, i am in quratine","   My phone notifaction coming but no open & some time no rining.i tomuch time contact center call but no answer .can i reinstall ap after register second time .please advice, i am in quratine  ",en,   My phone notifaction coming but no open   some time no rining i tomuch time contact center call but no answer  can i reinstall ap after register second time  please advice  i am in quratine  ,Domain_Specific,answer,0.05,Negative,,,1,0,0,0,0,0,0
150,23/09/2020 0:20,com.healthcarekw.app,Shlonik - شلونك,ar,ميمو مرامي,1,نزلت التطبيق ونفس المشكله ومايردون عل تلفون وابي حل ضروري," I downloaded the application and the same problem, and they don't answer on my phone, and I want a necessary solution ",ar, I downloaded the application and the same problem  and they don t answer on my phone  and I want a necessary solution ,Domain_Specific,"answer, applic",0.25,Neutral,,,1,0,0,0,0,0,0
155,20/09/2020 18:23,com.healthcarekw.app,Shlonik - شلونك,ar,A Dr,2,لا يعمل هذا التطبيق, This application does not work ,ar, This application does not work ,Domain_Specific,applic,0.333333333,Neutral,,,1,0,0,0,0,0,0
156,20/09/2020 13:19,com.healthcarekw.app,Shlonik - شلونك,ar,Abu Mido,1,كلما احاول ابعت الصوة تظهر رسالة خطأ فى تحميل الصورة مما قد يسبب مشكلة مع المختصين عن متابعة الحجر المنزلى وقد حاولت الاتصال بالدعم الفنى ولا مجيب ...رجاء اصلحوا هذا المشكلة الفنية," Whenever I try to send the image, an error message appears in uploading the image, which may cause a problem with the specialists about following the home quarantine, and I tried to contact technical support and no one answered ... Please fix this technical problem ",ar, Whenever I try to send the image  an error message appears in uploading the image  which may cause a problem with the specialists about following the home quarantine  and I tried to contact technical support and no one answered     Please fix this technical problem ,"Domain_Specific, Socio_economic_Status","technic, imag, follow, answer, specialist",0.192307692,Negative,,,1,0,0,0,0,0,1
157,20/09/2020 10:09,com.healthcarekw.app,Shlonik - شلونك,en,Mohammad Alhusaini,2,الاشعارات بدون صوت و مرات ما فيه اصلا و بعدين يقولك ليش ما تستجيب للاشعار, Notifications without sound and times what is in it originally and two dimensions tells you why do not respond to the notification ,ar, Notifications without sound and times what is in it originally and two dimensions tells you why do not respond to the notification ,Domain_Specific,respond,0.090909091,Neutral,,,1,0,0,0,0,0,0
162,19/09/2020 10:33,com.healthcarekw.app,Shlonik - شلونك,ar,Mas Mas,1,التطبيق يعطي رسالة خطأ عند التصوير والمتابعة( an error occurred . Upload issue. Please try again later. .. شو الحل للضرورة القصوى . مافي رقم نتواصل لحل مشاكل التطبيق وتطبيق بهذه الاهمية ...؟؟؟, The application gives an error message when photographing and following up (an error occurred. Upload issue. Please try again later. .. What is the solution absolutely necessary. No number we communicate to solve application problems and an application of this importance ... ??? ,ar, The application gives an error message when photographing and following up  an error occurred  Upload issue  Please try again later     What is the solution absolutely necessary  No number we communicate to solve application problems and an application of this importance         ,Domain_Specific,"communic, import, follow, photograph, applic",0.217391304,Neutral,,,1,0,0,0,0,0,0
166,18/09/2020 14:03,com.healthcarekw.app,Shlonik - شلونك,ar,Om Fahad,4,تطبيق يحرص على صحة المسافر عند عودته وعلى اللي حواليه, An application that is keen on the health of the traveler upon his return and those around him ,ar, An application that is keen on the health of the traveler upon his return and those around him ,Domain_Specific,applic,0.142857143,Positive,,,1,0,0,0,0,0,0
168,17/09/2020 20:18,com.healthcarekw.app,Shlonik - شلونك,ar,الحياه حلوه,2,مش شغال التطبيق بيجبلى شاشة بيضة ايه الحل," Do not run the application on the egg screen, what is the solution? ",ar, Do not run the application on the egg screen  what is the solution  ,Domain_Specific,"run, applic",0.4,Positive,,,1,0,0,0,0,0,0
172,16/09/2020 13:52,com.healthcarekw.app,Shlonik - شلونك,en,Google User,1,"An app that tracks everything you do in the name of the ""greater good"", that's dystopian level of hypocrisy.","   An app that tracks everything you do in the name of the ""greater good"", that's dystopian level of hypocrisy.  ",en,   An app that tracks everything you do in the name of the  greater good   that s dystopian level of hypocrisy   ,"Domain_Specific, Privacy","track, level",0.222222222,Positive,,,1,0,0,0,0,1,0
175,15/09/2020 12:51,com.healthcarekw.app,Shlonik - شلونك,en,hani hussam,1,"Worst app ever when I try to check in it keeps telling me location error, so I restart my location and reconnect to the internet again and keep changing my place in home and the error message keeps appearing.","   Worst app ever when I try to check in it keeps telling me location error, so I restart my location and reconnect to the internet again and keep changing my place in home and the error message keeps appearing.  ",en,   Worst app ever when I try to check in it keeps telling me location error  so I restart my location and reconnect to the internet again and keep changing my place in home and the error message keeps appearing   ,"Domain_Specific, Privacy","locat, locat",0.095238095,Negative,,,1,0,0,0,0,1,0
177,15/09/2020 1:18,com.healthcarekw.app,Shlonik - شلونك,en,John Q Public,1,No option to reset personal information when registering. Tried contacting the number provided but no answer. Folks calling from international locations have been wasting money on international calling charges after spending significant time waiting for an answer. And no contact via email or an accurate number is given to contact.,   No option to reset personal information when registering. Tried contacting the number provided but no answer. Folks calling from international locations have been wasting money on international calling charges after spending significant time waiting for an answer. And no contact via email or an accurate number is given to contact.  ,en,   No option to reset personal information when registering  Tried contacting the number provided but no answer  Folks calling from international locations have been wasting money on international calling charges after spending significant time waiting for an answer  And no contact via email or an accurate number is given to contact   ,"Domain_Specific, Privacy","locat, locat, answer",0.096774194,Negative,,,1,0,0,0,0,1,0
178,14/09/2020 18:15,com.healthcarekw.app,Shlonik - شلونك,en,Muscle Mania,3,As i proceeded to register as soon as i reached my home in fahaheel it still shows me that i am on airport road number 51. There is no helpline number or any option to update location.,   As i proceeded to register as soon as i reached my home in fahaheel it still shows me that i am on airport road number 51. There is no helpline number or any option to update location.  ,en,   As i proceeded to register as soon as i reached my home in fahaheel it still shows me that i am on airport road number     There is no helpline number or any option to update location   ,"Domain_Specific, Privacy","locat, locat",0.117647059,Negative,,,1,0,0,0,0,1,0
186,11/9/20 3:37,com.healthcarekw.app,Shlonik - شلونك,ar,ربي احفظ الكويت 188,3,السلام عليكم اخواني الدعم الفني في تطبيق شلونك عندي سؤال ابي اتسبح عشان انزل الحرارة هل انزل الاسواره لاني مريض كرونا وحجر منزلي ؟ارجو من اخواني عدم الطلب كثيرا التصوير لثبوت حضوري لاني تعبانه جدا ويصعب علي كل شوي اقوم من السرير واصور ارجو مراعاة ضروفي الصحيه والنفسيه وشكرا," Peace be upon you, my brothers, technical support in the Shlonak application. I have a question, my father, to swim in order to bring down the heat, do I go down the walls because I am sick with Corona and a home quarantine? ",ar, Peace be upon you  my brothers  technical support in the Shlonak application  I have a question  my father  to swim in order to bring down the heat  do I go down the walls because I am sick with Corona and a home quarantine  ,"Domain_Specific, Emotional, Socio_economic_Status","sick, technic, brother, swim, father, applic, order",0.35,Positive,,,1,1,0,0,0,0,1
203,4/9/20 17:59,com.healthcarekw.app,Shlonik - شلونك,ar,seher alsharq,1,برنامجكم بصراحة مزعج و يعلق كلما احط صورة يقول خطأ و كل ساعة تدقون علي و ترسلون مسج اكتشفت بالنهاية ان برنامجكم محتاج التصليح الرجاء عدم إزعاج الناس المرضى الله يهديكم و يصلحكم و يغفر ذنوبكم و يسامحكم," Your program is frankly annoying and gets stuck every time a picture says wrongly, and every hour you knock on me and send a sheet, I discovered in the end that your program needs to be fixed. Please do not disturb sick people. May God guide you and fix you and forgive your sins and forgive you ",ar, Your program is frankly annoying and gets stuck every time a picture says wrongly  and every hour you knock on me and send a sheet  I discovered in the end that your program needs to be fixed  Please do not disturb sick people  May God guide you and fix you and forgive your sins and forgive you ,"Domain_Specific, Emotional","sick, annoy, guid",0.096774194,Positive,,,1,1,0,0,0,0,0
206,3/9/20 19:37,com.healthcarekw.app,Shlonik - شلونك,en,sarfaraz lokhande,1,I tried to login this aap but not open written to error.write down a no I call them but not answering the call how to fix him pls help me.,   I tried to login this aap but not open written to error.write down a no I call them but not answering the call how to fix him pls help me.  ,en,   I tried to login this aap but not open written to error write down a no I call them but not answering the call how to fix him pls help me   ,Domain_Specific,answer,0.076923077,Negative,,,1,0,0,0,0,0,0
207,3/9/20 15:35,com.healthcarekw.app,Shlonik - شلونك,en,amal almutawaa,2,التسجيل الصوتي في مشكلة عندي ومافي طريقة للتواصل أو الاستفسار في التطبيق, The audio recording is in my problem and there is no way to communicate or inquire in the application ,ar, The audio recording is in my problem and there is no way to communicate or inquire in the application ,Domain_Specific,"record, communic, applic",0.428571429,Negative,,,1,0,0,0,0,0,0
208,2/9/20 22:37,com.healthcarekw.app,Shlonik - شلونك,es,JOSE RODRIGUEZ,1,"In the law sectiion...it is Just in Arabi, can be use in English too. Please.","   In the law sectiion...it is Just in Arabi, can be use in English too. Please.  ",en,   In the law sectiion   it is Just in Arabi  can be use in English too  Please   ,Language,english,0.166666667,Positive,,,0,0,0,1,0,0,0
209,2/9/20 22:01,com.healthcarekw.app,Shlonik - شلونك,ar,ابو محمد بني يحيا,1,تطبيق شلونك لايعمل B8, Shlonak application does not work B8 ,ar, Shlonak application does not work B  ,Domain_Specific,applic,0.2,Neutral,,,1,0,0,0,0,0,0
212,1/9/20 6:41,com.healthcarekw.app,Shlonik - شلونك,en,Talal AlMuhanna,1,"Very bad app wit h many bugs in it. It asks me for an update, but it doesn't receive the updated when I give it. Very stupid app","   Very bad app wit h many bugs in it. It asks me for an update, but it doesn't receive the updated when I give it. Very stupid app  ",en,   Very bad app wit h many bugs in it  It asks me for an update  but it doesn t receive the updated when I give it  Very stupid app  ,Domain_Specific,receiv,0.066666667,Negative,,,1,0,0,0,0,0,0
214,30/08/2020 12:33,com.healthcarekw.app,Shlonik - شلونك,ar,Hussain Alhussain,2,سلام عليكم الي يومين احاول انزل البرنامج مو راضي والرقم محدا يرد إيش اسوي," Peace be upon you. For two days, I have been trying to download the program, I am not satisfied, and the number does not answer, What should I do? ",ar, Peace be upon you  For two days  I have been trying to download the program  I am not satisfied  and the number does not answer  What should I do  ,Domain_Specific,answer,0.090909091,Positive,,,1,0,0,0,0,0,0
215,30/08/2020 10:29,com.healthcarekw.app,Shlonik - شلونك,en,Spawn,1,"-No audible sounds on notifications -Notifications doesn't disappear after opening the app.(Sometimes need to open the app 3-5 times to make them disappear) -Even after they disappear, you will get it in 10 mins again which is frustrating. -I can't check in due to a bug in the app or the servers are overloaded. (After taking a selfie, pressing ""proceed"" just makes the button freeze on loading animation.) For a mandatory, nation-wide health application, these bugs are not acceptable at all.","   -No audible sounds on notifications -Notifications doesn't disappear after opening the app.(Sometimes need to open the app 3-5 times to make them disappear) -Even after they disappear, you will get it in 10 mins again which is frustrating. -I can't check in due to a bug in the app or the servers are overloaded. (After taking a selfie, pressing ""proceed"" just makes the button freeze on loading animation.) For a mandatory, nation-wide health application, these bugs are not acceptable at all.  ",en,    No audible sounds on notifications  Notifications doesn t disappear after opening the app  Sometimes need to open the app     times to make them disappear   Even after they disappear  you will get it in    mins again which is frustrating   I can t check in due to a bug in the app or the servers are overloaded   After taking a selfie  pressing  proceed  just makes the button freeze on loading animation   For a mandatory  nation wide health application  these bugs are not acceptable at all   ,"Domain_Specific, Emotional","frustrat, anim, button, applic",0.097560976,Negative,,,1,1,0,0,0,0,0
216,27/08/2020 14:05,com.healthcarekw.app,Shlonik - شلونك,ar,suood,1,برنامج..فاشل..وخايب.وانتهاك خصوصية الناس في بيوتهم. وحرام فيه النجمة...وخسارة ضيعت وقتي تحميل برنامج غبي.لايفتح بسرعة...وتظهر لي الشاشة بيضاء معلق اكثر من ساعتين احاول افتحة ولكن لاجدوى منة وخريطة الموقع..بدائية وقديمة ويوجد اخطاء في العناوين..والمحافظات..اللى وضع..هذا البرنامج..لايعرف التقسيم الاداري للمحافظات..انا اسكن في محافظة مبارك الكبير...ومنطقة سكني جعلوها تتبع.حولي..تخبط اداري لامثيل له يجب محاسبة هذا العبقري الفلتة الذي برمج..هذا.البرنامج ومحاسبتة على جهلة..ونسبة الغباء العالية لدية.," A program..Failed ... and disappointed, and violating people's privacy in their homes. It is forbidden for the star ... and a loss I wasted my time downloading a stupid program. It does not open quickly ... and a white screen appears hanging for more than two hours. I try to open it, but it is useless. This program .. does not know the administrative division of the governorates..I live in Mubarak al-Kabeer governorate ... and a residential area that they made follow. Around me ... an unparalleled administrative confusion that must be held accountable for this sloppy genius who programmed ... this program. High has. ",ar, A program  Failed     and disappointed  and violating people s privacy in their homes  It is forbidden for the star     and a loss I wasted my time downloading a stupid program  It does not open quickly     and a white screen appears hanging for more than two hours  I try to open it  but it is useless  This program    does not know the administrative division of the governorates  I live in Mubarak al Kabeer governorate     and a residential area that they made follow  Around me     an unparalleled administrative confusion that must be held accountable for this sloppy genius who programmed     this program  High has  ,"Domain_Specific, Emotional, Location, Privacy","confus, area, privaci, governor, follow, account",0.111111111,Negative,,,1,1,0,0,1,1,0
218,27/08/2020 7:49,com.healthcarekw.app,Shlonik - شلونك,ar,احمد عمر,5,يعطيكم العافيه علي الاهتمام وحفظ الله الكويت, Gives you wellness on the attention and God save Kuwait ,ar, Gives you wellness on the attention and God save Kuwait ,Location,kuwait,0.166666667,Positive,,,0,0,0,0,1,0,0
221,26/08/2020 15:27,com.healthcarekw.app,Shlonik - شلونك,en,Ahmad Al-Faqih,1,"Whenever I try to send my selfi, an error occurs saying no location available.","   Whenever I try to send my selfi, an error occurs saying no location available.  ",en,   Whenever I try to send my selfi  an error occurs saying no location available   ,"Domain_Specific, Privacy","locat, locat",0.222222222,Negative,,,1,0,0,0,0,1,0
227,22/08/2020 17:40,com.healthcarekw.app,Shlonik - شلونك,en,Ibrahim Badshah,2,"App is good, now i stopped receiving notifications and missed many picture uploads. Dont know where to contact","   App is good, now i stopped receiving notifications and missed many picture uploads. Dont know where to contact  ",en,   App is good  now i stopped receiving notifications and missed many picture uploads  Dont know where to contact  ,Domain_Specific,receiv,0.083333333,Negative,,,1,0,0,0,0,0,0
243,12/8/20 3:26,com.healthcarekw.app,Shlonik - شلونك,en,Domagoj Švagelj,1,"It gives me a notification that a check in is required, and when I click on it, the app says no check in is needed at this time and I can't check in. Then I receive a phone call that I missed the check in??","   It gives me a notification that a check in is required, and when I click on it, the app says no check in is needed at this time and I can't check in. Then I receive a phone call that I missed the check in??  ",en,   It gives me a notification that a check in is required  and when I click on it  the app says no check in is needed at this time and I can t check in  Then I receive a phone call that I missed the check in    ,Domain_Specific,receiv,0.0625,Negative,,,1,0,0,0,0,0,0
244,11/8/20 18:53,com.healthcarekw.app,Shlonik - شلونك,en,ali aslan,1,I cant chekin... I have received push not. But checkin says no need to chekinnnn,   I cant chekin... I have received push not. But checkin says no need to chekinnnn  ,en,   I cant chekin    I have received push not  But checkin says no need to chekinnnn  ,Domain_Specific,receiv,0.125,Negative,,,1,0,0,0,0,0,0
250,9/8/20 10:24,com.healthcarekw.app,Shlonik - شلونك,en,Rasha Ezzeddine,3,Haven't used it yet but it's not allowing me to fix or update my flight details and also missing a contact section,   Haven't used it yet but it's not allowing me to fix or update my flight details and also missing a contact section  ,en,   Haven t used it yet but it s not allowing me to fix or update my flight details and also missing a contact section  ,Domain_Specific,section,0.090909091,Negative,,,1,0,0,0,0,0,0
251,8/8/20 16:58,com.healthcarekw.app,Shlonik - شلونك,en,Munther Abu Doleh,3,انا مسجل في شلونك لكن رقمي الكويتي أصبح خارج الخدمة انفصل ، حاولت استخدم رقمي الأردني لكن ما انحلت المشكلة ، شلون ممكن تنحل، انا حاليا خارج الكويت و في المطار احتاج التطبيق.," I am registered in Shlonak, but my Kuwaiti number has become out of service, it has been disconnected, I tried to use my Jordanian number, but the problem has not been resolved. How can it be resolved, I am currently outside Kuwait and at the airport I need the application. ",ar, I am registered in Shlonak  but my Kuwaiti number has become out of service  it has been disconnected  I tried to use my Jordanian number  but the problem has not been resolved  How can it be resolved  I am currently outside Kuwait and at the airport I need the application  ,"Domain_Specific, Location","kuwait, servic, servic, outsid, applic",0.25,Negative,,,1,0,0,0,1,0,0
254,5/8/20 3:53,com.healthcarekw.app,Shlonik - شلونك,en,Amna Elsheikh,1,I cannot receive the the otp code,   I cannot receive the the otp code  ,en,   I cannot receive the the otp code  ,Domain_Specific,receiv,0.333333333,Neutral,,,1,0,0,0,0,0,0
260,31/07/2020 12:41,com.healthcarekw.app,Shlonik - شلونك,en,khaled mandani,1,",my request not close and i cant do any requeat and I can not do a counseling ، and 22092424 no body answer","   ,my request not close and i cant do any requeat and I can not do a counseling ، and 22092424 no body answer  ",en,    my request not close and i cant do any requeat and I can not do a counseling   and          no body answer  ,Domain_Specific,"answer, counsel",0.25,Negative,,,1,0,0,0,0,0,0
261,30/07/2020 21:25,com.healthcarekw.app,Shlonik - شلونك,ar,nasser alessa,5,يعطيكم اللف عافيه علي الجود الطيبه وكله لج الكويت يهون وعسى ربي يحفظكم من كل شر يارب وعساكم علي القوه," The rewards give you well-being on good generosity, and all of it is in Kuwait. May God protect you from all evil, O Lord, and may you be in strength ",ar, The rewards give you well being on good generosity  and all of it is in Kuwait  May God protect you from all evil  O Lord  and may you be in strength ,"Location, Privacy","kuwait, protect",0.153846154,Positive,,,0,0,0,0,1,1,0
