,Date,AppID,AppName,Country,Version,Author,Rating,Title,Review,Title Review,Detected Language,content,issue,syn,issue_vio_id,sentiment,Age,Disability,Domain_Specific,Emotional,Gender,Language,Location,Privacy,Socio_economic_Status
251,6/5/20 2:05,1498276074,TraceTogether,sg,,Potatochips78,3,Please also include Birth Certificate option,"Would be helpful to include Birth Certificate option so that upper primary and secondary students can also create their own profile and maximise the usage and efficiency of this tracking app. Majority of them would have to travel back home and also own a mobile phone, but unable to create profile because they don’t have NRIC.", Please also include Birth Certificate option Would be helpful to include Birth Certificate option so that upper primary and secondary students can also create their own profile and maximise the usage and efficiency of this tracking app. Majority of them would have to travel back home and also own a mobile phone  but unable to create profile because they don’t have NRIC. ,en, Please also include Birth Certificate option Would be helpful to include Birth Certificate option so that upper primary and secondary students can also create their own profile and maximise the usage and efficiency of this tracking app  Majority of them would have to travel back home and also own a mobile phone  but unable to create profile because they don t have NRIC  ,"Age, Domain_Specific, Privacy","student, track, profil, student",0.108108108,Positive,1,0,1,0,0,0,0,1,0
257,6/4/20 12:00,1498276074,TraceTogether,sg,,Williebang,2,Fields,All fields entered. But still can&#39;t proceed. Keep prompting cHeck field In red. But there is nothing wrong and yet I still unable to update, Fields All fields entered. But still can&#39;t proceed. Keep prompting cHeck field In red. But there is nothing wrong and yet I still unable to update ,en, Fields All fields entered  But still can     t proceed  Keep prompting cHeck field In red  But there is nothing wrong and yet I still unable to update ,Domain_Specific,enter,0.0625,Positive,0,0,1,0,0,0,0,0,0
265,6/4/20 10:48,1498276074,TraceTogether,sg,,apllman,1,Student not working,This app dors not work if you are a Singaporean student studying in Singapore... Could you guys please fix it?, Student not working This app dors not work if you are a Singaporean student studying in Singapore... Could you guys please fix it? ,en, Student not working This app dors not work if you are a Singaporean student studying in Singapore    Could you guys please fix it  ,"Age, Domain_Specific, Location","student, singapor, student",0.230769231,Positive,1,0,1,0,0,0,1,0,0
266,6/4/20 10:40,1498276074,TraceTogether,sg,,raelline,3,It doesn’t work,"I keep trying to input my card details but they keep saying something is wrong. I’ve tried all the options, work pass holders, nric, etc. but it doesn’t work. I’m a student", It doesn’t work I keep trying to input my card details but they keep saying something is wrong. I’ve tried all the options  work pass holders  nric  etc. but it doesn’t work. I’m a student ,en, It doesn t work I keep trying to input my card details but they keep saying something is wrong  I ve tried all the options  work pass holders  nric  etc  but it doesn t work  I m a student ,"Age, Domain_Specific","student, holder, student",0.157894737,Negative,1,0,1,0,0,0,0,0,0
274,6/4/20 9:01,1498276074,TraceTogether,us,2.0.1,Subaru Hoshiyomi,1,Great idea poor execution,This is a great idea but the execution is poor. The app crashes when student pass is selected. And has a poor unexciting interface . No wonder not enough people use it., Great idea poor execution This is a great idea but the execution is poor. The app crashes when student pass is selected. And has a poor unexciting interface . No wonder not enough people use it. ,en, Great idea poor execution This is a great idea but the execution is poor  The app crashes when student pass is selected  And has a poor unexciting interface   No wonder not enough people use it  ,"Age, Domain_Specific","student, student, execut",0.15,Negative,1,0,1,0,0,0,0,0,0
277,6/4/20 8:01,1498276074,TraceTogether,sg,,xxjasminetxy,1,USELESS,When keyed in my NRIC it says that my NRIC is invalid.. How is my NRIC even invalid? Am I not registered in Singapore? Am I a unknown person in Singapore? 🙃, USELESS When keyed in my NRIC it says that my NRIC is invalid.. How is my NRIC even invalid? Am I not registered in Singapore? Am I a unknown person in Singapore? 🙃 ,en, USELESS When keyed in my NRIC it says that my NRIC is invalid   How is my NRIC even invalid  Am I not registered in Singapore  Am I a unknown person in Singapore    ,Location,singapor,0.071428571,Negative,0,0,0,0,0,0,1,0,0
279,6/4/20 7:45,1498276074,TraceTogether,sg,,SGKingKong,3,More features please..,"1. Integrate with singpass or myInfo to get personal data. 
2. Let app scan for QR code. During scanning also allows Bluetooth to do its work. 
3. Let app detect location or user to select location in advance to prepare for check in, like what Singpass app used to do. 
4. Let user see which location is still checked in so that checking out is easier."," More features please.. 1. Integrate with singpass or myInfo to get personal data. 
2. Let app scan for QR code. During scanning also allows Bluetooth to do its work. 
3. Let app detect location or user to select location in advance to prepare for check in  like what Singpass app used to do. 
4. Let user see which location is still checked in so that checking out is easier. ",en, More features please      Integrate with singpass or myInfo to get personal data      Let app scan for QR code  During scanning also allows Bluetooth to do its work      Let app detect location or user to select location in advance to prepare for check in  like what Singpass app used to do      Let user see which location is still checked in so that checking out is easier  ,"Domain_Specific, Privacy","data, locat, prepar, locat, prepar",0.12195122,Positive,0,0,1,0,0,0,0,1,0
280,6/4/20 7:43,1498276074,TraceTogether,sg,,husg76,3,Student BC no,"Hi, for local students without IC yet, it cannot update particulars using their birth certificate no. Please assist to look into it.", Student BC no Hi  for local students without IC yet  it cannot update particulars using their birth certificate no. Please assist to look into it. ,en, Student BC no Hi  for local students without IC yet  it cannot update particulars using their birth certificate no  Please assist to look into it  ,"Age, Domain_Specific, Location","student, local, student",0.1875,Negative,1,0,1,0,0,0,1,0,0
282,6/4/20 5:16,1498276074,TraceTogether,sg,,r_t*,3,Cannot set up with NRIC/FIN after update,"I have tried at least 10 times to set up with my student pass FIN number, but it didn’t work. I have even tried my FIN number with other profiles, but all don’t work. 
Please help and fix this! Thanks"," Cannot set up with NRIC/FIN after update I have tried at least 10 times to set up with my student pass FIN number  but it didn’t work. I have even tried my FIN number with other profiles  but all don’t work. 
Please help and fix this! Thanks ",en, Cannot set up with NRIC FIN after update I have tried at least    times to set up with my student pass FIN number  but it didn t work  I have even tried my FIN number with other profiles  but all don t work   Please help and fix this  Thanks ,"Age, Domain_Specific","student, profil, student",0.130434783,Positive,1,0,1,0,0,0,0,0,0
284,6/4/20 4:33,1498276074,TraceTogether,sg,,bluehand minthu,1,Very high data Usage!,I just updated this morning. Now my data usage is showing 5.6GB just in a day!!! How can this be. Plz check if anything wrong with this app after update, Very high data Usage! I just updated this morning. Now my data usage is showing 5.6GB just in a day!!! How can this be. Plz check if anything wrong with this app after update ,en, Very high data Usage  I just updated this morning  Now my data usage is showing    GB just in a day    How can this be  Plz check if anything wrong with this app after update ,Privacy,data,0.058823529,Negative,0,0,0,0,0,0,0,1,0
287,6/4/20 3:43,1498276074,TraceTogether,sg,,secretguy1987,1,No working after software update,Not able fill in IC. Tried many time but still giving invalid entry. Btw I am a local., No working after software update Not able fill in IC. Tried many time but still giving invalid entry. Btw I am a local. ,en, No working after software update Not able fill in IC  Tried many time but still giving invalid entry  Btw I am a local  ,Location,local,0.066666667,Positive,0,0,0,0,0,0,1,0,0
288,6/4/20 3:27,1498276074,TraceTogether,sg,,Augustine44,2,SafeEntry check in can be improved,"Other than having the nric barcode, it will be useful if it can offers the same functionality offered by SingPass SafeEntry check in - select location to check in.", SafeEntry check in can be improved Other than having the nric barcode  it will be useful if it can offers the same functionality offered by SingPass SafeEntry check in - select location to check in. ,en, SafeEntry check in can be improved Other than having the nric barcode  it will be useful if it can offers the same functionality offered by SingPass SafeEntry check in   select location to check in  ,"Domain_Specific, Privacy","locat, locat",0.133333333,Positive,0,0,1,0,0,0,0,1,0
297,6/4/20 2:29,1498276074,TraceTogether,sg,,peaiamzx :),1,😌,i couldnt use the new version. It kept crashing in the page that i need to fill a fin no. (student pass), 😌 i couldnt use the new version. It kept crashing in the page that i need to fill a fin no. (student pass) ,en,   i couldnt use the new version  It kept crashing in the page that i need to fill a fin no   student pass  ,"Age, Domain_Specific","student, student",0.166666667,Negative,1,0,1,0,0,0,0,0,0
298,6/4/20 2:18,1498276074,TraceTogether,sg,,AshViP,1,Crashed.,App crashed after I tried opening. Not sure if phone model is old or what. A new update perhaps?, Crashed. App crashed after I tried opening. Not sure if phone model is old or what. A new update perhaps? ,en, Crashed  App crashed after I tried opening  Not sure if phone model is old or what  A new update perhaps  ,Domain_Specific,model,0.083333333,Negative,0,0,1,0,0,0,0,0,0
301,6/4/20 2:09,1498276074,TraceTogether,sg,,Dennis.Teh,2,New safe entry feature not working,"Hi, i just updates the nee trace together app. The registration went well, i am a work permit holder. But the app closes every time i press the safe entry button. Please rectify... thank you very much", New safe entry feature not working Hi  i just updates the nee trace together app. The registration went well  i am a work permit holder. But the app closes every time i press the safe entry button. Please rectify... thank you very much ,en, New safe entry feature not working Hi  i just updates the nee trace together app  The registration went well  i am a work permit holder  But the app closes every time i press the safe entry button  Please rectify    thank you very much ,Domain_Specific,"holder, rectifi, button",0.1,Positive,0,0,1,0,0,0,0,0,0
304,6/4/20 1:16,1498276074,TraceTogether,sg,2.0.1,TT8937,1,Problem with NRIC input,"I’ve keyed in the right NRIC multiple times, but it is still reflected as Invalid.

Kindly rectify the issue. Thank you."," Problem with NRIC input I’ve keyed in the right NRIC multiple times  but it is still reflected as Invalid.

Kindly rectify the issue. Thank you. ",en, Problem with NRIC input I ve keyed in the right NRIC multiple times  but it is still reflected as Invalid   Kindly rectify the issue  Thank you  ,Domain_Specific,rectifi,0.066666667,Positive,0,0,1,0,0,0,0,0,0
312,6/3/20 23:27,1498276074,TraceTogether,sg,2.0.1,S9414970c,1,Pls fix the new update,"Pls fix it, after the new update, I can’t even fill it my NRIC I’m a Singaporean, and my NRIC is invalid are you kidding me?? Which of NRIC is valid??", Pls fix the new update Pls fix it  after the new update  I can’t even fill it my NRIC I’m a Singaporean  and my NRIC is invalid are you kidding me?? Which of NRIC is valid?? ,en, Pls fix the new update Pls fix it  after the new update  I can t even fill it my NRIC I m a Singaporean  and my NRIC is invalid are you kidding me   Which of NRIC is valid   ,Age,"kid, kid",0.117647059,Positive,1,0,0,0,0,0,0,0,0
316,6/3/20 22:33,1498276074,TraceTogether,sg,2.0.1,kyee1976,1,Student can’t not setup profile on newly updated apps.,Please provide guideline how for a student setup a profile for them. It looks like useless for them with the newly updated apps., Student can’t not setup profile on newly updated apps. Please provide guideline how for a student setup a profile for them. It looks like useless for them with the newly updated apps. ,en, Student can t not setup profile on newly updated apps  Please provide guideline how for a student setup a profile for them  It looks like useless for them with the newly updated apps  ,"Age, Domain_Specific","student, profil, student",0.166666667,Positive,1,0,1,0,0,0,0,0,0
326,6/3/20 11:14,1498276074,TraceTogether,sg,2.0.1,frommylens,1,Cannot run at background,Cannot run at background, Cannot run at background Cannot run at background ,en, Cannot run at background Cannot run at background ,Domain_Specific,run,0.25,Neutral,0,0,1,0,0,0,0,0,0
327,6/3/20 11:04,1498276074,TraceTogether,sg,2.0.1,cracklepums,4,how do i setup for singapore child without NRIC yet?,how, how do i setup for singapore child without NRIC yet? how ,en, how do i setup for singapore child without NRIC yet  how ,"Age, Location","child, singapor",0.333333333,Neutral,1,0,0,0,0,0,1,0,0
329,6/3/20 10:33,1498276074,TraceTogether,sg,2.0.1,MHA boi,3,Well...,"What if I don’t have an NRIC card, am not visiting Singapore don’t have a work, dependent’s, student’s or Long Term Visit pass?", Well... What if I don’t have an NRIC card  am not visiting Singapore don’t have a work  dependent’s  student’s or Long Term Visit pass? ,en, Well    What if I don t have an NRIC card  am not visiting Singapore don t have a work  dependent s  student s or Long Term Visit pass  ,"Age, Domain_Specific, Location","student, singapor, student",0.25,Positive,1,0,1,0,0,0,1,0,0
331,6/3/20 9:30,1498276074,TraceTogether,sg,2.0.1,Chloelxy__,1,Cannot log into 3 June new update,I just downloaded the new update and when i launched the app it asks me to put my NRIC or FIN so i put under student’s pass because i am a student and i put down my name FIN and date of issue and ticked the box it says that it is not valid i even asked my father to help me and it did not work. The app in my opinion is quite lousy. There are other was to set up the app that you can use., Cannot log into 3 June new update I just downloaded the new update and when i launched the app it asks me to put my NRIC or FIN so i put under student’s pass because i am a student and i put down my name FIN and date of issue and ticked the box it says that it is not valid i even asked my father to help me and it did not work. The app in my opinion is quite lousy. There are other was to set up the app that you can use. ,en, Cannot log into   June new update I just downloaded the new update and when i launched the app it asks me to put my NRIC or FIN so i put under student s pass because i am a student and i put down my name FIN and date of issue and ticked the box it says that it is not valid i even asked my father to help me and it did not work  The app in my opinion is quite lousy  There are other was to set up the app that you can use  ,"Age, Domain_Specific","student, father, student",0.076923077,Negative,1,0,1,0,0,0,0,0,0
333,6/3/20 7:50,1498276074,TraceTogether,sg,2.0.1,Aloy26,1,Buggy.,"The latest version keeps crashing on my device running iOS 13.5 (17F75). Especially when I press the “safe entry” option; it crashes immediately. 

Please resolve this, it is piss poor user experience; conduct an exhaustive user testing phase prior to major releases or the agency’s efforts will not be effective."," Buggy. The latest version keeps crashing on my device running iOS 13.5 (17F75). Especially when I press the “safe entry” option; it crashes immediately. 

Please resolve this  it is piss poor user experience; conduct an exhaustive user testing phase prior to major releases or the agency’s efforts will not be effective. ",en, Buggy  The latest version keeps crashing on my device running iOS         F     Especially when I press the  safe entry  option  it crashes immediately    Please resolve this  it is piss poor user experience  conduct an exhaustive user testing phase prior to major releases or the agency s efforts will not be effective  ,Domain_Specific,"exhaust, run",0.060606061,Negative,0,0,1,0,0,0,0,0,0
334,6/3/20 7:48,1498276074,TraceTogether,sg,2.0.1,TN 007,1,Security and app malfunction,"For the profile, the date of issue shall not been show. Please do a survey or option that what need to display. The new application is not functional able. Isn’t it to test before launching it. Making ppl troubling to keep on updating and the application is useless. What’s the point? It it really trustable?", Security and app malfunction For the profile  the date of issue shall not been show. Please do a survey or option that what need to display. The new application is not functional able. Isn’t it to test before launching it. Making ppl troubling to keep on updating and the application is useless. What’s the point? It it really trustable? ,en, Security and app malfunction For the profile  the date of issue shall not been show  Please do a survey or option that what need to display  The new application is not functional able  Isn t it to test before launching it  Making ppl troubling to keep on updating and the application is useless  What s the point  It it really trustable  ,"Domain_Specific, Privacy","secur, secur, display, profil, applic",0.166666667,Negative,0,0,1,0,0,0,0,1,0
337,6/3/20 7:22,1498276074,TraceTogether,sg,2.0.1,dazyboi,1,Unable to register,No record of my ic number, Unable to register No record of my ic number ,en, Unable to register No record of my ic number ,Domain_Specific,record,0.2,Negative,0,0,1,0,0,0,0,0,0
338,6/3/20 7:08,1498276074,TraceTogether,sg,2,yeuann,1,Keeps crashing :(,"Thanks for the hard work, GovTech. But sadly the latest version 2.0 keeps crashing on my iPhone whenever I try to do a Safe Entry check in.", Keeps crashing :( Thanks for the hard work  GovTech. But sadly the latest version 2.0 keeps crashing on my iPhone whenever I try to do a Safe Entry check in. ,en, Keeps crashing    Thanks for the hard work  GovTech  But sadly the latest version     keeps crashing on my iPhone whenever I try to do a Safe Entry check in  ,Emotional,sad,0.058823529,Positive,0,0,0,1,0,0,0,0,0
345,6/3/20 6:28,1498276074,TraceTogether,sg,2,Sam_SG,1,Need Another Software Update,Clicking on the SafeEntry Check-in button causes the user to automatically exit the app., Need Another Software Update Clicking on the SafeEntry Check-in button causes the user to automatically exit the app. ,en, Need Another Software Update Clicking on the SafeEntry Check in button causes the user to automatically exit the app  ,Domain_Specific,button,0.076923077,Neutral,0,0,1,0,0,0,0,0,0
349,6/3/20 6:20,1498276074,TraceTogether,sg,2,howtoosee,3,SafeEntry crashes app,"SafeEntry crashes the app upon clicking, same with the barcode button in the top right.", SafeEntry crashes app SafeEntry crashes the app upon clicking  same with the barcode button in the top right. ,en, SafeEntry crashes app SafeEntry crashes the app upon clicking  same with the barcode button in the top right  ,Domain_Specific,button,0.083333333,Positive,0,0,1,0,0,0,0,0,0
356,6/3/20 5:13,1498276074,TraceTogether,sg,2,LCQYQ,5,Cannot operation safe entry,"Can’t work with safe entry. Pls rectify. 

Many thanks."," Cannot operation safe entry Can’t work with safe entry. Pls rectify. 

Many thanks. ",en, Cannot operation safe entry Can t work with safe entry  Pls rectify    Many thanks  ,Domain_Specific,rectifi,0.1,Positive,0,0,1,0,0,0,0,0,0
361,6/3/20 4:25,1498276074,TraceTogether,sg,2,Jarylzjs,3,App crashes.,"Finally the app is able to run in the background on iOS! However, I encounter issues that the app crashes when I click on the “SafeEntry check-in” button or the barcode button on the top right corner. Meaning that I’m not able to retrieve the barcode that is supposed to display when selected either of the button/function. Appreciate if the bug could be solved. I’m already on iOS 13.5.1.", App crashes. Finally the app is able to run in the background on iOS! However  I encounter issues that the app crashes when I click on the “SafeEntry check-in” button or the barcode button on the top right corner. Meaning that I’m not able to retrieve the barcode that is supposed to display when selected either of the button/function. Appreciate if the bug could be solved. I’m already on iOS 13.5.1. ,en, App crashes  Finally the app is able to run in the background on iOS  However  I encounter issues that the app crashes when I click on the  SafeEntry check in  button or the barcode button on the top right corner  Meaning that I m not able to retrieve the barcode that is supposed to display when selected either of the button function  Appreciate if the bug could be solved  I m already on iOS         ,Domain_Specific,"display, run, button",0.078947368,Positive,0,0,1,0,0,0,0,0,0
363,6/3/20 4:21,1498276074,TraceTogether,my,2,Zack_Tan,1,App crashes,App just crashes whenever I click the barcode or safe entry button, App crashes App just crashes whenever I click the barcode or safe entry button ,en, App crashes App just crashes whenever I click the barcode or safe entry button ,Domain_Specific,button,0.1,Positive,0,0,1,0,0,0,0,0,0
376,6/3/20 3:15,1498276074,TraceTogether,sg,2,Sam_SGP,1,Keep Crashing,Keep crashing... after key in the NRIC details and can’t use at all... pls check and rectify. I’m using iPhone X., Keep Crashing Keep crashing... after key in the NRIC details and can’t use at all... pls check and rectify. I’m using iPhone X. ,en, Keep Crashing Keep crashing    after key in the NRIC details and can t use at all    pls check and rectify  I m using iPhone X  ,Domain_Specific,rectifi,0.071428571,Positive,0,0,1,0,0,0,0,0,0
383,6/3/20 2:24,1498276074,TraceTogether,sg,2,xshroff,3,Edit profile,"There is no way to edit profile details that are wrongly entered. Please correct this.

Also the app is crashing when you try to check in."," Edit profile There is no way to edit profile details that are wrongly entered. Please correct this.

Also the app is crashing when you try to check in. ",en, Edit profile There is no way to edit profile details that are wrongly entered  Please correct this   Also the app is crashing when you try to check in  ,Domain_Specific,"enter, profil",0.133333333,Neutral,0,0,1,0,0,0,0,0,0
387,6/2/20 7:08,1498276074,TraceTogether,sg,,tableann,1,Can’t even use other apps,What’s the point if I can’t even use other apps? Useless with poor planning and execution., Can’t even use other apps What’s the point if I can’t even use other apps? Useless with poor planning and execution. ,en, Can t even use other apps What s the point if I can t even use other apps  Useless with poor planning and execution  ,Domain_Specific,execut,0.090909091,Negative,0,0,1,0,0,0,0,0,0
388,6/2/20 1:07,1498276074,TraceTogether,my,1.9.1,Kai Shien,2,Unable to receive OTP,Failure from getting OTP even though I had re-install it few times. Kindly advise., Unable to receive OTP Failure from getting OTP even though I had re-install it few times. Kindly advise. ,en, Unable to receive OTP Failure from getting OTP even though I had re install it few times  Kindly advise  ,Domain_Specific,receiv,0.083333333,Neutral,0,0,1,0,0,0,0,0,0
390,6/1/20 20:56,1498276074,TraceTogether,sg,,Erldkvkjdjcjfgdbkdjcvinks,5,Please implement the Apple & Google API,"The intention of TraceTogether is great but the implementation is not there. I still have privacy concerns, plus the current technology behind TraceTogether requires iPhone to always have the app open. The Apple &amp; Google API resolves that issue and contract tracing can be done in the background while maintaining a higher level of privacy. 

GovTech needs to update the app with that API and it will benefit us all and address our privacy concerns once and for all."," Please implement the Apple & Google API The intention of TraceTogether is great but the implementation is not there. I still have privacy concerns  plus the current technology behind TraceTogether requires iPhone to always have the app open. The Apple &amp; Google API resolves that issue and contract tracing can be done in the background while maintaining a higher level of privacy. 

GovTech needs to update the app with that API and it will benefit us all and address our privacy concerns once and for all. ",en, Please implement the Apple   Google API The intention of TraceTogether is great but the implementation is not there  I still have privacy concerns  plus the current technology behind TraceTogether requires iPhone to always have the app open  The Apple  amp  Google API resolves that issue and contract tracing can be done in the background while maintaining a higher level of privacy    GovTech needs to update the app with that API and it will benefit us all and address our privacy concerns once and for all  ,"Domain_Specific, Emotional, Privacy","concern, privaci, level, address",0.085106383,Positive,0,0,1,1,0,0,0,1,0
