,Date,AppID,AppName,Country,Version,Author,Rating,Title,Review,Title Review,Detected Language,content,issue,syn,issue_vio_id,sentiment,Age,Disability,Domain_Specific,Emotional,Gender,Language,Location,Privacy,Socio_economic_Status
12,7/29/20 4:48,1498276074,TraceTogether,sg,2.1.2,Ns6;771,1,App sent out a message without my knowledge,I think there’s a security loophole in the app that needs to be closed. The app used my messaging app to send out a message to ask my contact list to download it. Please patch the app., App sent out a message without my knowledge I think there’s a security loophole in the app that needs to be closed. The app used my messaging app to send out a message to ask my contact list to download it. Please patch the app. ,en, App sent out a message without my knowledge I think there s a security loophole in the app that needs to be closed  The app used my messaging app to send out a message to ask my contact list to download it  Please patch the app  ,Privacy,"secur, secur",0.083333333,Positive,0,0,0,0,0,0,0,1,0
14,7/28/20 14:22,1498276074,TraceTogether,ca,2.1.2,Disapointed7308,5,I deleted this app not because,I deleted this app not because it doesn’t work I’m sure it works just fine I just want an app created for Canada so that I get the information I need, I deleted this app not because I deleted this app not because it doesn’t work I’m sure it works just fine I just want an app created for Canada so that I get the information I need ,en, I deleted this app not because I deleted this app not because it doesn t work I m sure it works just fine I just want an app created for Canada so that I get the information I need ,Location,canada,0.058823529,Positive,0,0,0,0,0,0,1,0,0
21,7/21/20 12:48,1498276074,TraceTogether,sg,2.1.2,yg4jix,3,Reminder to keep app on,"Thanks for the response. But I don’t mean the Bluetooth is turned off. Sometimes the app might be accidentally closed even if Bluetooth is on. Previously there is alert notifying the app is not running is the background but I don’t see such alerts anymore.
*********

Noticed it doesn’t remind user if the app is closed accidentally anymore. Feels like this is an important feature"," Reminder to keep app on Thanks for the response. But I don’t mean the Bluetooth is turned off. Sometimes the app might be accidentally closed even if Bluetooth is on. Previously there is alert notifying the app is not running is the background but I don’t see such alerts anymore.
*********

Noticed it doesn’t remind user if the app is closed accidentally anymore. Feels like this is an important feature ",en, Reminder to keep app on Thanks for the response  But I don t mean the Bluetooth is turned off  Sometimes the app might be accidentally closed even if Bluetooth is on  Previously there is alert notifying the app is not running is the background but I don t see such alerts anymore             Noticed it doesn t remind user if the app is closed accidentally anymore  Feels like this is an important feature ,Domain_Specific,"import, run",0.057142857,Positive,0,0,1,0,0,0,0,0,0
25,7/19/20 13:44,1498276074,TraceTogether,sg,2.1.2,Rich27375958262,5,Great App,"This app is really great. I especially like the new feature to check in and out at locations. It makes it so seamless. All-in-one. Checking in/out and tracing at the same time. 

Thanks also for all the hard work to make it finally run in the background. Together we will overcome this crisis!"," Great App This app is really great. I especially like the new feature to check in and out at locations. It makes it so seamless. All-in-one. Checking in/out and tracing at the same time. 

Thanks also for all the hard work to make it finally run in the background. Together we will overcome this crisis! ",en, Great App This app is really great  I especially like the new feature to check in and out at locations  It makes it so seamless  All in one  Checking in out and tracing at the same time    Thanks also for all the hard work to make it finally run in the background  Together we will overcome this crisis  ,"Domain_Specific, Privacy","locat, locat, run",0.107142857,Positive,0,0,1,0,0,0,0,1,0
28,7/18/20 8:21,1498276074,TraceTogether,sg,2.1.2,Dreamliner 777,2,Developer needs to be a user,"Apart from occasional bugs (cannot check out) I hope they will improve on the followings from user experience:

1) the home screen takes up half of the screen space and won’t scroll away. It also doesn’t offer any useful info apart from showing an image of three persons with active mobile phones. 

2) home screen should display a list of all checked-in places, instead of showing just the latest one. This allows users to see at once where have they not checked out yet instead of having to check out one by one.  We really have no time for this especially when our hands are occupied with heavy groceries."," Developer needs to be a user Apart from occasional bugs (cannot check out) I hope they will improve on the followings from user experience:

1) the home screen takes up half of the screen space and won’t scroll away. It also doesn’t offer any useful info apart from showing an image of three persons with active mobile phones. 

2) home screen should display a list of all checked-in places  instead of showing just the latest one. This allows users to see at once where have they not checked out yet instead of having to check out one by one.  We really have no time for this especially when our hands are occupied with heavy groceries. ",en, Developer needs to be a user Apart from occasional bugs  cannot check out  I hope they will improve on the followings from user experience      the home screen takes up half of the screen space and won t scroll away  It also doesn t offer any useful info apart from showing an image of three persons with active mobile phones       home screen should display a list of all checked in places  instead of showing just the latest one  This allows users to see at once where have they not checked out yet instead of having to check out one by one   We really have no time for this especially when our hands are occupied with heavy groceries  ,Domain_Specific,"display, imag, follow",0.05,Positive,0,0,1,0,0,0,0,0,0
29,7/18/20 6:49,1498276074,TraceTogether,sg,2.1.2,Jackieee92,5,Finally works on iOS!,I am impressed that the app finally works for iOS users! I am very curious; how did you guys do it? Did Apple finally allow for the bypass or you manage to find a way to bypass it? I’m googling online on this right now!, Finally works on iOS! I am impressed that the app finally works for iOS users! I am very curious; how did you guys do it? Did Apple finally allow for the bypass or you manage to find a way to bypass it? I’m googling online on this right now! ,en, Finally works on iOS  I am impressed that the app finally works for iOS users  I am very curious  how did you guys do it  Did Apple finally allow for the bypass or you manage to find a way to bypass it  I m googling online on this right now  ,"Domain_Specific, Emotional","curious, manag, manag",0.130434783,Positive,0,0,1,1,0,0,0,0,0
32,7/16/20 13:45,1498276074,TraceTogether,sg,2.1.1,7224235866,4,Suggestion: Adding bookmarks of places.,"Adding like bookmarks of the places frequently visited. If I go to work Everyday via a underpass that is located in a mall then out to my office building, I have to fight to scan the QR code every morning with so many other commuters. 

Adding it will just make it easier and I can straight head towards to the staff to show that I have already checked in while walking towards them, Instead of clustering to scan that small QR code.Hopefully it will improve the user friendliness of the app. 

Thanks TraceTogether team for making the app work for Apple users! Great Job!"," Suggestion: Adding bookmarks of places. Adding like bookmarks of the places frequently visited. If I go to work Everyday via a underpass that is located in a mall then out to my office building  I have to fight to scan the QR code every morning with so many other commuters. 

Adding it will just make it easier and I can straight head towards to the staff to show that I have already checked in while walking towards them  Instead of clustering to scan that small QR code.Hopefully it will improve the user friendliness of the app. 

Thanks TraceTogether team for making the app work for Apple users! Great Job! ",en, Suggestion  Adding bookmarks of places  Adding like bookmarks of the places frequently visited  If I go to work Everyday via a underpass that is located in a mall then out to my office building  I have to fight to scan the QR code every morning with so many other commuters    Adding it will just make it easier and I can straight head towards to the staff to show that I have already checked in while walking towards them  Instead of clustering to scan that small QR code Hopefully it will improve the user friendliness of the app    Thanks TraceTogether team for making the app work for Apple users  Great Job  ,"Domain_Specific, Privacy","locat, locat, staff, head",0.066666667,Positive,0,0,1,0,0,0,0,1,0
35,7/13/20 8:55,1498276074,TraceTogether,sg,2.1.1,vlagtr,4,Love the addition of safe entry,"Thanks for the addition of safe entry. It’s useful for checking out. 

Would be more useful if we can help our kids to check in too. Currently we have to use browsers to do it and it’s cumbersome if you are checking in more than one kid.

Also, the image on the home screen is taking up too much real estate."," Love the addition of safe entry Thanks for the addition of safe entry. It’s useful for checking out. 

Would be more useful if we can help our kids to check in too. Currently we have to use browsers to do it and it’s cumbersome if you are checking in more than one kid.

Also  the image on the home screen is taking up too much real estate. ",en, Love the addition of safe entry Thanks for the addition of safe entry  It s useful for checking out    Would be more useful if we can help our kids to check in too  Currently we have to use browsers to do it and it s cumbersome if you are checking in more than one kid   Also  the image on the home screen is taking up too much real estate  ,"Age, Domain_Specific","kid, kid, imag",0.1,Positive,1,0,1,0,0,0,0,0,0
36,7/13/20 8:10,1498276074,TraceTogether,sg,2.1.1,Sibei sian,4,Detect location for SafeEntry check in,"Love the fact now can run in background, great job to the team! :)

I also use the SafeEntry in TraceTogether now, so that I only need to use 1 app. Can this be further improved to allow check in without scanning the QR code? SingPass is able to detect the nearby locations available for check in, which is more convenient than locating the QR code especially at places like the hawker centre which has multiple entry points and QR code not easily found. Hope to see this available in TraceTogether soon. Keep up the great work!"," Detect location for SafeEntry check in Love the fact now can run in background  great job to the team! :)

I also use the SafeEntry in TraceTogether now  so that I only need to use 1 app. Can this be further improved to allow check in without scanning the QR code? SingPass is able to detect the nearby locations available for check in  which is more convenient than locating the QR code especially at places like the hawker centre which has multiple entry points and QR code not easily found. Hope to see this available in TraceTogether soon. Keep up the great work! ",en, Detect location for SafeEntry check in Love the fact now can run in background  great job to the team      I also use the SafeEntry in TraceTogether now  so that I only need to use   app  Can this be further improved to allow check in without scanning the QR code  SingPass is able to detect the nearby locations available for check in  which is more convenient than locating the QR code especially at places like the hawker centre which has multiple entry points and QR code not easily found  Hope to see this available in TraceTogether soon  Keep up the great work  ,"Domain_Specific, Privacy","locat, locat, hawker, run",0.070175439,Positive,0,0,1,0,0,0,0,1,0
38,7/13/20 1:13,1498276074,TraceTogether,sg,2.1.1,Iceice619,1,Not able to log in with new EP,I couldn’t setup the profile even with my new EP. please help to fix., Not able to log in with new EP I couldn’t setup the profile even with my new EP. please help to fix. ,en, Not able to log in with new EP I couldn t setup the profile even with my new EP  please help to fix  ,Domain_Specific,profil,0.083333333,Positive,0,0,1,0,0,0,0,0,0
39,7/13/20 0:56,1498276074,TraceTogether,sg,2.1.1,Ahsen87,1,I can’t validate my nric and create my account,Pls help, I can’t validate my nric and create my account Pls help ,en, I can t validate my nric and create my account Pls help ,Domain_Specific,account,0.166666667,Positive,0,0,1,0,0,0,0,0,0
40,7/11/20 11:44,1498276074,TraceTogether,sg,2.1.1,shunshoheng,4,Great app,"Glad that the app can be used in the background for apple now. Well done! One suggestion for safe entry, the options aren’t listed for the safeentry so if one location has multiple options its just listed as the same place. For example at wheelock place, theres two options, one for office and the other for mall but on the app both options are listed as “wheelock place” without stating which is which. Other than that great app!", Great app Glad that the app can be used in the background for apple now. Well done! One suggestion for safe entry  the options aren’t listed for the safeentry so if one location has multiple options its just listed as the same place. For example at wheelock place  theres two options  one for office and the other for mall but on the app both options are listed as “wheelock place” without stating which is which. Other than that great app! ,en, Great app Glad that the app can be used in the background for apple now  Well done  One suggestion for safe entry  the options aren t listed for the safeentry so if one location has multiple options its just listed as the same place  For example at wheelock place  theres two options  one for office and the other for mall but on the app both options are listed as  wheelock place  without stating which is which  Other than that great app  ,"Domain_Specific, Privacy","locat, locat",0.051282051,Positive,0,0,1,0,0,0,0,1,0
43,7/9/20 7:59,1498276074,TraceTogether,sg,2.1.1,Rayong,4,Good but can be better,"Suggestions:

1.  No need for home button after scan in, it’s just extra step. Right after scan can just go straight to home.  When leaving tap to bring up and check out. 

2.  Have history of locations we have checked in and out for our own reference so we know where we’ve been and can compare to locations where Covid cases have been recently."," Good but can be better Suggestions:

1.  No need for home button after scan in  it’s just extra step. Right after scan can just go straight to home.  When leaving tap to bring up and check out. 

2.  Have history of locations we have checked in and out for our own reference so we know where we’ve been and can compare to locations where Covid cases have been recently. ",en, Good but can be better Suggestions       No need for home button after scan in  it s just extra step  Right after scan can just go straight to home   When leaving tap to bring up and check out        Have history of locations we have checked in and out for our own reference so we know where we ve been and can compare to locations where Covid cases have been recently  ,"Domain_Specific, Privacy","locat, locat, button",0.107142857,Positive,0,0,1,0,0,0,0,1,0
44,7/9/20 1:43,1498276074,TraceTogether,sg,2.1.1,Starrystarryskysky,4,UI,Very convenient app for helping to scan and keep track of check-ins. The UI however can be improved. The nice pic at the top is taking up more than half the screen space on my iPhone 8. The info/buttons we need to use are right at the bottom and they share only a small scrolling space., UI Very convenient app for helping to scan and keep track of check-ins. The UI however can be improved. The nice pic at the top is taking up more than half the screen space on my iPhone 8. The info/buttons we need to use are right at the bottom and they share only a small scrolling space. ,en, UI Very convenient app for helping to scan and keep track of check ins  The UI however can be improved  The nice pic at the top is taking up more than half the screen space on my iPhone    The info buttons we need to use are right at the bottom and they share only a small scrolling space  ,"Domain_Specific, Privacy","track, bottom, button",0.096774194,Positive,0,0,1,0,0,0,0,1,0
45,7/8/20 16:04,1498276074,TraceTogether,sg,2.1.1,YenChuan,5,The trace still same,The background trace still not working after awhile today whole day only few people which I whole day outside, The trace still same The background trace still not working after awhile today whole day only few people which I whole day outside ,en, The trace still same The background trace still not working after awhile today whole day only few people which I whole day outside ,Domain_Specific,outsid,0.066666667,Neutral,0,0,1,0,0,0,0,0,0
47,7/8/20 0:07,1498276074,TraceTogether,sg,2.1.1,Jessie Low WJ,3,Homescreen image too big,"Homescreen image cosmetic, serves no purpose and takes up too much screen real estate. Confines useful features to small scrolling window at bottom. Can’t readily see SafeEntry and Bluetooth exchanges summary.", Homescreen image too big Homescreen image cosmetic  serves no purpose and takes up too much screen real estate. Confines useful features to small scrolling window at bottom. Can’t readily see SafeEntry and Bluetooth exchanges summary. ,en, Homescreen image too big Homescreen image cosmetic  serves no purpose and takes up too much screen real estate  Confines useful features to small scrolling window at bottom  Can t readily see SafeEntry and Bluetooth exchanges summary  ,Domain_Specific,"bottom, imag",0.076923077,Positive,0,0,1,0,0,0,0,0,0
48,7/7/20 6:18,1498276074,TraceTogether,sg,,Kemikeze,3,Illustration sticky hiding information,"This app have been improving a lot. However, something about the UI may have been overlooked. There is actually no need to sticky the illustration as it provides no information. Especially for older folks whose UI most likely to zoom or enlarged fonts or smaller screen phones, the illustration actually takes up 70% of the screen leaving only 30% to scroll to do check ins and outs. Please look into it.", Illustration sticky hiding information This app have been improving a lot. However  something about the UI may have been overlooked. There is actually no need to sticky the illustration as it provides no information. Especially for older folks whose UI most likely to zoom or enlarged fonts or smaller screen phones  the illustration actually takes up 70% of the screen leaving only 30% to scroll to do check ins and outs. Please look into it. ,en, Illustration sticky hiding information This app have been improving a lot  However  something about the UI may have been overlooked  There is actually no need to sticky the illustration as it provides no information  Especially for older folks whose UI most likely to zoom or enlarged fonts or smaller screen phones  the illustration actually takes up     of the screen leaving only     to scroll to do check ins and outs  Please look into it  ,"Age, Domain_Specific","older, illustr, enlarg",0.075,Negative,1,0,1,0,0,0,0,0,0
50,7/7/20 0:22,1498276074,TraceTogether,sg,2.1.1,Guggenhnibuvuvubib,3,Problem with NRIC Verification,The app is unable to verify me despite all fields entered correctly and in accordance to NRIC. NRIC starts with T, Problem with NRIC Verification The app is unable to verify me despite all fields entered correctly and in accordance to NRIC. NRIC starts with T ,en, Problem with NRIC Verification The app is unable to verify me despite all fields entered correctly and in accordance to NRIC  NRIC starts with T ,Domain_Specific,enter,0.071428571,Negative,0,0,1,0,0,0,0,0,0
52,7/6/20 9:06,1498276074,TraceTogether,sg,,Beboptang,4,Running in the background for iOS!!,"Finally GovTech got it together!! Thank you for finally making TraceTogether functional for iPhone users. 

The Safety Beta isn’t accepted by most venues."," Running in the background for iOS!! Finally GovTech got it together!! Thank you for finally making TraceTogether functional for iPhone users. 

The Safety Beta isn’t accepted by most venues. ",en, Running in the background for iOS   Finally GovTech got it together   Thank you for finally making TraceTogether functional for iPhone users    The Safety Beta isn t accepted by most venues  ,Domain_Specific,run,0.055555556,Positive,0,0,1,0,0,0,0,0,0
54,7/6/20 3:41,1498276074,TraceTogether,sg,,Happisilver,5,Thumbs up on IOS,Great. Happy it can now run in the background. Also love the safe entry feature., Thumbs up on IOS Great. Happy it can now run in the background. Also love the safe entry feature. ,en, Thumbs up on IOS Great  Happy it can now run in the background  Also love the safe entry feature  ,Domain_Specific,run,0.090909091,Positive,0,0,1,0,0,0,0,0,0
55,7/5/20 13:10,1498276074,TraceTogether,sg,2.1.1,Sara.Sj,2,Bluetooth Auto Turnoff,Hi pls help to do something with this issue for IOS 13.5.1. Mostly Bluetooth Auto turn off and turn on reconnecting back in few seconds.. It's annoying while using Bluetooth headset.., Bluetooth Auto Turnoff Hi pls help to do something with this issue for IOS 13.5.1. Mostly Bluetooth Auto turn off and turn on reconnecting back in few seconds.. It's annoying while using Bluetooth headset.. ,en, Bluetooth Auto Turnoff Hi pls help to do something with this issue for IOS         Mostly Bluetooth Auto turn off and turn on reconnecting back in few seconds   It s annoying while using Bluetooth headset   ,Emotional,annoy,0.05,Positive,0,0,0,1,0,0,0,0,0
61,7/5/20 2:55,1498276074,TraceTogether,sg,2.1.1,Tvb serial fans,3,Stay prepared Face masks QR Code cannot scan,"Hi sir / miss 
Can you please fix the QR Code on the trace together on my i phone 10 , I tried many times with the trace together QR code to scan the stay prepared SG / masks the system ask me scan again can u do the QR code thanks 
,"," Stay prepared Face masks QR Code cannot scan Hi sir / miss 
Can you please fix the QR Code on the trace together on my i phone 10   I tried many times with the trace together QR code to scan the stay prepared SG / masks the system ask me scan again can u do the QR code thanks 
  ",en, Stay prepared Face masks QR Code cannot scan Hi sir   miss  Can you please fix the QR Code on the trace together on my i phone      I tried many times with the trace together QR code to scan the stay prepared SG   masks the system ask me scan again can u do the QR code thanks    ,Domain_Specific,"prepar, prepar",0.055555556,Positive,0,0,1,0,0,0,0,0,0
63,7/5/20 2:10,1498276074,TraceTogether,sg,2.1.1,tlczlq,1,Badly developed app,"Received notification on new updates but cannot be used.  It keeps showing my details are wrong, date of birth, issues date and etc. 
Stop wasting my time!"," Badly developed app Received notification on new updates but cannot be used.  It keeps showing my details are wrong  date of birth  issues date and etc. 
Stop wasting my time! ",en, Badly developed app Received notification on new updates but cannot be used   It keeps showing my details are wrong  date of birth  issues date and etc   Stop wasting my time  ,Domain_Specific,receiv,0.05,Negative,0,0,1,0,0,0,0,0,0
66,7/4/20 9:13,1498276074,TraceTogether,sg,,kohhy6,1,Bluetooth auto turn off on iphone,Please help to do something. Bluetooth auto turn off and keep receiving notification., Bluetooth auto turn off on iphone Please help to do something. Bluetooth auto turn off and keep receiving notification. ,en, Bluetooth auto turn off on iphone Please help to do something  Bluetooth auto turn off and keep receiving notification  ,Domain_Specific,receiv,0.076923077,Positive,0,0,1,0,0,0,0,0,0
69,7/4/20 4:33,1498276074,TraceTogether,sg,,Guifeng830,5,New updates perfect!,Glad that the team takes feedback seriously and managed to improve on it. Definitely be using this one stop app on the go., New updates perfect! Glad that the team takes feedback seriously and managed to improve on it. Definitely be using this one stop app on the go. ,en, New updates perfect  Glad that the team takes feedback seriously and managed to improve on it  Definitely be using this one stop app on the go  ,Domain_Specific,"manag, manag",0.125,Positive,0,0,1,0,0,0,0,0,0
73,7/3/20 11:52,1498276074,TraceTogether,sg,2.1.1,eleanorcbc,5,🙏🇸🇬💪🏽❌🦠,Please everyone cooperate and use this app and do safe distancing. We will stop COVID-19 together. SG boleh!, 🙏🇸🇬💪🏽❌🦠 Please everyone cooperate and use this app and do safe distancing. We will stop COVID-19 together. SG boleh! ,en,         Please everyone cooperate and use this app and do safe distancing  We will stop COVID    together  SG boleh  ,Domain_Specific,"cooper, cooper",0.166666667,Positive,0,0,1,0,0,0,0,0,0
80,7/1/20 23:55,1498276074,TraceTogether,sg,2.0.3,a pack of nuts,1,forced to download,"forced by school to download 
deleting later"," forced to download forced by school to download 
deleting later ",en, forced to download forced by school to download  deleting later ,Age,school,0.142857143,Negative,1,0,0,0,0,0,0,0,0
