,Date,AppID,AppName,Country,Version,Author,Rating,Title,Review,Title Review,Detected Language,content,issue,syn,issue_vio_id,sentiment,Age,Disability,Domain_Specific,Emotional,Gender,Language,Location,Privacy,Socio_economic_Status
667,3/23/20 9:24,1498276074,TraceTogether,sg,1.2,Shilpa N S,2,Unable to get OTP,"Tried to register few times but I haven’t received any OTP yet. Tried to close the app and reopen and tried again, still doesn’t work.", Unable to get OTP Tried to register few times but I haven’t received any OTP yet. Tried to close the app and reopen and tried again  still doesn’t work. ,en, Unable to get OTP Tried to register few times but I haven t received any OTP yet  Tried to close the app and reopen and tried again  still doesn t work  ,Domain_Specific,receiv,0.058823529,Neutral,0,0,1,0,0,0,0,0,0
669,3/23/20 8:36,1498276074,TraceTogether,at,1.2,Geri@Austria,5,Great idea,"Dear Team, how could this app spread worldwide in different languages?

Best regards from Austria"," Great idea Dear Team  how could this app spread worldwide in different languages?

Best regards from Austria ",en, Great idea Dear Team  how could this app spread worldwide in different languages   Best regards from Austria ,"Language, Location","languag, austria",0.153846154,Positive,0,0,0,0,0,1,1,0,0
670,3/23/20 8:34,1498276074,TraceTogether,sg,1.2,20xyz06,4,Great app :),"It’s really unfortunate that the app has to be kept open in order to work on IOS as it uses a lot of battery, but I understand that the app developers have no choice because they can’t change how Bluetooth runs on IOS. But other than that, I really appreciate the efforts being put into speeding up the process of contact tracing. Let’s be united and overcome this together!", Great app :) It’s really unfortunate that the app has to be kept open in order to work on IOS as it uses a lot of battery  but I understand that the app developers have no choice because they can’t change how Bluetooth runs on IOS. But other than that  I really appreciate the efforts being put into speeding up the process of contact tracing. Let’s be united and overcome this together! ,en, Great app    It s really unfortunate that the app has to be kept open in order to work on IOS as it uses a lot of battery  but I understand that the app developers have no choice because they can t change how Bluetooth runs on IOS  But other than that  I really appreciate the efforts being put into speeding up the process of contact tracing  Let s be united and overcome this together  ,Domain_Specific,"run, unit, order",0.088235294,Positive,0,0,1,0,0,0,0,0,0
674,3/23/20 4:38,1498276074,TraceTogether,sg,1.2,Ken Ng Singapore,2,Tedious to keep it working all the time,"As handphones are used for general communication and information gathering purposes, the users will definitely receives calls/messages, check their email/calendar, google information while the app is performing the tracing function. Every times after all these interruptions, they have to remember to activate the app for tracing. It's cumbersome to use. I am wondering if there is way to remind people to activate the tracing app or make it work in the background.", Tedious to keep it working all the time As handphones are used for general communication and information gathering purposes  the users will definitely receives calls/messages  check their email/calendar  google information while the app is performing the tracing function. Every times after all these interruptions  they have to remember to activate the app for tracing. It's cumbersome to use. I am wondering if there is way to remind people to activate the tracing app or make it work in the background. ,en, Tedious to keep it working all the time As handphones are used for general communication and information gathering purposes  the users will definitely receives calls messages  check their email calendar  google information while the app is performing the tracing function  Every times after all these interruptions  they have to remember to activate the app for tracing  It s cumbersome to use  I am wondering if there is way to remind people to activate the tracing app or make it work in the background  ,Domain_Specific,"perform, receiv, communic, gather",0.090909091,Neutral,0,0,1,0,0,0,0,0,0
675,3/23/20 4:19,1498276074,TraceTogether,ph,1.2,VjCabuday,4,Add other countries,Could you add other countries like Philippines?, Add other countries Could you add other countries like Philippines? ,en, Add other countries Could you add other countries like Philippines  ,"Language, Location","countri, countri, philippin",0.428571429,Positive,0,0,0,0,0,1,1,0,0
677,3/23/20 3:50,1498276074,TraceTogether,sg,1.2,Jaster foo,5,Enchance feature,Suggest to enable the location access (always) for the apps. This will help to trace the individual location within this period., Enchance feature Suggest to enable the location access (always) for the apps. This will help to trace the individual location within this period. ,en, Enchance feature Suggest to enable the location access  always  for the apps  This will help to trace the individual location within this period  ,"Domain_Specific, Privacy","locat, locat",0.142857143,Positive,0,0,1,0,0,0,0,1,0
678,3/23/20 3:48,1498276074,TraceTogether,sg,1.2,Pling91,1,"Not practical, Wasted app","Who the heck will open and leave the app while walking outside?
Govtech is really wasting Singaporean tax payer money to introduce this iOS app knowing that Bluetooth limitation on running on foreground require app to be opened all the time. 
I would like to put zero star. There are no option for me to put zero star."," Not practical  Wasted app Who the heck will open and leave the app while walking outside?
Govtech is really wasting Singaporean tax payer money to introduce this iOS app knowing that Bluetooth limitation on running on foreground require app to be opened all the time. 
I would like to put zero star. There are no option for me to put zero star. ",en, Not practical  Wasted app Who the heck will open and leave the app while walking outside  Govtech is really wasting Singaporean tax payer money to introduce this iOS app knowing that Bluetooth limitation on running on foreground require app to be opened all the time   I would like to put zero star  There are no option for me to put zero star  ,Domain_Specific,"outsid, run",0.054054054,Negative,0,0,1,0,0,0,0,0,0
683,3/23/20 2:02,1498276074,TraceTogether,sg,1.2,Radish.G,5,Track in the background,It’s good to let the app track while the app is in the background. It’s very hard to keep the app as a current app in our busy life style., Track in the background It’s good to let the app track while the app is in the background. It’s very hard to keep the app as a current app in our busy life style. ,en, Track in the background It s good to let the app track while the app is in the background  It s very hard to keep the app as a current app in our busy life style  ,Privacy,track,0.058823529,Positive,0,0,0,0,0,0,0,1,0
685,3/23/20 1:38,1498276074,TraceTogether,sg,1.2,zfzenryu,5,Good app,Great idea but would be even better if it can run in the background, Good app Great idea but would be even better if it can run in the background ,en, Good app Great idea but would be even better if it can run in the background ,Domain_Specific,run,0.111111111,Positive,0,0,1,0,0,0,0,0,0
686,3/23/20 1:13,1498276074,TraceTogether,co,1.2,volare1982,1,Código de área,No me deja agregar el código de área de colombia,Area code It won't let me add the area code for Colombia,pt,Area code It won t let me add the area code for Colombia,Location,"colombia, area",0.285714286,Positive,0,0,0,0,0,0,1,0,0
687,3/23/20 1:07,1498276074,TraceTogether,sg,1.2,Benda34,5,Good idea....totally supportive and interested to help!,"Hello,
Great idea and hope it works.
Intrigued on the amount of data this will generate and need analysing.
Would love to volunteer to help!

By the way Im getting an Unable to Connect when I click the Help button/menu in the app!!"," Good idea....totally supportive and interested to help! Hello 
Great idea and hope it works.
Intrigued on the amount of data this will generate and need analysing.
Would love to volunteer to help!

By the way Im getting an Unable to Connect when I click the Help button/menu in the app!! ",en, Good idea    totally supportive and interested to help  Hello  Great idea and hope it works  Intrigued on the amount of data this will generate and need analysing  Would love to volunteer to help   By the way Im getting an Unable to Connect when I click the Help button menu in the app   ,"Domain_Specific, Privacy","data, button, volunt",0.096774194,Positive,0,0,1,0,0,0,0,1,0
692,3/22/20 13:42,1498276074,TraceTogether,us,1.2,Mikeradu,2,"GREAT idea, but implementation needs work","There are many apps out there that are able to record a user’s location without the user keeping the app open or the phone screen on for that matter... please do your research and help to implement here as well.  It’s WAY easier than betting that people will remember to turn it on when in crowded places, and it’s definitely gentler on the battery life of the phone.  Thank you for your consideration and for the great idea!", GREAT idea  but implementation needs work There are many apps out there that are able to record a user’s location without the user keeping the app open or the phone screen on for that matter... please do your research and help to implement here as well.  It’s WAY easier than betting that people will remember to turn it on when in crowded places  and it’s definitely gentler on the battery life of the phone.  Thank you for your consideration and for the great idea! ,en, GREAT idea  but implementation needs work There are many apps out there that are able to record a user s location without the user keeping the app open or the phone screen on for that matter    please do your research and help to implement here as well   It s WAY easier than betting that people will remember to turn it on when in crowded places  and it s definitely gentler on the battery life of the phone   Thank you for your consideration and for the great idea  ,"Domain_Specific, Privacy","locat, record, locat",0.073170732,Positive,0,0,1,0,0,0,0,1,0
693,3/22/20 13:14,1498276074,TraceTogether,sg,1.2,Wallywalts,3,Unwanted interaction in pocket,"Ran it today whilst walking around and left it on in my pocket but was shocked to see many random messages sent, notes edited, web pages open etc.

The screen is not properly locked from user input whilst in the power save mode. A single tap then a press on “share this app” will take you to any number of apps unknowingly in your pocket. For this reason it’s impossible to use.

Advise app developer to introduce a “slide to unlock” whilst in power save mode.

Other apps are able to track location in the background with low power use via wifi hotpot connections. Suggest to implement this feature for broader reach."," Unwanted interaction in pocket Ran it today whilst walking around and left it on in my pocket but was shocked to see many random messages sent  notes edited  web pages open etc.

The screen is not properly locked from user input whilst in the power save mode. A single tap then a press on “share this app” will take you to any number of apps unknowingly in your pocket. For this reason it’s impossible to use.

Advise app developer to introduce a “slide to unlock” whilst in power save mode.

Other apps are able to track location in the background with low power use via wifi hotpot connections. Suggest to implement this feature for broader reach. ",en, Unwanted interaction in pocket Ran it today whilst walking around and left it on in my pocket but was shocked to see many random messages sent  notes edited  web pages open etc   The screen is not properly locked from user input whilst in the power save mode  A single tap then a press on  share this app  will take you to any number of apps unknowingly in your pocket  For this reason it s impossible to use   Advise app developer to introduce a  slide to unlock  whilst in power save mode   Other apps are able to track location in the background with low power use via wifi hotpot connections  Suggest to implement this feature for broader reach  ,"Domain_Specific, Emotional, Privacy","shock, locat, track, locat",0.055555556,Positive,0,0,1,1,0,0,0,1,0
695,3/22/20 10:07,1498276074,TraceTogether,sg,1.1,Raja NESH,5,Just an idea,Why can u place wire less connector all around singapore so that it connects with a phone with the app at that certain reigon, Just an idea Why can u place wire less connector all around singapore so that it connects with a phone with the app at that certain reigon ,en, Just an idea Why can u place wire less connector all around singapore so that it connects with a phone with the app at that certain reigon ,"Domain_Specific, Location","singapor, connector",0.142857143,Positive,0,0,1,0,0,0,1,0,0
696,3/22/20 10:06,1498276074,TraceTogether,sg,1.1,SGLightning,1,Waiting for a better implementation.,"The respond from developer makes me laugh. They just copy standard answer and reply to all. Most part, they are not even answering the concerns of the users. No point answering if the answers are not sincere. 

I have installed and deleted the app immediately when I am required to put it in the foreground all the time. Will consider again when a more elegant solution is derived."," Waiting for a better implementation. The respond from developer makes me laugh. They just copy standard answer and reply to all. Most part  they are not even answering the concerns of the users. No point answering if the answers are not sincere. 

I have installed and deleted the app immediately when I am required to put it in the foreground all the time. Will consider again when a more elegant solution is derived. ",en, Waiting for a better implementation  The respond from developer makes me laugh  They just copy standard answer and reply to all  Most part  they are not even answering the concerns of the users  No point answering if the answers are not sincere    I have installed and deleted the app immediately when I am required to put it in the foreground all the time  Will consider again when a more elegant solution is derived  ,"Domain_Specific, Emotional","concern, respond, answer",0.09375,Positive,0,0,1,1,0,0,0,0,0
698,3/22/20 9:19,1498276074,TraceTogether,jp,1.1,pixelcort,5,Please add support for other countries,Currently only works in one country. Please consider adding support for other countries. Thank you!, Please add support for other countries Currently only works in one country. Please consider adding support for other countries. Thank you! ,en, Please add support for other countries Currently only works in one country  Please consider adding support for other countries  Thank you  ,"Language, Location","countri, countri",0.133333333,Positive,0,0,0,0,0,1,1,0,0
700,3/22/20 8:11,1498276074,TraceTogether,gb,1.1,Jugglingz,1,App,So is this only being used in Singapore? Why can’t we use it in UK ?, App So is this only being used in Singapore? Why can’t we use it in UK ? ,en, App So is this only being used in Singapore  Why can t we use it in UK   ,Location,"singapor, uk",0.285714286,Neutral,0,0,0,0,0,0,1,0,0
704,3/22/20 4:52,1498276074,TraceTogether,sg,1.1,[[daised,3,Can we lock our iPhones?,"Three stars because I’m confused as to whether we can have the iPhone locked or not with the app running in the foreground.

I understand that the app needs to be the foreground app to work aka the app is currently being used and running. But can the iPhone be locked with the app running in the foreground? Eg when I unlock the phone, it automatically displays the app because that’s what I had up on screen when I locked the phone. That’s not very clear. Are you saying that the iPhone needs to be UNLOCKED with the app up and open/currently being used?"," Can we lock our iPhones? Three stars because I’m confused as to whether we can have the iPhone locked or not with the app running in the foreground.

I understand that the app needs to be the foreground app to work aka the app is currently being used and running. But can the iPhone be locked with the app running in the foreground? Eg when I unlock the phone  it automatically displays the app because that’s what I had up on screen when I locked the phone. That’s not very clear. Are you saying that the iPhone needs to be UNLOCKED with the app up and open/currently being used? ",en, Can we lock our iPhones  Three stars because I m confused as to whether we can have the iPhone locked or not with the app running in the foreground   I understand that the app needs to be the foreground app to work aka the app is currently being used and running  But can the iPhone be locked with the app running in the foreground  Eg when I unlock the phone  it automatically displays the app because that s what I had up on screen when I locked the phone  That s not very clear  Are you saying that the iPhone needs to be UNLOCKED with the app up and open currently being used  ,"Domain_Specific, Emotional","confus, display, run",0.0625,Negative,0,0,1,1,0,0,0,0,0
706,3/22/20 3:01,1498276074,TraceTogether,sg,1.1,rn77769,5,"Great app, need to have it on a separate device","Great effort! It is fine not to be perfect for now. I suggest to have it installed in a separate device (which is powered) where it can be always on and free the user to continue using the phone, I.e smart watch link to a phone, or even a specially built device link to the phone. Anyway, thank you for creating this app! God bless you.", Great app  need to have it on a separate device Great effort! It is fine not to be perfect for now. I suggest to have it installed in a separate device (which is powered) where it can be always on and free the user to continue using the phone  I.e smart watch link to a phone  or even a specially built device link to the phone. Anyway  thank you for creating this app! God bless you. ,en, Great app  need to have it on a separate device Great effort  It is fine not to be perfect for now  I suggest to have it installed in a separate device  which is powered  where it can be always on and free the user to continue using the phone  I e smart watch link to a phone  or even a specially built device link to the phone  Anyway  thank you for creating this app  God bless you  ,"Domain_Specific, Socio_economic_Status","free, separ",0.054054054,Positive,0,0,1,0,0,0,0,0,1
707,3/22/20 2:19,1498276074,TraceTogether,sg,1.1,damngengleh,1,"Good initiative , bad engineering","I want to support this initiative to trace together but the engineer is lousy. No one would want to open the app 24/7 just for this. You want people to play apart then invest more money to make the app work in background. App restarts frequently too, a pain to use. Cmon government pays u so much to do a job, please have some standard", Good initiative   bad engineering I want to support this initiative to trace together but the engineer is lousy. No one would want to open the app 24/7 just for this. You want people to play apart then invest more money to make the app work in background. App restarts frequently too  a pain to use. Cmon government pays u so much to do a job  please have some standard ,en, Good initiative   bad engineering I want to support this initiative to trace together but the engineer is lousy  No one would want to open the app      just for this  You want people to play apart then invest more money to make the app work in background  App restarts frequently too  a pain to use  Cmon government pays u so much to do a job  please have some standard ,"Domain_Specific, Socio_economic_Status","pay, engin",0.051282051,Negative,0,0,1,0,0,0,0,0,1
709,3/22/20 0:34,1498276074,TraceTogether,tr,1.1,shobiwankenobi,1,Only Local Singapore numbers allowed.,"With so many overseas Singaporeans returning home, and they are the main cause of imported cases, you should allow foreign numbers to be able to register too. Many do no have a local number. Limiting service only to local numbers is totally unnecessary.", Only Local Singapore numbers allowed. With so many overseas Singaporeans returning home  and they are the main cause of imported cases  you should allow foreign numbers to be able to register too. Many do no have a local number. Limiting service only to local numbers is totally unnecessary. ,en, Only Local Singapore numbers allowed  With so many overseas Singaporeans returning home  and they are the main cause of imported cases  you should allow foreign numbers to be able to register too  Many do no have a local number  Limiting service only to local numbers is totally unnecessary  ,"Domain_Specific, Location","local, singapor, servic, servic, import",0.172413793,Neutral,0,0,1,0,0,0,1,0,0
710,3/22/20 0:22,1498276074,TraceTogether,au,1.1,Steve (Australia),5,Global application,"Hi 
Has this app been affective in Singapore? 

Is there discussions to release to other countries health agencies to help stop this spread globally?"," Global application Hi 
Has this app been affective in Singapore? 

Is there discussions to release to other countries health agencies to help stop this spread globally? ",en, Global application Hi  Has this app been affective in Singapore    Is there discussions to release to other countries health agencies to help stop this spread globally  ,"Domain_Specific, Language, Location","countri, countri, singapor, applic",0.266666667,Positive,0,0,1,0,0,1,1,0,0
715,3/21/20 15:05,1498276074,TraceTogether,us,1.1,Annie008,5,Great idea!,But how can we register in the United States? Thanks in advance!, Great idea! But how can we register in the United States? Thanks in advance! ,en, Great idea  But how can we register in the United States  Thanks in advance  ,Domain_Specific,unit,0.142857143,Positive,0,0,1,0,0,0,0,0,0
717,3/21/20 13:51,1498276074,TraceTogether,it,1.1,chiarimanuella,3,No,Non riesco ad inserire il mio numero essendo italiana,No I can't enter my number being Italian,it,No I can t enter my number being Italian,"Domain_Specific, Language","italian, enter",0.666666667,Negative,0,0,1,0,0,1,0,0,0
719,3/21/20 12:47,1498276074,TraceTogether,sg,1.1,Jozuaaaaa,5,Thank you for trying your best Singapore government,Would say this is a very smart initiative, Thank you for trying your best Singapore government Would say this is a very smart initiative ,en, Thank you for trying your best Singapore government Would say this is a very smart initiative ,Location,singapor,0.1,Positive,0,0,0,0,0,0,1,0,0
720,3/21/20 11:51,1498276074,TraceTogether,sg,1.1,Dominins,1,Crap customer service,Good idea but poor implementation. Customer feedback email is run by robots., Crap customer service Good idea but poor implementation. Customer feedback email is run by robots. ,en, Crap customer service Good idea but poor implementation  Customer feedback email is run by robots  ,Domain_Specific,"servic, servic, custom, run",0.333333333,Negative,0,0,1,0,0,0,0,0,0
721,3/21/20 11:27,1498276074,TraceTogether,sg,1.1,Adrian Fong,1,Disability of Background Mode,"This App unable to operate in background, no point to activate it", Disability of Background Mode This App unable to operate in background  no point to activate it ,en, Disability of Background Mode This App unable to operate in background  no point to activate it ,Disability,disabl,0.111111111,Negative,0,1,0,0,0,0,0,0,0
722,3/21/20 11:16,1498276074,TraceTogether,sg,1.1,kachino,2,Need to detect with a locked,"Thank you for setting up this app but it is important to update it to be able to be used with locked iphone.
Very few people will have the habit to keep it open in power save mode."," Need to detect with a locked Thank you for setting up this app but it is important to update it to be able to be used with locked iphone.
Very few people will have the habit to keep it open in power save mode. ",en, Need to detect with a locked Thank you for setting up this app but it is important to update it to be able to be used with locked iphone  Very few people will have the habit to keep it open in power save mode  ,Domain_Specific,import,0.05,Positive,0,0,1,0,0,0,0,0,0
723,3/21/20 11:15,1498276074,TraceTogether,cn,1.1,A Sad User:(,5,iPad版本有bug啊建议修复,"就是在输入otp的时候最后一位输不进去，输进去的数字会替换倒数第二位的数字
但是大家都说挺好的先打个5星吧（","There is a bug in the iPad version. It is recommended to fix it. The last digit cannot be entered when entering otp  and the entered number will replace the second-to-last number.
But everyone said it’s good to give 5 stars first (",zh-cn,There is a bug in the iPad version  It is recommended to fix it  The last digit cannot be entered when entering otp  and the entered number will replace the second to last number  But everyone said it s good to give   stars first  ,Domain_Specific,"enter, replac",0.090909091,Positive,0,0,1,0,0,0,0,0,0
725,3/21/20 10:39,1498276074,TraceTogether,sg,1.1,mouseandcow,4,Idea is good but...,"My iphone is keeping warm after turn on this app. The problem is, the app is disable if I pause it. Giving 1 start to this app, and 5 starts to the idea and Gov.", Idea is good but... My iphone is keeping warm after turn on this app. The problem is  the app is disable if I pause it. Giving 1 start to this app  and 5 starts to the idea and Gov. ,en, Idea is good but    My iphone is keeping warm after turn on this app  The problem is  the app is disable if I pause it  Giving   start to this app  and   starts to the idea and Gov  ,Disability,disabl,0.058823529,Positive,0,1,0,0,0,0,0,0,0
