,Date,AppID,AppName,Country,Version,Author,Rating,Title,Review,Title Review,Detected Language,content,issue,syn,issue_vio_id,sentiment,Age,Disability,Domain_Specific,Emotional,Gender,Language,Location,Privacy,Socio_economic_Status
555,4/6/20 2:58,1498276074,TraceTogether,sg,1.4,codered1603,1,-1 star rating for this app,"How could an app that was launched 2 days ago have 12 reviews with total rating of 4.3 be possible?
Are these “reviewers” really giving review or they are just bumping up the rating score?

20/03: why would the user want to keep this app open and on foreground? It means the user cannot use any other app at all. By using other app, it will close this app and render it unable to trace and track.  They seriously need UX & UI expert to get the design right.

05/04: i tried using this app for a few hours but decided that it will not work at all. When i get a call i cannot accept the call as this app has to be running 100% of the time. Even if they advise to use only when in public i still cannot answer calls when in public. If i need to search in google or map for something and I am outside i cannot use google app too since it will make this app run at background. 
I give up using this app as it is more stressful to use this app. The developers & designers will need to think other ways instead of forcing it down our throat to use this app."," -1 star rating for this app How could an app that was launched 2 days ago have 12 reviews with total rating of 4.3 be possible?
Are these “reviewers” really giving review or they are just bumping up the rating score?

20/03: why would the user want to keep this app open and on foreground? It means the user cannot use any other app at all. By using other app  it will close this app and render it unable to trace and track.  They seriously need UX & UI expert to get the design right.

05/04: i tried using this app for a few hours but decided that it will not work at all. When i get a call i cannot accept the call as this app has to be running 100% of the time. Even if they advise to use only when in public i still cannot answer calls when in public. If i need to search in google or map for something and I am outside i cannot use google app too since it will make this app run at background. 
I give up using this app as it is more stressful to use this app. The developers & designers will need to think other ways instead of forcing it down our throat to use this app. ",en,    star rating for this app How could an app that was launched   days ago have    reviews with total rating of     be possible  Are these  reviewers  really giving review or they are just bumping up the rating score          why would the user want to keep this app open and on foreground  It means the user cannot use any other app at all  By using other app  it will close this app and render it unable to trace and track   They seriously need UX   UI expert to get the design right          i tried using this app for a few hours but decided that it will not work at all  When i get a call i cannot accept the call as this app has to be running      of the time  Even if they advise to use only when in public i still cannot answer calls when in public  If i need to search in google or map for something and I am outside i cannot use google app too since it will make this app run at background   I give up using this app as it is more stressful to use this app  The developers   designers will need to think other ways instead of forcing it down our throat to use this app  ,"Domain_Specific, Emotional, Privacy","stress, track, outsid, run, answer, render",0.06,Negative,0,0,1,1,0,0,0,1,0
557,4/5/20 17:20,1498276074,TraceTogether,sg,1.4,ErangaH,5,Try to make the app run in background,"Hello Team,

Highly appreciate your hard work on letting out this app out in time. Of course, there are technical issues that you need to find workarounds for. And most importantly as a person who lives in Singapore, this app makes me feel more secure than living in some other country with nothing at all to trace. Kudos to the Dev team ???? One suggestion: There will be developers who are willing to support your cause if you make your code publicly available."," Try to make the app run in background Hello Team 

Highly appreciate your hard work on letting out this app out in time. Of course  there are technical issues that you need to find workarounds for. And most importantly as a person who lives in Singapore  this app makes me feel more secure than living in some other country with nothing at all to trace. Kudos to the Dev team ???? One suggestion: There will be developers who are willing to support your cause if you make your code publicly available. ",en, Try to make the app run in background Hello Team   Highly appreciate your hard work on letting out this app out in time  Of course  there are technical issues that you need to find workarounds for  And most importantly as a person who lives in Singapore  this app makes me feel more secure than living in some other country with nothing at all to trace  Kudos to the Dev team      One suggestion  There will be developers who are willing to support your cause if you make your code publicly available  ,"Domain_Specific, Language, Location, Privacy, Socio_economic_Status","countri, technic, countri, singapor, secur, secur, import, run",0.181818182,Positive,0,0,1,0,0,1,1,1,1
560,4/4/20 13:42,1498276074,TraceTogether,sg,1.4,鸡蛋y,5,Try I beacon ?,"Since the bluetooth got the limitation that cannot run in backend, why not try iBeacon ?  I was writing one app using iBeacon that can run and send signals at backend .", Try I beacon ? Since the bluetooth got the limitation that cannot run in backend  why not try iBeacon ?  I was writing one app using iBeacon that can run and send signals at backend . ,en, Try I beacon   Since the bluetooth got the limitation that cannot run in backend  why not try iBeacon    I was writing one app using iBeacon that can run and send signals at backend   ,Domain_Specific,"run, signal",0.1,Negative,0,0,1,0,0,0,0,0,0
561,4/4/20 10:11,1498276074,TraceTogether,sg,1.4,simonlkl,1,Disconnect Bluetooth when in used,Disconnect my Bluetooth when on. Need keep always on cannot run in background for iphone - will not be as useful. On the move pple are surfing net etc., Disconnect Bluetooth when in used Disconnect my Bluetooth when on. Need keep always on cannot run in background for iphone - will not be as useful. On the move pple are surfing net etc. ,en, Disconnect Bluetooth when in used Disconnect my Bluetooth when on  Need keep always on cannot run in background for iphone   will not be as useful  On the move pple are surfing net etc  ,Domain_Specific,run,0.058823529,Negative,0,0,1,0,0,0,0,0,0
562,4/4/20 7:01,1498276074,TraceTogether,sg,1.4,Anonymous18101997,2,Having to run the app all the time,"I love the concept. I really do. But it is a pain to have it on in order to properly trace. I would like to do other stuff on my my phone while I am commuting, at work, eating, etc. 

Pretty sure many iOS users would share the same sentiment."," Having to run the app all the time I love the concept. I really do. But it is a pain to have it on in order to properly trace. I would like to do other stuff on my my phone while I am commuting  at work  eating  etc. 

Pretty sure many iOS users would share the same sentiment. ",en, Having to run the app all the time I love the concept  I really do  But it is a pain to have it on in order to properly trace  I would like to do other stuff on my my phone while I am commuting  at work  eating  etc    Pretty sure many iOS users would share the same sentiment  ,Domain_Specific,"run, order",0.076923077,Positive,0,0,1,0,0,0,0,0,0
564,4/4/20 3:31,1498276074,TraceTogether,us,1.4,Rdbor,5,Open source or license elsewhere?,Would it be possible to get this usable in other countries? Please make it available as soon as possible. I'm in the US, Open source or license elsewhere? Would it be possible to get this usable in other countries? Please make it available as soon as possible. I'm in the US ,en, Open source or license elsewhere  Would it be possible to get this usable in other countries  Please make it available as soon as possible  I m in the US ,"Language, Location","countri, countri",0.133333333,Positive,0,0,0,0,0,1,1,0,0
565,4/4/20 1:55,1498276074,TraceTogether,sg,1.4,CL SG,2,Great thought with lack of usability,"It is great to have a method to assist to contact tracing where time is crucial to identify people affected. But the effort seems to be counterproductive in iPhone by having the apps opened the whole time. For example, when I put the phone in my pocket, it would actually accidentally pressing other menu, or even going to other apps, and eventually the trace would not be working. This is a serious flaw, as even though we have more users, it doesn't translate into more data. Why can't we make the apps running in the background?", Great thought with lack of usability It is great to have a method to assist to contact tracing where time is crucial to identify people affected. But the effort seems to be counterproductive in iPhone by having the apps opened the whole time. For example  when I put the phone in my pocket  it would actually accidentally pressing other menu  or even going to other apps  and eventually the trace would not be working. This is a serious flaw  as even though we have more users  it doesn't translate into more data. Why can't we make the apps running in the background? ,en, Great thought with lack of usability It is great to have a method to assist to contact tracing where time is crucial to identify people affected  But the effort seems to be counterproductive in iPhone by having the apps opened the whole time  For example  when I put the phone in my pocket  it would actually accidentally pressing other menu  or even going to other apps  and eventually the trace would not be working  This is a serious flaw  as even though we have more users  it doesn t translate into more data  Why can t we make the apps running in the background  ,"Domain_Specific, Language, Privacy","translat, translat, data, identifi, translat, run",0.12,Neutral,0,0,1,0,0,1,0,1,0
566,4/4/20 0:06,1498276074,TraceTogether,sg,1.4,AKo-2018,1,Not comparable with Huawei phone,I installed on my Huawei phone but did not received the OTP code. Tried many times but it did not work., Not comparable with Huawei phone I installed on my Huawei phone but did not received the OTP code. Tried many times but it did not work. ,en, Not comparable with Huawei phone I installed on my Huawei phone but did not received the OTP code  Tried many times but it did not work  ,Domain_Specific,receiv,0.076923077,Neutral,0,0,1,0,0,0,0,0,0
568,4/3/20 9:36,1498276074,TraceTogether,us,1.4,bkev420,1,Not for USA,Can’t use my phone # to login. Stuck and can’t use app., Not for USA Can’t use my phone # to login. Stuck and can’t use app. ,en, Not for USA Can t use my phone   to login  Stuck and can t use app  ,Location,usa,0.142857143,Negative,0,0,0,0,0,0,1,0,0
571,4/1/20 23:49,1498276074,TraceTogether,sg,1.4,Reader000000,3,Remind. Gamification.,"Suggest posters be put up everywhere reminding people to open it. Eg. bus stops, MRT, hawker centers, taxis....

Some reward (NTUC voucher) for keeping it open like those what productivity tree growing app."," Remind. Gamification. Suggest posters be put up everywhere reminding people to open it. Eg. bus stops  MRT  hawker centers  taxis....

Some reward (NTUC voucher) for keeping it open like those what productivity tree growing app. ",en, Remind  Gamification  Suggest posters be put up everywhere reminding people to open it  Eg  bus stops  MRT  hawker centers  taxis      Some reward  NTUC voucher  for keeping it open like those what productivity tree growing app  ,Domain_Specific,"hawker, poster",0.076923077,Positive,0,0,1,0,0,0,0,0,0
573,4/1/20 13:35,1498276074,TraceTogether,sg,1.4,totallydisaster,3,Appreciate effort for the app,unsure how effective for me since i always have to run the app in the background or forgot to on the app when i am in crowded places., Appreciate effort for the app unsure how effective for me since i always have to run the app in the background or forgot to on the app when i am in crowded places. ,en, Appreciate effort for the app unsure how effective for me since i always have to run the app in the background or forgot to on the app when i am in crowded places  ,Domain_Specific,run,0.071428571,Positive,0,0,1,0,0,0,0,0,0
574,4/1/20 12:54,1498276074,TraceTogether,us,1.4,Krisflier,5,Good idea,Can this app be made available for USA?, Good idea Can this app be made available for USA? ,en, Good idea Can this app be made available for USA  ,Location,usa,0.166666667,Positive,0,0,0,0,0,0,1,0,0
576,4/1/20 8:24,1498276074,TraceTogether,gb,1.4,gfjfffujfdtjdyfgtyh,1,UK option,Not available outside Singapore. COVID19 is a worldwide problem and this app could help reduce spread once lockdown is lifted., UK option Not available outside Singapore. COVID19 is a worldwide problem and this app could help reduce spread once lockdown is lifted. ,en, UK option Not available outside Singapore  COVID   is a worldwide problem and this app could help reduce spread once lockdown is lifted  ,"Domain_Specific, Location","singapor, uk, reduc, outsid",0.25,Neutral,0,0,1,0,0,0,1,0,0
578,4/1/20 6:52,1498276074,TraceTogether,gb,1.4,simmy1959,5,Responsible people,Anyone who is a responsible human being who cares for there fellow humans should use this and get behind it to make our world a safer place to live and work corvid 19 is a massive killer has changed our world forever. Help try and regain freedom so we can try to rebuild so sort of normality . Please install, Responsible people Anyone who is a responsible human being who cares for there fellow humans should use this and get behind it to make our world a safer place to live and work corvid 19 is a massive killer has changed our world forever. Help try and regain freedom so we can try to rebuild so sort of normality . Please install ,en, Responsible people Anyone who is a responsible human being who cares for there fellow humans should use this and get behind it to make our world a safer place to live and work corvid    is a massive killer has changed our world forever  Help try and regain freedom so we can try to rebuild so sort of normality   Please install ,Domain_Specific,"killer, normal",0.060606061,Positive,0,0,1,0,0,0,0,0,0
580,4/1/20 5:49,1498276074,TraceTogether,sg,1.4,staelen,5,a non-intrusive way of staying safe,i like how it’s not transferring my data anywhere else other than my mobile. tho i hope i dont ever need to use the data at all! ????, a non-intrusive way of staying safe i like how it’s not transferring my data anywhere else other than my mobile. tho i hope i dont ever need to use the data at all! ???? ,en, a non intrusive way of staying safe i like how it s not transferring my data anywhere else other than my mobile  tho i hope i do not ever need to use the data at all       ,Privacy,data,0.058823529,Positive,0,0,0,0,0,0,0,1,0
581,4/1/20 3:24,1498276074,TraceTogether,us,1.4,happyuser13245,5,Interesting idea,"Nice that this app can help me be informed if I’m near a COVID-19 case, while still protecting my privacy. Very useful. We need to fight this horrible disease together.", Interesting idea Nice that this app can help me be informed if I’m near a COVID-19 case  while still protecting my privacy. Very useful. We need to fight this horrible disease together. ,en, Interesting idea Nice that this app can help me be informed if I m near a COVID    case  while still protecting my privacy  Very useful  We need to fight this horrible disease together  ,Privacy,"privaci, protect",0.105263158,Positive,0,0,0,0,0,0,0,1,0
582,3/31/20 19:17,1498276074,TraceTogether,ro,1.4,thecr15t1,5,Good idea!,I hope that this application will be available in Europe as soon as possible....or way not in România!!!, Good idea! I hope that this application will be available in Europe as soon as possible....or way not in România!!! ,en, Good idea  I hope that this application will be available in Europe as soon as possible    or way not in Rom nia    ,Domain_Specific,applic,0.090909091,Positive,0,0,1,0,0,0,0,0,0
583,3/31/20 11:28,1498276074,TraceTogether,gb,1.3,KSG28,1,Problem entering phone number,"I live here in United Kingdom, and our country code is +44
Problem is that the all has a default number of +65
And the app will not allow me to change this to +44 for use in UK
Feeling sad that I cannot use this very useful app
Why is this not designed to work in every country around the world, I believe it could help in stopping the spread of that deadly virus"," Problem entering phone number I live here in United Kingdom  and our country code is +44
Problem is that the all has a default number of +65
And the app will not allow me to change this to +44 for use in UK
Feeling sad that I cannot use this very useful app
Why is this not designed to work in every country around the world  I believe it could help in stopping the spread of that deadly virus ",en, Problem entering phone number I live here in United Kingdom  and our country code is     Problem is that the all has a default number of     And the app will not allow me to change this to     for use in UK Feeling sad that I cannot use this very useful app Why is this not designed to work in every country around the world  I believe it could help in stopping the spread of that deadly virus ,"Domain_Specific, Emotional, Language, Location","sad, countri, countri, uk, enter, unit",0.162162162,Neutral,0,0,1,1,0,1,1,0,0
584,3/31/20 7:00,1498276074,TraceTogether,it,1.3,L.B6,1,No,"Negativo, app non disponibile per i numeri Italiani , tentativo fallito!!",No Negative  app not available for Italian numbers  attempt failed !!,it,No Negative  app not available for Italian numbers  attempt failed   ,Language,italian,0.142857143,Negative,0,0,0,0,0,1,0,0,0
587,3/30/20 11:59,1498276074,TraceTogether,tr,1.3,AselmanK,5,Kolay ve hafif,Telefonu fazla yormadan yapması gerekeni sizin veri güvenliğinizi de ön planda tutarak gerçekleştiren bir uygulama. Kullanıp kullanmamak size kalmış fakat çevrenizde vaka çıktığı zaman hızlıca bildiri alabileceğiniz başka bir çözüm yok henüz.,Easy and light An application that performs what it needs to do without too much strain on the phone  keeping your data security at the forefront. Whether you use it or not is up to you  but there is no other solution that you can quickly get notifications when there are cases around you.,tr,Easy and light An application that performs what it needs to do without too much strain on the phone  keeping your data security at the forefront  Whether you use it or not is up to you  but there is no other solution that you can quickly get notifications when there are cases around you ,"Domain_Specific, Emotional, Privacy","strain, data, secur, secur, perform, applic",0.285714286,Negative,0,0,1,1,0,0,0,1,0
588,3/30/20 11:54,1498276074,TraceTogether,id,1.3,hery ghandhor,4,Tidak bisa di pakai,"Kok masih pakai +65 ya, ga bisa d pakai di Indonesia Pak. 
Mohon diperbaiki.

————————————————————

Hii Dev Team, 
Thanks for your response.
Now I know that application can not use in my country.","It can't be used How come it's still using +65  can't it be used in Indonesia Sir.
Please fix it.

————————————————————

Hii Dev Team 
Thanks for your response.
Now I know that application can not use in my country.",id,It can t be used How come it s still using      can t it be used in Indonesia Sir  Please fix it                         Hii Dev Team  Thanks for your response  Now I know that application can not use in my country ,"Domain_Specific, Language, Location","countri, indonesia, countri, applic",0.222222222,Positive,0,0,1,0,0,1,1,0,0
590,3/30/20 4:06,1498276074,TraceTogether,kz,1.3,Mukhagali,4,Mukhagali,"Dear developers , we can’t activate it in Kazakhstan, since it asks to Singapore’s local phone number (+65) and we can’t select other countries . For example in KZ we use +7. Can you change it , since it was made valuable to globe?", Mukhagali Dear developers   we can’t activate it in Kazakhstan  since it asks to Singapore’s local phone number (+65) and we can’t select other countries . For example in KZ we use +7. Can you change it   since it was made valuable to globe? ,en, Mukhagali Dear developers   we can t activate it in Kazakhstan  since it asks to Singapore s local phone number       and we can t select other countries   For example in KZ we use     Can you change it   since it was made valuable to globe  ,"Language, Location","countri, kazakhstan, countri, local, singapor",0.238095238,Positive,0,0,0,0,0,1,1,0,0
591,3/29/20 18:36,1498276074,TraceTogether,de,1.3,Korsar3479,2,World wide service ?,"Is there any posibility to share this service world wide because this virus is affecting all of us!?

I would give you five stars when you will deliver your service early than our developers will do i.e in Germany!"," World wide service ? Is there any posibility to share this service world wide because this virus is affecting all of us!?

I would give you five stars when you will deliver your service early than our developers will do i.e in Germany! ",en, World wide service   Is there any posibility to share this service world wide because this virus is affecting all of us    I would give you five stars when you will deliver your service early than our developers will do i e in Germany  ,"Domain_Specific, Location","germani, servic, servic",0.130434783,Positive,0,0,1,0,0,0,1,0,0
593,3/28/20 21:41,1498276074,TraceTogether,be,1.3,Pokesis,1,Telefoon intikken lukt niet.,Kan mijn mobiele telefoon nr niet intikken. Er is 1 nr tekort. Dus kan ik niets doen met die app want ik kan niet verder. Kan de code niet ontvangen.,Phone cannot be typed. Can't enter my mobile phone number. There is 1 no shortage. So I can't do anything with that app because I can't continue. Unable to receive the code.,af,Phone cannot be typed  Can t enter my mobile phone number  There is   no shortage  So I can t do anything with that app because I can t continue  Unable to receive the code ,Domain_Specific,"enter, receiv",0.142857143,Positive,0,0,1,0,0,0,0,0,0
594,3/28/20 15:50,1498276074,TraceTogether,us,1.3,Htet Ko Naing,4,Can not use It,"Now i use in MYANMAR. 
I need a Code 
I can not choose Region ( +95 ) 
How can i change My country Code +95 ?"," Can not use It Now i use in MYANMAR. 
I need a Code 
I can not choose Region ( +95 ) 
How can i change My country Code +95 ? ",en, Can not use It Now i use in MYANMAR   I need a Code  I can not choose Region          How can i change My country Code       ,"Language, Location","countri, countri, myanmar, region",0.4,Neutral,0,0,0,0,0,1,1,0,0
596,3/28/20 13:05,1498276074,TraceTogether,us,1.3,Elenovember,4,Country code can not choose,"I got a problem area code can not change. Not global yet, right?", Country code can not choose I got a problem area code can not change. Not global yet  right? ,en, Country code can not choose I got a problem area code can not change  Not global yet  right  ,"Language, Location","countri, countri, area",0.272727273,Negative,0,0,0,0,0,1,1,0,0
597,3/28/20 5:50,1498276074,TraceTogether,au,1.3,Shunleleaung,3,Cannot change country number,I cannot even log in because it keeps showing +65 which is Singapore number. I am in Australia and it should be +61. I cannot change it no matter how much I try., Cannot change country number I cannot even log in because it keeps showing +65 which is Singapore number. I am in Australia and it should be +61. I cannot change it no matter how much I try. ,en, Cannot change country number I cannot even log in because it keeps showing     which is Singapore number  I am in Australia and it should be      I cannot change it no matter how much I try  ,"Language, Location","countri, australia, countri, singapor",0.266666667,Neutral,0,0,0,0,0,1,1,0,0
600,3/27/20 14:02,1498276074,TraceTogether,sg,1.3,amosyeow,3,To add in fixtures,"It will be good to add on two fixtures 
Optional
1) to check in ur location manually 
2) to turn on ur location (similarly to iPhone location , ) 
It can help narrow down to source"," To add in fixtures It will be good to add on two fixtures 
Optional
1) to check in ur location manually 
2) to turn on ur location (similarly to iPhone location   ) 
It can help narrow down to source ",en, To add in fixtures It will be good to add on two fixtures  Optional    to check in ur location manually     to turn on ur location  similarly to iPhone location      It can help narrow down to source ,"Domain_Specific, Privacy","locat, locat",0.1,Positive,0,0,1,0,0,0,0,1,0
601,3/27/20 12:20,1498276074,TraceTogether,id,1.3,Wewewe jelek,1,Gak bisa pake no +62,Asallamualaikum pak selamat malam ini aplikasi gak bisa daftar pakai nomor indo biasanya pakai nomor malaysia aja.,You can't use the number +62 Asallamualaikum  sir  good night  the application can't register using Indo numbers  usually just use Malaysian numbers.,id,You can t use the number     Asallamualaikum  sir  good night  the application can t register using Indo numbers  usually just use Malaysian numbers ,Domain_Specific,applic,0.066666667,Positive,0,0,1,0,0,0,0,0,0
